,user,user_profile,date_review,title,rating,type_visit,num_contributions,review
310,Georges,georoche43,8 décembre 2019,Un endroit simple et vraiment accueillant,4.0,none,28,"Excellent accueil. Avec une grande amabilité et le sourire. Personnel très présent pour nous recevoir, nous installer, nous servir. Patronne charmante et n'hésitant pas à bavarder agréablement lorsque nous allons quitter l'établissement."
311,Guillaume,GuillaumeU63,8 décembre 2019,Un bon resto pour une bonne soirée,5.0,none,16,"Une ambiance sympa et agréable tout comme le personnel.
Très bonne cuisine et de bon plats. 
Je recommande sans problème"
312,Natou74,Natouj74,8 décembre 2019,Très bon accueil et très bon repas,4.0,family,46,"Bonne ambiance dans un cadre sympa et typique 
Repas très bon surtout la quenelle qui était excellente"
313,famo69,famo69,30 novembre 2019,Cuisine et lieu au diapason!Parfait,5.0,none,29,"Cuisine et lieu au diapason! Tout est parfait
De l’accueil à la qualité des plats et au charme de l’endroit
Bravo!
"
314,Etienne,224etiennen,29 novembre 2019,Super,5.0,couples,37,"Super bouchon Lyonnais avec un accueil convivial et détendu.
Le service est parfait et la cuisine excellente.
Que du positif "
315,Dubois E,duboise508,22 novembre 2019,Super soirée et super déjeuner,5.0,friends,22,"Une soirée beaujolais avec une superbe ambiance, un menu copieux mais délicieux fait maison et des spécialitées lyonnaise! 
Un repas de midi entre collègues super avec un accueil familial qui fait plaisir! Les amiénoises reviendront avec plaisir! Merci! 😊"
316,DDDDDDDavid,DDDDDDDavid,21 novembre 2019,"Une offre de cuisine locale,",4.0,none,114,"Une offre de cuisine locale, à la carte ou au menu (sont un menu enfant), après un accueil chaleureux et plein d’humour. Le cadre est typique et propre. Le restaurant est situé dans un quartier ancien très intéressant. "
317,cgrda,cgrda,18 novembre 2019,Très bon,4.0,family,156,"Les plats sont délicieux, de la vrai cuisine lyonnaise, c’est copieux et bon rapport qualité/prix. 
Les serveurs sont sympathiques, cependant, la personne qui est à l’entrée est exécrable, vraiment désagréable et les tables sont très collés (on ne peut pas passer entre sa table et celle du voisin) et il y a beaucoup de bruit, on ne se rends pas trop parler."
318,globtrotteuse,globtrottreuse,18 novembre 2019,une institution,4.0,none,164145,"Une très bonne adresse authentique, à la décoration stylée et typique, au service professionnel, le tout dans une ambiance très sympa
on vient de loin pour découvrir et on revient volontiers"
319,Alexandre R,U3042QIalexandrer,13 novembre 2019,Très copieux,4.0,family,53,"Alors pour ma part j'ai beaucoup apprécié ce bouchon lyonnais. Des plats très généreux et très bons, pour moi qui suis gourmand et friand de la cuisine lyonnaise.
Ma sœur et ma mère ont quand à elle eu plus de mal à finir leur assiette, pour mon bon plaisir haha."
320,Badoit,badoit42,13 novembre 2019,Bon rapport qualité / prix,4.0,family,351,"Bon rapport qualité / prix pour Lyon
Ce n’est pas une arnaque à touristes

Plats lyonnais très bons. Même le côte du Rhône en pot est très correct.

Décor sympathique et ambiance de bouchon. Si vous ne connaissez pas ce type de restaurant, il ne faut pas venir pour un dîner en amoureux, car vous pouvez partager votre table avec un autre couple

Réservation conseillée
Il y a la queue devant le restaurant

Personnel sympathique

"
321,Emmabouille,EmmanuelleR989,10 novembre 2019,Ambiance typique mais repas moyen,3.0,friends,26,"Déco/concept sympa et typique d’un bouchon.
Accueil chaleureux 
Repas correct mais sans plus, aucun effort de présentation (on se croirait presque à la cantine, les plats ne nous donnent pas envie de saucer) 
Rapport qualité / prix moyen "
322,Gérald B,355g_raldb,9 novembre 2019,Super Moment,5.0,none,25,"Nous avons été dans ce bouchon par recommandation d'un ami, et bien nous ne regrettons pas d'y être aller, cuisine simple, goûteuse et excellente un accueil au top et le concept de partager la table avec d'autres gens est d'une convivialités déconcertante. 
Je recommande vivement."
323,anth0069,anth0069,5 novembre 2019,Super endroit,4.0,family,10,"Un vrai bouchon Lyonnais! Un accueil sympa et de la super bouffe.
Lieu atypiques déco à la lyonnaise.
Super.
Un petit bémol pour le serveur qui râle quand on lui fait remarquer qu'il a oublié quelques chose."
324,MANU06_11,MANU06_11,5 novembre 2019,Une bonne soirée,4.0,none,89,Un service sympathique et très professionnel. Des plats de très bonne qualité et très copieux. La salle en sous sol est très agréable. Le seul bémol est le bruit quand la salle se remplit. Dommage car on ne s'entend pas parlé. Attention vous devez réserver plusieurs jours en avance
325,Mary T,Maaryth,3 novembre 2019,Super!,5.0,family,415,"Velouté de lentilles très bon, terrine de campagne généreuse et gratin de ravioles juste... EXCELLENT!

Endroit très chaleureux, équipe joviale, on s’y sent bien!

"
326,Ludo S,ludoS6363,3 novembre 2019,Le cadre est typique des bouchons,4.0,none,32,"Le cadre est typique des bouchons lyonnais, rien à voir avec certaines usines de la rue St Jean. L’accueil est sympa,pas d’attente et très bien dîné 

chaleureux,paspasd’attente ,très bonne organisation et "
327,MMi76,MMi76,1 novembre 2019,très décevant,2.0,none,104,"je ne comprends pas son bon classement...
seul l'humour de la vitrine vaut le coup
ensuite l'humour répétitif, et déplacé des garçons, les plats quelconques (cuisse de canard mal cuite, potée de veau malingre une fois écarté le gras, pot de beaujolais au mieux de différentes provenances de la cee, tarte aux pralines ratée
seule l'addition est copieuse
à éviter!"
328,Mot R,motr2016,27 octobre 2019,"Usine a touristes, cuisine d'assemblage",2.0,none,4,"Venu en famille, l'humour lourd des serveurs va de paire avec la lourdeur des plats et de la note. Passez votre chemin..."
329,Didier C,didierc598,26 octobre 2019,Incontournable,5.0,couples,11,"A faire absolument. 
Ambiance brasserie avec un service irréprochable avec une attention apportée au client pendant tout le repas."
330,Isi853,Isi853,26 octobre 2019,Sans hésiter !,5.0,family,150,"Excellent accueil, nous n’avions pas réservé ( ce que je vous conseille vivement de faire vu l’affluence ! ) et le chef de salle a fait dresser une table supplémentaire pour nous . Les mets typiques d’un bouchon sont délicieux et le service a été impeccable ! Atmosphère un peu bruyante mais c’est aussi ce qui fait le charme ! "
331,Roxane B,roxanebrd,25 octobre 2019,N'hésitez plus,4.0,none,4,"Ce resto est tout à fait fidèle aux avis que vous pouvez trouver sur cette page, le service est top, les plats sont copieux, de qualité et typiques de la région. Je suis lyonnaise et pourtant j'ai rarement l'occasion de manger des plats d'ici aussi bons. 
Ce n'est pas un restaurant entrée de gamme au niveau du prix mais vous en avez pour votre argent. 

Je recommande à 100%."
332,Alain B,abrevet44,18 octobre 2019,Très bon bouchon Lyonnais typique,5.0,none,32,"Belle ambiance, personnel très agréable et amusant, supers produits frais et très bien préparés, bons vins et tarifs vraiment raisonnables vu l'emplacement de cet établissement. Je conseil fortement !"
333,Gael G,773gaelg,18 octobre 2019,superbe adresse,5.0,family,16,"de passage à Lyon, après plusieurs minutes à chercher une adresse sympa , nous avons trouvé cet adresse ,"" LES LYONNAIS "" nous avons passer une super moment ( accueil, service et repas parfait)rien à dire je recommande fortement "
334,CLP 34,clp34280,17 octobre 2019,bon bouchon,4.0,none,18,"Nous y sommes allés en juin, sous la canicule,dîner en terrasse sur la chaussée (attention au démarrage en côte des voitures au feu, odeurs de pot d'échappement). La devanture très sympa avec les phrases marquées sur les vitres. Menu entrée plat dessert dans les prix, un régal, salade lyonnaise et /oeuf meurette, gratin ravioles du dauphiné, et baba /salade de fruits. Note un peu chère. Nous avons voulu y retourner samedi 12 oct. On appelle en début de soirée vers 19h30 pour réserver, on nous répond sèchement y'a deux tables de libres, pas de réservation faut venir et vous verrez bien... traverser lyon pour 2 tables?... Pas de merci ni d'au revoir, la tonalité te fait comprendre que le très cher monsieur malpoli a raccroché!"
335,IB,brln2014,16 octobre 2019,convivial et typique,5.0,none,121,"Cadre authentique et vivant où l'on retrouve tous les plats typique lyonnais. Réservation à l'avance et jusqu'à 20 h 30 (environ) plus de réservation après cette heure, il faut faire la queue et attendre qu'une table se libère.
Bon St joseph pris au pot ! Plat copieux."
336,sandrine g,sandtotoche,15 octobre 2019,très bon moment,5.0,none,384,"Bouchon de qualité. Carte simple et typique d'un bouchon. Oeufs meurettes excellents. Très bon Saint joseph. Nous avons déjeuné dans la salle du bas: les tables sont proches les unes des autres, c'est bruyant, c'est sympa ! Nous avons passé un très bon moment."
337,Gigi,GillesC907,10 octobre 2019,Bonne adresse,4.0,business,56,"Endroit convivial et typique d un bouchon lyonnais.
Service et plats bons.
Une adresse sûre sur Lyon pour manger des plats typiques."
338,lezhenry,lezhenry,9 octobre 2019,Un authentique bouchon Lyonnais,5.0,none,54,"Pour terminer notre séjour à Lyon, nous avons réservé dans un authentique bouchon Lyonnais, ils ne sont pas si nombreux 22 si on en croit le site officiel. Parce que à Lyon le bouchon est au sommet des bouteilles mais aussi à tous les coins de rue pour appâter le chaland touristique, mais avec des fortunes gustatives fort désappointantes le plus souvent. Aussi je vous recommande de vous renseigner avant. Dans tous les cas, pour ce qui concerne ce restaurant vous ne vous trompez pas. Tout est à la hauteur des attendus, une jolie salle en sous-sol voûtée et en pierre avec une décoration typique. Quand à ce qui est à la carte comme aux menus, abordables par ailleurs, tout est fait maison et le service plein d’humour et professionnel. Vous pouvez y aller les yeux fermés, mais il est fort prudent de réserver."
339,Olivier K,ol54370,8 octobre 2019,Ambiance conviviale d'un bouchon,5.0,none,6,"Atmosphère chaleureuse,tables serrées, serveurs vous mettant à l'aise, attentionnés et pleins d'humour.
Plats traditionnels de bouchons, de bonne qualité, carte des vins un peu succincte mais coteaux du lyonnais excellent."
340,Lisa,lisa712f,6 octobre 2019,très bonne cuisine,4.0,family,2,La nourriture est vraiment très bonne mais le service est super long et le serveur pas très agréable.
341,bene140,bene140,1 octobre 2019,Typique bouchon lyonnais - Maître restaurateur,5.0,friends,341,"Diner entre collègues.
Ce bouchon lyonnais typique bénéficie du label de maître restaurateur, gage d'une cuisine fait maison.
Très bon accueil, la carte est suffisamment garnie pour contenter tous les goûts.
Et quand les assiettes arrivent, tout y est : quantité et goût. 
Bon conseil pour le choix du vin.
Service agréable.
Comptez une trentaine d'euros par personne.
Je vous recommande ce restaurant, pensez à réserver car il se remplit vite même en semaine."
342,JD-JLD,JD-JLD,30 septembre 2019,vrai bouchon lyonnais,5.0,none,21,"service impécable et agréable; bonne cuisine lyonnaise
Ambiance du bouchon lyonnais typique où l'on rencontre des gens sympatiques"
343,Delphine T,700delphinet,28 septembre 2019,Un vrai bouchon lyonnais labellisé,5.0,none,19,"La cuisine est maison et l'ambiance très conviviale. Pas de table isolée, vous partagez une grande table avec d'autres client, et vous pouvez faire de belles rencontres tout en dégustant leur cuisine simple, mais délicieuse."
344,A. BENAIS,Abenais,24 septembre 2019,Très bonne cuisine. Mais c'est tout!!!,3.0,couples,1,"Nous nous sommes rendus dans ce bouchon un midi. Nous avons été ravis de la cuisine mais le service fut déplorable !
Un serveur pas du tout agréable, nous avons été oublié deux fois. Il y a eu une erreur dans les desserts et personne ne s'est excusé. Je suis très déçue et ne recommande pas, ou vous souhaite de tomber sur un autre serveur !"
345,mélanie b,m_lanieb972,18 septembre 2019,Très bon,4.0,none,3,"Déjeuner à Lyon 
beaucoup de monde, mais on nous a trouvé une place.
Les quenelles étaient délicieuses et les menus enfants très bons... 
Un bon moment !"
346,nad,nadegec4,17 septembre 2019,Très bien,4.0,friends,152,"Repas très bon et copieux. 
Le cadre est très agréable. 
Les serveurs très sympas et souriants.
J'y retournerai avec plaisir. "
347,Georges René c,petitange0656,12 septembre 2019,Idéal,4.0,none,118,nous avons pris le menu à 29€70 nous avions réservé ( chaise roulante pliante ) Découverte de la cuisine lyonnaise accueil correct Pour finir après le menu j'ai pris un rhum arrangé ...facilite la digestion!! Situé dans le vieux Lyon et pas loin de l'église Saint Jean et du musée miniature et cinéma
348,Nathalie C,116nathaliec,8 septembre 2019,Un bouchon incontournable,5.0,none,118,"Invitée par ma fille pour mon anniversaire, nous avons été très bien accueillis. Service impeccable, beaucoup d’humour tout en étant correcte , ce que j’apprécie. En plat principal , gâteaux de foie de volaille avec riz et carottes vichy , très copieux , perso j’aurais aimé plus le goût corsé du foie de volaille . En dessert, baba au rhum chantilly, énorme ! Et pour ma fille , glace artisanale coussin lyonnais et pralines , excellentes . Un pot de ST Joseph, des grattons  , une note plus que correcte , la déco top et lieux très propre .Nous avons passé un agréable moment .  Je recommande ."
349,copysand,copysand,6 septembre 2019,bon bouchon,4.0,none,318,"bien situé  avec une jolie salle bien décoré , bon accueil , bon service , ambiance d'un bouchon , bonne restauration faite maison ."
350,rico r,Django2308,6 septembre 2019,bonne cuisine et très bon service...,4.0,none,67,"nous y sommes allé avant de rentrer de vacances.
Déjà, l'accueil est très sympathique. Notre serveur attitré avait beaucoup d'humour...
niveau entrée, la terrine était très bonne, l'assiette lyonnaise aussi (persillé excellent!!!). Ensuite, ma cherie avait pris le parmentier de joue...la viande était ultra fondante, et vraiment bien aromatisée (marinade parfaite) .. moi je voulais absolument tester le tablier, chose que j ai pu faire donc...
j ai trouve cela bien sur ultra calorique.. normal, mais par contre, un peu sec.. je ne sais pas si le plat est comme ca, je n en ai jamais mangé d'autre... 
donc nous sommes ressorti rassasié..et pour un prix raisonnable. Nous avions pris la aussi un pot de morgon, et qui était par contre ici très correct... 
Donc je recommande sans hésiter... pensez à réserver par contre.. je l ai fait la veille c etait juste..."
351,Mag,M_A_G_38_1234,6 septembre 2019,un vrai bouchon lyonnais !,4.0,none,165,"Grattons, quenelle, .... un vrai régal ! des serveurs locaux, qui savent de quoi ils parlent ! top !"
352,Mero67,CDB67,30 août 2019,Cuisine décevante,2.0,friends,5,Le service est à revoir et la cuisine n’est pas à la hauteur!  Pas la peine d’aller au resto pour ça. Vous ferez sans doute mieux chez vous !
353,Alex,Alexis-69-77-,28 août 2019,PASSEZ VOTRE CHEMIN...,1.0,couples,7,"Je rejoins l’avis précédent de Veroon269... Mon amie et moi nous sommes rendus devant l’établissemment et avons attendu pas moins de 5 minutes dans l’ignorance la plus totale du serveur puisqu’il nous avait tout à fait vus, avant que le « serveur » daigne nous adresser la parole... Et encore j’ai du engager la conversation quand il nous est passé devant car il continuer de nous ignorer. 

Nous demandons donc une table pour 2 à l’extérieur, il nous dit qu’il a une table dedans (des tables étaient libres dehors) et s’en va de nouveau, comme si nous adressait la parole le faisait ch***.

Très très mauvaise impression, pas du tout professionnels, si marcher ne vous fait pas peur RDV au « LE VIEUX LYON », dans la rue St-JEAN !"
354,veroon269,veroon269,28 août 2019,Quelle déception !,1.0,couples,18,"Au regard des avis, nous pensions passer une agréable soirée avec des mets de qualité. Nous avons été déçus sur toute la ligne. Le serveur se permet des blagues salaces (lourdes au possible), comme si le fait de dîner dans un bouchon pouvait justifier ce manque de classe. Les plats apportent peu de réconfort car ils sont quelconques. Un jeune couple s’est vu réprimander car le bébé a poussé quelques petits cris. Ils ont été pressés de partir sans même terminer leur dessert. Choquant. Enfin, l’addition est désarmante pour une soirée de piètre qualité que nous avons finie dans un endroit bien plus sympathique. Une chose est sûre : les lyonnais ne sont pas dignement représentés dans cet attrape touristes."
355,aurore b,auroreb285,26 août 2019,on s'est régalé,5.0,none,23,"Petit bouchon trouvé grâce à nos amis de tripadvisor. On y est allé en toute confiance du coup et comme d'habitude on est jamais déçu. Cuisine et accueil impeccable ! Rien à dire, c'est une bonne adresse"
356,JLV19,JLV1959,24 août 2019,Bouchon pas trop touristique....,4.0,family,400,"Avec un accueil sympathique, une carte bien locale y compris le tablier de sapeur et une ambiance douce et nonchalante.
Agréable pour une déjeuner d’été improvisé.
Bravo pour le menu et le service "
357,Julie G,juliegC7026OT,22 août 2019,Bon bouchon lyonnais,4.0,none,21,"Bouchon lyonnais avec un bon rapport qualité-prix. Les produits sont de qualité. Le service est rapide et efficace mais les serveurs ne montrent pas d'intéret particuliers aux clients.
Parfaitement situé dans le vieux Lyon, décoration originale.
Je recommanderais ce bouchon, c'est un bon restaurant mais pas exceptionnel."
358,Patrice R,456patricer,21 août 2019,De passage à Lyon,4.0,none,30," belle expérience . A part la rosette, nous ne connaissions pas la cuisine Lyonnaise. le plaisir a été au rdz. De nombreux plats proposés donc difficile pour nous de choisir.  Cependant, nous avons été bien conseillés et nous remercions au passage la jeune femme qui nous a servi  . Son choix a été le notre et nous n'avons pas regretté . Le cadre est très sympatrique dans la pure tradition . Nous conseillons vivement ce Bouchon  "
359,ntrocell,ntrocell,18 août 2019,Cauchemar en service !,1.0,family,26,"Sur ce message je ne viens pas apporter de critique négative sur la gastronomie proposée par le bouchon (quand bien même cette dernière reste sans effet particulier. Nous avons fait des bouchons, labellisés, bien meilleurs) mais je viens prévenir tous les parents qui souhaitent partager un moment convivial en famille ! Le panneau à l’entrée du restaurant est très significatif ! Laissez de côté le ton humoriste car au final il dit vrai !
Pour l’histoire :  famille de 2 adultes + 1 fille de 5 ans + 1 bébé d’un an à peine. Disciplinés, nous avions réservé une table pour 19:30 Max ! Déjà au téléphone nous avons compris qu’il fallait être aux pas !
Arrivés à l’heure, nous avons patienté plus de 30 min avant que quelqu’un daigne nous donner un intérêt. Le patron commence à m’interroger à savoir si je n’ai pas un problème car mon accent n’est pas de la région (je suis lozerienne) ??!! Première approche plutôt bizarre... au moment de la commande le serveur commence à faire un humour plus que dépassé sur la quenelle lyonnaise (elle est grosse, elle chaude...) devant notre fille,  bref il en fait trop (limite vulgaire). Il se permet même de critiquer son patron... bref un « show » bien raté ! Et 
pour la première fois de notre vie nous nous sommes sentis attaqués car le serveur nous demande de faire taire notre bébé car il fait trop de bruit ! Ha ok notre fils d’1 an, plein de vie, participe au dîner en goûtant la « fameuse » quenelle et son riz collant et cela dérange qui ? Ben les restaurateurs bien entendu ! Les personnes autour de nous étaient très gênées du commentaire déplacé. Nous nous empressons de terminer ce repas et le patron en rajoute une couche au moment de payer la note et THE note !
Alors très chers parents, oubliez ce restaurant car 1. La gastronomie ne réveille pas les papilles et 2. nos enfants ne sont vraiment pas les bienvenus ! Une honte en terme de relation client et de qualité de service PS : vous verrez dans d’autres commentaires ci-dessous que ce n’est pas la première fois mais quand ça tourne, pourquoi changer ? Chers « touristes », à bon entendeur. "
360,sirocco047,sirocco047,18 août 2019,Un bon bouchon,4.0,couples,5,"A la recherche d'un bon bouchon sans préparation à 13h . Quelques recherches rapides sur internet dans ce quartier du vieux Lyon et nous éliminons les pièges touristes que nous sommes ... Nous tombons donc sur Les Lyonnais.
Et nous n'avons pas été déçus, les avis sont cohérents. Quenelles pour madame et andouillettes pour monsieur d'un très bon niveau. Le coulant au chocolat est excellent. Le sorbet maison citron basilique avec une salade de fruit nickel également. Seul bémole l'entrée saucisson briochet aurait pu être plus chaud.
Rien à redire côté service. Avec le côté théâtrale, humour !
"
361,Jorry,RollinG6,18 août 2019,Manque de professionnalisme,2.0,friends,15,"Voilà 2 fois que je vais dans ce restaurant. Si j’y suis retourné une seconde fois c’est que j’avais été totalement satisfait. Mais hier cela s’est déroulé différemment. Le bouchon « Les Lyonnais » cuisinent des produits de qualité, c’est un fait. Mais voyez-vous il ne suffit pas de s’approvisionner des meilleurs produits de la région pour être un grand restaurant et hier en fut un bel exemple.
Nous avons pris un « St Joseph Deschants » de chez Chapoutier (40€), le vin est arrivé trop chaud. Nous l’avons précisé au serveur qui n’a même pas relevé. Nous lui avons demandé par la suite un sceau de glace afin de le faire descendre en température. Je sais ce n’est pas très « classe », mettre un excellent vin rouge dans un sceau à glace,  mais ce qui l’est encore moins c’est de ne pas conserver le vin destiné aux clients dans un endroit prévu à cet effet (cave de service)...
Concernant la nourriture ce ne fut guère mieux. Les 2 enfants de mes amis ont pris un menu enfant composé d’un steak haché. Première erreur, le serveur ne demande pas la cuisson. Les steaks hachés arrivent, l’un est saignant et l’autre est trop cuit. Le steak haché trop cuit n’avait bien entendu plus aucun goût. Cette seconde erreur m’amène à me poser 2 questions: ces 2 steaks bien que commandé et servi en même temps n’ont, de toute évidence, pas été cuit au même moment. 
-Quand a été cuisiné ce steak?
- Etait-il propre à la consommation au moment d’être servi?
Pour ma part j’ai pris une salade lyonnaise composé de lardons FROIDS, a bon entendeur..."
362,Patrick H,patrickhT6330ED,18 août 2019,Une bonne adresse,5.0,family,13,Déjeuner le midi du 15 août Restaurant plein il restait 3 places sur une table à côté d un couple sympathique. Un serveur qui fait le show et une cuisine traditionnelle saucisson brioché et quenelle de brochet. Un moment agréable.
363,Canissallio,Canissallio,17 août 2019,Nature et naturel,5.0,couples,214,"Cela fait plusieurs fois que nous venons dans cet établissement. Le show et dans la salle et dans l’assiette. De l’humour et l’amour de la cuisine lyonnaise. On a passé un super moment autour de plat lyonnais. Quenelle au top et œufs meurette excellents. Service et accueil au top de la part de l’ensemble du personnel.
Merci pour ce bon moment. "
364,Fifille54,Fifille54,16 août 2019,Bouchon sympa,4.0,couples,176,"De l’humour plein les murs, service pince sans rire comme j’aime, filet mignon, quenelle et tarte aux pralines au menu tout à fait corrects pour moi, n’ayant pas encore de quoi comparer, assis à une grande table commune: l’ambiance y est!!! Ce fut un dîner fort sympathique.:-)"
365,Anne G,annegL3219TJ,15 août 2019,Bon mais service décevant,3.0,none,59,"Au départ, le service a été correct avec de bons plats. 
Par contre après avoir demandé par trois fois la carte des desserts et une attente très longue, nous sommes partis manger notre dessert ailleurs.
Très déçus quand même... "
366,Didier R,373didierr,12 août 2019,Décevant,3.0,couples,64,Pour un restaurant qui affiche le macaron  « bouchon » on est en droit de s’attendre à mieux. L’accueil et le service sont agréable mais la qualité n’est pas au RDV. 
367,Alain MYA,ALAINM6937,12 août 2019,Une belle découverte sans risque,4.0,none,23,"Invité par mon beau-frère venant de Belgique, j'ai pu découvrir ce bouchon qui est en dehors du circuit classique de la rue St Jean. Mais vu l'affluence dans la rue, ce bouchon n'a pas besoin de publicité. Il faut bien sûr réserver, mais en respectant l'horaire, nous avons été accueilli par le patron, souriant, compréhensif, qui nous a placé dans la salle en partageant une table de 8. Repas du menu, avec vin et apéro. On s'en sort pour 40€ environ. Les plats conformes à l'attente (Quenelle, andouillette, ravioles..). Bonne ambiance, service efficace et les mets sans reproche. A découvrir"
