,user,user_profile,date_review,title,rating,type_visit,num_contributions,review
968,Cyril C,257cyrilc,12 juin 2016,Que du positif !,5.0,friends,49,"Un cadre excellent une ambiance au top :) 
De passage sur Lyon avec un pote qui m'a fait découvrir ce bouchon j'ai étais ravis du début jusqu'à la fin .
Un repas de dimanche midi dans la convivialité sur une grande table assis à la même tablée d'autres couples mais rien de désagréable au contraire ! Bon une entrée arrivée un peu tôt nous avions  encore clés entrées 😂😂 mais ça peut arrivé et avec des excuses d'une équipe sympathique ça passe toujours ! De plus on a eu le droit à une quenelle offerte en plus pour nous faire pardonner une cuisson apparemment trop cuite mais on a tout mangé ce que c'était très bon !! Et pour finir une tarte praline délicieuse !! A refaire sans hésitation merci ! 

Un ""chinois"" qui prends tout ses plats en photos 😂😂"
969,moutmout69,moutmout69,12 juin 2016,Que c'est il passé ce jour là ?,2.0,none,167,"Nous étions déjà venu, et c'était bien. Mais là: une heure d'attente avant le premier plat, qui nous été servis alors que les couverts n'étaient pas posés. Puis 45' entre chaque plat...heureusement que nous avons pris cela avec humour - les plats étaient juste corrects. Dommage ! Mais je suis certain qu'il y avait un événement particulier ce jour là 
"
970,Matde01,Matde01,12 juin 2016,pas facile à juger,4.0,friends,141,"Apparemment les avis divergent énormément et il n'est pas facile de juger un établissement si inconstant ....
Pour notre part :
- cadre : sympa
- nourriture : franchement très bon malgré que ce bouchon est archi touristique
- service : très bien mais on vous presse un peu !!!!"
971,Sepcbien,Sepcbien,28 mai 2016,Un très bon moment !!,5.0,family,127,"De Toulouse et en vacances à Lyon, nous avons voulu manger local.
Nous n'avons pas été déçu : accueil sympathique car nous avions un bébé dans une poussette.
Ensuite l'état d'esprit des serveurs au top car ils nous ont bien chambré sur notre accent.
Pour finir, le plus important le repas, c'était délicieux car toute la tablée était unanime !!

À ne pas éviter !!!! 

Merci"
972,SouetGuigui,SouetGuigui,26 mai 2016,Super table!,5.0,couples,1,"Nous nous sommes régalés, tant au niveau gustatif qu'au niveau ambiance.
Les serveurs sont très agréables et les plats excellents! 
Si vous recherchez une cuisine authentique et de qualité, c'est aux Lyonnais qu'il faut aller!
Je recommande vraiment cette adresse."
973,luluberlu232,luluberlu232,23 mai 2016,Une adresse exceptionnelle !!,5.0,friends,1,"Enfin un vrai bouchon Lyonnais..
Nous nous sommes régalés, le cadre est très sympa.
Mention spéciale à Stéphane qui nous a fait passer un très bon moment.
A refaire."
974,Flo C,floc641,22 mai 2016,Un bouchon un vrai,5.0,couples,113,"Vous ne pouvez pas aller à Lyon sans faire un bouchon et celui-ci est un vrai, excellent de l'entrée au dessert. Avec un service au top. Un conseil réserver car toujours complet."
975,fanch,denisF224,22 mai 2016,un détour a ne pas manquer,5.0,friends,112,"sublime  excellent a 4 personnes pour la pentecôte 3 sortes de menus très 
abordable, un patron avec un humour sympa une serveuse en extra très souriante et serviable  il faut impérativement réservé un véritable bouchon cuisine a ne pas loupé merci pour cette découverte"
976,Ko c,Jet269692,19 mai 2016,Excellent,5.0,friends,1,"De la tête de veau sauce gribiche aux quenelles en passant par la salade Lyonnaise tout est plaisir.
Tout ça avec un service plein d'humour et de bonne humeur sans compter les murs couverts de Lyonnais et les vitres de verve poetique.
Nous en avons fait notre cantine préférée.
Allez y les yeux fermés ! "
977,Emilie G,emmy_guillaume,19 mai 2016,Une très belle expérience,5.0,couples,13,"Première expérience dans un bouchon lyonnais et aucun regret : le cadre, l'ambiance, les petits phrases sur le mur et les vitres, la proximité des gens (on discute en toute simplicité avec des inconnus) et des plats typiques de qualité !!!
Conseils : réservez car le lieu est très convoité."
978,J-Charles V,jcharlesv,19 mai 2016,Un bouchon à la hauteur de la tradition lyonnaise!!!,5.0,friends,1,"Nous avons passé un très bon moment dans ce restaurant typiquement lyonnais avec une cuisine excellente et un très bon rapport qualité prix. 
Je recommande fortement !!!"
979,Valsca,Valsca,17 mai 2016,Excellent ! Vrai bouchon !,5.0,couples,51,"Vous cherchez un vrai bouchon Lyonnais, typique, raisonnable en prix, et avec une vraie cuisine Lyonnaise : ne cherchez plus ! Le repas était parfait du début à la fin ! "
980,RichyKrisprolls,RichyKrisprolls,13 mai 2016,Très bonne cuisine et bonne atmosphère,4.0,friends,61,"Bon bouchon digne de Lyon, un peu à l'écart pour éviter le flot des touristes. Très bonne cuisine et bon service. Cadre sympa bien que sommaire. Bémol : attente quelque peu longue."
981,Agnès j,84agn_sj,8 mai 2016,On en redemande !,5.0,couples,12,Très bon accueil avec beaucoup de bonne humeur. Cuisine typique et maison. Généreuse comme le sont les lyonnais. Une très bonne adresse.
982,Franck C,622FranckC,7 mai 2016,très bon bouchon,4.0,couples,113,"Nous avons très bien manger dans ce bouchon et ce pour un prix tout à fait correct.
Nous y retrouvons les grands classiques de la cuisine lyonnaise, tablier de sapeur, gateu de foies, .....
A fréquenter sans hésiter, et en plus l'accueil est fort sympathique"
983,Nicolas F,530nicolasf,1 mai 2016,À faire et refaire,5.0,couples,123,"Que dire ? 
C'est vraiment un excellent bouchon à recommander !
Nous y allons une fois à deux fois par mois ! 
C'est vraiment une excellente adresse "
984,Sonia H,soniah512,27 avril 2016,Un très agréable Bouchon,5.0,couples,89,"Légèrement à l'écart de LA rue touristique du Vieux Lyon , ce bouchon très accueillant mérite une visite. Un cadre original avec ses grandes tables communes qui se remplissent au fur et à mesure des arrivées, ses innombrables portraits photos anciens  et ses ""maximes"" maison qui ornent les vitres. Un accueil très agréable, le serveur ( patron? gérant?) sachant établir un bon contact avec ses clients. 
Des plats traditionnels lyonnais (oeufs en meurette, quenelles...) copieux et goûteux très appréciés et pour un prix abordable. 
Bref, une adresse à conserver en mémoire pour y revenir à une autre occasion"
985,Fred G,federico34120,27 avril 2016,"excellent rapport qualité, quantité et prix",5.0,couples,13,"Accueil très sympathique et chaleureux. 
Les assiettes sont copieuses et goûteuses.  
Le tout dans une ambiance bistro bouchon au top !
Je recommande le tablier et le saucisson lyonnais !"
986,Marie3112,Marie3112,25 avril 2016,Excellent bouchon lyonnais,5.0,family,66,"Accueil très sympa dès la réservation, on nous prévient que l'on partagera la table avec d'autres personnes (grandes tables en bois de 8 à 10 personnes). Même humour sur les vitrines avec les maximes du jour qu'au niveau du service, donc bonne ambiance dans la salle. La carte présente un bon choix de plats typiques de la cuisine lyonnaise, ça tombe bien, on venait pour çà ! Un peu d'attente après la commande. Le gâteau de foies de volaille est excellent, la quenelle de brochet aussi, sans oublier le verre de Jurançon de l'apéritif. En résumé, c'est vraiment une adresse que je recommande !"
987,Guillaume M,931guillaumem,22 avril 2016,Un must des bouchons lyonnais,4.0,business,96,"Toujours un plaisir d'aller dans ce bouchon.
La carte est typique, pas de surprise mais grande qualité !
Seul bémol sur la carte des vins peu étoffée à mon goût 
En tout cas je recommande !"
988,193michelt,193michelt,20 avril 2016,un vrai bon bouchon tres sympa,4.0,friends,143,"voila la cinquième fois que j'y vais avec un grand plaisir. outré le cadre bouchon tres proper avec des meubles sympa, un patron souriant et efficace suit le deroulement avec efficacité. le contenu des assiettes ets de tres bonne qualité"
989,Morgan B,morganb474,19 avril 2016,Bon restaurant,5.0,family,40,"C'est une belle adresse , les mets y sont très bon et le service y est très sympathique. L'attente était correct .
Nous recommandons vivement."
990,tressfaim,tressfaim,18 avril 2016,des plats lyonnais dans un vrai bouchon avec un serveur très sympa,4.0,none,8,la catre est super le serveur nous conseille des bons vins pour aller avec le tout dans un cadre typique et sur une cuisine ouverte sur la salle de restaurant; on est jamais déçut!!!  
991,Tcheny L,louboungou95320,17 avril 2016,Week-end entre amis,4.0,friends,13,"Excellent repas. Nous avions hâte de découvrir les fameux bouchons lyonnais et nous n'avons pas été déçu. Repas succulent du début à la fin, de très bon vin pour accompagner l'ensemble (vin au pichets pourtant).
Un seul petit bémol concerne l'attente avant d'être servi.
Attention : réservation nécessaire le vendredi soir.
Je ne peux que conseiller cette adresse.
"
992,Tyno,Tyno28002,13 avril 2016,À éviter piège à touriste !!!,2.0,business,99,Tout les 2 mois je vais sur Lyon en déplacement et je mange dans les petits bouchon lyonnais !!! Cela fait 1 ans jamais était déçu là pour le coup le cadre est vraiment bof pas digne d'un bouchon. Pas d'ambiance pas de rigolade service très médiocre et beaucoup d'attente !!! Les plats ne sont pas à là hauteurs des petits bouchon lyonnais piège à touriste !!!
993,g_benkemoun,g_benkemoun,11 avril 2016,au TOP,5.0,couples,2,"Rien a dire et je dirai même que l'on peut applaudir ! Super accueil, repas excellent et tres bon rapport qualité prix ! sa fait super plaisir ! Merci à toutes l'équipe"
994,Stéph’y,Stephyxyz,9 avril 2016,"Enfin, le bouchon lyonnais comme je le l'attendais , Bon sympa décomplexé.",5.0,solo,26,"C'est trop bon , le service est parfait, la cuisine aussi, En un mot comme en cent, il faut y aller !"
995,E M,EricDuSud,8 avril 2016,Typique et excellent bouchon,5.0,couples,458,"Cuisine locale excellente avec préparation des plats visible. 
Bon tablier de sapeur, succulente souris d'agneau, desserts faits maison ( moelleux chocolat, tarte pistache). Entrées saussisson chaud un peu simple.
Accueil jovial.
Pour avoir parcouru une quinzaine de restaurant dans ce quartier attrape touriste, c'est le seul véritable et correct bouchon. 
Menu à 25 et 30 euros, mais au moins ca permet de se différencier avec une nourriture de qualité par rapport à tous les autres arnaqueurs du coin avec des menus à 16/20 euros.
Je reviendrais dès mon prochain déplacement professionnel, ou à titre personnel."
996,al_vialle,al_vialle,8 avril 2016,restaurant ou la cuisine et la bonne humeur font bon ménage,5.0,friends,9,"restaurant ou le personnel vous reçois avec toujours le sourire et un mot de plaisanterie et un des rares bouchons lyonnais ou la gastronomie lyonnaise est de rigueur si vous y allez pour faire le régime évitez il vaut mieux Cuisine délicieuse,tablier du sapeurs excellent, et autres mets du terroir et pour finir la délicieuse cervelle des canuts et la tarte aux pralines je ne peux que vous conseiller de faire un détour par les lyonnais"
997,Greg D,319gregd,7 avril 2016,Hummmmmm trop bon,5.0,friends,1,"Un vrai bouchon délicieux et très sympa .
Parfait pour repas en famille , en amoureux ou entre amis .

"
998,Jack2901,Jack2901,7 avril 2016,Un excellent bouchon dans la tradition lyonnaise,5.0,friends,625,"Un bouchon à recommander très fortement. L'ambiance y est excellente, le patron plein d'humour. Une excellente cuisine lyonnaise pour des prix raisonnables (menus à 24,50 € et 29,50 €). Il est prudent de réserver car les Lyonnais semblent aussi le plébisciter."
999,vale261267,vale261267,5 avril 2016,pittoresque,5.0,none,21,"Après vous être rendu à pied à la basilique de Fourvière, et avoir descendu les 251 marches préalablement montées, arrêtez-vous chez Les Lyonnais, bouchon typique à l angle de la rue Tramassac. Réservation à faire, ou alors, attendre midi et l ouverture, en lisant les phrases humouristiques sur les vitres de l enseigne. Personnel accueillant et rapide."
1000,alsace m,alsacem_13,3 avril 2016,Bonne expérience,4.0,couples,168,"De passage à Lyon nous nous devions d'aller découvrir un des fameux "" bouchon Lyonnais "" nous avons choisi celui-ci par hasard et nous n'avons pas regretté.

L'ambiance à la bonne franquette , change d'un restaurant classique, de grandes tablées et pas de petite table chacun dans son coin, ce qui dénote parfaitement d'un restaurant classique au début cela peut surprendre et final c'est bien sympathique, l'ambiance y est tel le restaurant plein à craque , qu'on ne fait même plus attention que nous avons des voisins de table; 

Le repas était très bon et copieusement servi, le cadre atypique et le personnel, sympathique .

Si nous sommes à nouveau de passage à Lyon, nous y retournerons sans hésiter"
1001,Jeremy,791jeremyc,3 avril 2016,Parfait !,5.0,family,20,"Cuisinie authentique, un vrai bouchon lyonnais !
Cuisinie simple mais goûteuse,  produits de qualité.
Le personnel très sympa et cadre super agréable ! Bravo à toute l'équipe et merci "
1002,Lyon1969,Lyon1969,31 mars 2016,Que dire de plus?,5.0,family,2,"Repas délicieux, accueil chaleureuse, humour agréable !

Très bon rapport/qualité/prix.

JE reviendrai !"
1003,Stanislas M,334stanislasm,30 mars 2016,Bon et généreux,5.0,family,1,"Venu mangé un midi avec mon frère, nous avons prit l'andouillette: une TUERIE!! et le magret de canard rôti au miel: à tomber par terre!
Pour finir un ""café très gourmand"" (c'est comme ça qu'ils l'appellent) avec petit fondant, petit financier aux pralines et petite île flottante, heureusement que ce sont des ""miniature"" car c'est déjà très copieux!
Bref un bon repas servi avec beaucoup d'humour par le patron."
1004,Quest604474,Quest604474,29 mars 2016,Bon repas convivial,5.0,none,3,L'ambiance était très conviviale et on y retrouve des plats typiques. Le serveur était bien rigolo sans être dérangeant. 
1005,sandrelafille,sandrelafille,23 mars 2016,Super sympa,4.0,friends,230,"Bon repas traditionnel dans une ambiance très agréable. 2 menus à 24,9 et 29,9 euros. Copieux et bien cuisine. A recommander !"
1006,Delphine130892,Delphine130892,21 mars 2016,Un bouchon qui a de la bouteille,5.0,couples,25,"Décidément une réussite ! On passait dans le coin, et les citations écrites sur toutes les fenêtres nous ont bien fait rire ! L ambiance avec le personnel est extra, on déguste mais avis aux gros appétits, vous aurez du mal à finir ! On recommande sans faute ! Un véritable bouchon ou on échange avec ses voisins les bons plans ! "
1007,Gaelle37,Gaelle37,18 mars 2016,Sympathique !,4.0,family,23,"Un restaurant lumineux, coloré, pleins de photos portrait toutes plus jolie les unes que les autres. Côté repas, un excellent moment. Plat très copieux et très bon ! Des plats typiquement lyonnais ! Je vous recommande l'andouillette et la cervelle de canut ! Je recommande ce restaurant mais attention aux compliments, le patron est timide !!! "
1008,ChupaChups2012,ChupaChups2012,15 mars 2016,Bon très copieux et accueil sympa,4.0,couples,65,"Merci pour cet agréable moment
Le menu était bon mais très copieux
Le service est top avec sourire Et humour
Mais qui sont toutes ces personnes en photo sur les murs ?? ...nous avons oublié de demander !
"
1009,freddesainte,freddesainte,13 mars 2016,Le repas à l'image de l'accueil,5.0,none,192,"Les spécialités lyonnaises sont là ! La quantité et la qualité aussi !
Mais surtout le serveur ( sauf erreur c'était le patron) s'adapte à l'humeur du client... quelques phrases humoristiques de notre part et voici un service qui vire à la bonne humeur avec des répliques du personnel bien senties ! Bref on en redemande d'autant que la facture n'a pas terni cet excellent moment"
1010,François D,fran_oisd914,13 mars 2016,Sympa et délicieux !,5.0,friends,2,"On est venu à 2 couples, le deuxième arrivant avec pas mal de retard, bloquant donc la table pour le deuxième service. Pour autant personne ne nous a embêté pour ça, on a pris le menu à 25€, un régal ! Il y a deux menus : 25 et 30€ et les vins sont vers 30-50€ la bouteille, avec des crus sympa. Même les vins en pichet sont très corrects, on a pris du mâconnais blanc en pichet qui était vraiment pas mal !"
1011,LongVehicle,LongVehicle,12 mars 2016,Bouchon au-dessus du lot,4.0,friends,70,"Est-ce sa situation légérement excentrée par rapport à la rue Saint-Jean? En tout cas, Les Lyonnais sort agréablement du commun des bouchons, avec une petite touche de modernité dans l'assiette. Cadre et service à la hauteur."
1012,Manue O,manueo107,10 mars 2016,super bon!!,5.0,none,15," à essayer absolument!! ambiance sympathique, la carte typique du coin les plats très bons, le service excellent! le samedi 5 mars au soir"
1013,mag2419,mag2419,8 mars 2016,Un peu décevant,3.0,friends,15,"L'accueil est très agréable et plein d'humour et le cadre très convivial.
Les plats sont copieux mais pas terribles, pas mauvais mais pas tops non plus.
Peut-être que le lieu nous avait été survendu, toujours est-il que je reste sur ma faim..."
1014,Luguan,Luguan,7 mars 2016,La cuisine à la hauteur de l'humour... ou l'inverse !,4.0,family,88,"Une philosophie certaine, cela débute sur les vitres au feutre blanc, cela passe par les serveurs, le patron et surement les cuisiniers- philosophie épicurienne bien sûr : la gratinée d'oignon, le saucisson à l'ail, le magret, l'andouillette en sont la preuve ! Le tout dans une ambiance amicale et jalonnée d'une bonne dose d'humour."
1015,Benjiii07,Benjiii07,5 mars 2016,"Un bon ""grand"" bouchon lyonnais",4.0,friends,93,"Petite sortie du samedi avec des copains et passage par Les lyonnais ! Super ambiance, accueil sympa et la gastronomie est au rendez vous ! Petit clin d'œil à l'andouillette excellente :) 
Passez vous faire votre propre avis mais je conseille "
1016,Tony_Smk,Tony_Smk,5 mars 2016,Du vrai bouchon !,5.0,friends,34,"On pourrait croire à l'attrape touriste vu le nombre d'étrangers 
Détrompez vous ! 
Tous les plats sont délicieux les prix abordables et le service ultra chaleureux ! "
1017,balou,chamguen,2 mars 2016,Typique et delicieux,4.0,none,31,"Cela fait deux fois que je viens à Lyon et que j'y déjeune. À chaque fois, nous nous sommes régalés. Le cadre est très sympa et le patron très agréable. "
1018,davy t,548davyt,27 février 2016,Excellent restaurant dans le vieux Lyon !,5.0,family,2,"Coup de coeur pour ce restaurant qui propose une gastronomie de qualité.
Bon rapport qualité/prix.
Le personnel est chaleureux et le repas s'est effectué dans la bonne humeur.
Nous reviendrons déjeuner aux Lyonnais sans hésitation !"
1019,Nicolas F,530nicolasf,25 février 2016,Un moment exceptionnel,5.0,couples,123,"Nouveau à Lyon il est important pour nous de découvrir la gastronomie lyonnaise une halte dans cet établissement et se fut un moment exceptionnel rien d'autre à dire ! De l'accueil à l'addition se fut que du bonheur ! 
Nous sommes vraiment ravis et nous reviendrons 
MERCI à vous pour ce moment !!"
1020,BestofPlus,BestofPlus,21 février 2016,Dans la bonne humeur,4.0,family,7,"Tablier de sapeur et andouillette au top... ainsi que l'ambiance de salle et l'humour du serveur. Les desserts sont un peu en dessous, mais ca reste une vraie valeur sure."
1021,oristana,oristana,18 février 2016,Un très bon repas dans la bonne humeur,4.0,friends,33,"Bouchon de qualité , service jovial et parfait.
Nous anis été enchantés de notre repas.
Ce Bouchon fait partie d'une liste labellisée sur Lyon, et on peut dire que c'est un vrai 
Bouchon , qui sert des produits locaux, et frais.
À conseiller."
1022,atchoumett,atchoumett,17 février 2016,Un agréable moment,5.0,friends,101,Un cadre typique un accueil plus que sympathique et un repas typiquement lyonnais très bon. A ne pas louper.
1023,Med-i51,Med-i51,16 février 2016,Bouchon décalé,3.0,friends,7,"La cuisine digne d'un bouchon lyonnais, bon, sans être succulent, avec un humour à prendre au second degré ...
À méditer...
"
1024,Caro E,caroe233,13 février 2016,Un voyage,5.0,couples,27,"Une agréable découverte fait au détour d'une ruelle nous y avons mangé en plein été dans les rues entre les terrasses des restaurants alentours et les passants nous avons très bien manger le rapport qualité-prix est là, l'accueil est agréable bien que le service empressé, de par le monde présent ce sera là."
1025,Loulous_testent_tout,Loulous_testent_tout,10 février 2016,Excellent!,5.0,couples,424,"Nous avons été placé dans la cave: juste un endroit superbe et authentique! Service agréable et cuisine Lyonnaise au top! Tout est maison et ca se sent! Seul bémol le financier aux pralines ressemblait plus a un gâteau aux yaourts mais il restait bon!
Une bonne adresse!"
1026,Sylvain A,syssou0191,6 février 2016,Bouchon lyonnais de qualité!!,5.0,business,11,"Très bon bouchon lyonnais! Des plats fait maison et des produits de qualités! Le gérant est super, il a pris le temps pour discuter avec nous à propos de Lyon et nous parler de toutes les photos au mur! Un très bon moment, je conseille vivement ce restaurant!"
1027,Jocelyne G,jocelyneg930,4 février 2016,Un délice!,5.0,solo,33,"Un bouchon très sympa où l'on partage son repas sur de longues tables donc on finit par engager la conversation avec les voisins en face ou à droite ou à gauche. Un prix raisonnable pour de belles spécialités de la région avec en plus l'humour du patron et les petits mots à lire sur les vitres, façon originale d'attirer les clients! de belles assiettes joliment décorées et de bons petits plats : que demander de plus?"
1028,juetjoalareunion,juetjoalareunion,4 février 2016,Une cuisine de qualité dans un cadre agréable,4.0,friends,9,"Un restaurant qui tient ses promesses de cuisine traditionnelle de qualité, roborative et gouteuse, dans un cadre agréable. Le service est efficace et convivial. Une bonne adresse."
1029,italiano28,italianodu28,30 janvier 2016,A ne pas louper,5.0,friends,84,Cet endroit est vraiment particulièrement intéressant pour tous ceux qui veulent tester goûter apprécier la bonne cuisine Lyonnaise. Rien à dire sur le service sur la qualité des plats la farandole des desserts jusqu'au café gourmand mais ce qui est vraiment extraordinaire c'est la qualité dans un restaurant que je qualifierais de gastronomique
1030,Herve Isa B,herveisab,29 janvier 2016,Un accueil et une assiette de grande qualité,5.0,couples,62,"Après la découverte de Lyon en séminaire de travail, j'ai décidé de revenir avec mon mari afin de partager cette découverte. Après une ballade qui nous a ouvert l'appétit, direction un bouchon. ""les lyonnais "". Après un accueil chaleureux et convivial, nous commandons deux menus à 25€ qui nous ont satisfaits au plus haut point. Pâté de foie de volaille, tablier du sapeur pané accompagné de sa sauce gribiche et de son écrasé de pommes de terre, financier à la praline. 
Un croze hermitage à la hauteur en accompagnement. Le tout servi avec le sourire et la sensation d'être accueilli par un ami. Bref allez-y!!!"
1031,Elodie I,elodiei443,17 janvier 2016,Toujours aussi bon,4.0,friends,3,"Menus copieux. De l'entrée au dessert, nous n'avons jamais été déçu. Le service est parfait. Le cadre typiquement bouchon lyonnais. Un plaisir à chaque visite. "
1032,Ellora347569,Ellora347569,16 janvier 2016,Gargantuesque ! A ne pas manquer !,4.0,friends,628,"Les Lyonnais Bouchon est une adresse à ne pas manquer à Lyon.
Le lieu et la localisation sont superbes, et la décoration très sympa.
Gourmands, nous avons opté pour le menu du chef... Et avons mangé comme des rois ! Les plats étaient tous plus bons les uns que les autres !
Enfin, le serveur était très sympa et nous a bien aidé pour le choix des plats !"
1033,patrice c,207patricec,13 décembre 2015,un personnel pas des plus agréable,3.0,business,51,"Un accueil pas très sympathique et des tables très serrées , on arrive encore a manger     des bons produits de la région lyonnaise dans ce jolie bouchon typique du cartier st jean . De l'entrée au dessert tout a été bon et dans l'ensemble on est ressortie content de notre soirée . Allé , un petit effort de sympathie au niveau du service et il passera au grade supérieur ... Patrice et son CE"
1034,Jerome B,S7432TUjeromeb,13 décembre 2015,soirée entre amis dans un pur bouchon lyonnais,4.0,none,29,"après le petit communard , une gratinée à l'oignon ( ah , le jaune d'oeuf au porto .. )  et une tête de veau sauce gribiche...dans un joli décor avec un service impeccable et toujours une bonne ambiance !"
1035,Soubies V,soubiesv,9 décembre 2015,super bouchon lyonnais dans un cadre unique et a la cuisine genereuse et traditionnelle,5.0,No information,1,excellente adresse. cadre sympathique et de caractere. personnel adorable souriant et passionne. cuisine genereuse de qualite respectueuse des traditions des bouchons lyonnais. tout est maison!!!! nous y etions a 3. nous avons tous adore!
1036,Camille C,619camillec,8 décembre 2015,Un bouchon lyonnais classique..,3.0,friends,216,"Une adresse simple pour un repas lyonnais. Des plats typiques, bon point pour le gâteau de foie et la quenelle. Une bonne carte des vins. Bon moment mais quelques déceptions sur certains plats. "
