,user,user_profile,date_review,title,rating,type_visit,num_contributions,review
608,Davidahou,Davidahou,6 mars 2018,Bouchon Typique,4.0,family,18,Repas sympa avec spécialités lyonnaises et beaujolais . Agréable déjeuner avant de monter à Notre Dame de Fourviere à pied pour digérer .
609,Anne-Catherine H,annecatherineh2013,6 mars 2018,super sympa!,4.0,friends,22,"restaurant décoré de citations, les serveurs drôles mais pas envahissants. Des plats et desserts typiques de Lyon, très bons. A recommander"
610,Maxime  C,maximec608,5 mars 2018,Très bon moment,5.0,family,6,"Passage impeccable dans ce restaurant: menu copieux, plat typique avec bon goût,  service agréable!

Le décors est aussi très bien. Pas de chichi, seulement de l'efficacité! Bref, un bon bouchon!"
611,dofin2a,dofin2a,5 mars 2018,Une référence si on cherche un bouchon !,5.0,friends,206,"Nous y sommes allés par hasard en descendant de Fourvière entre amis un dimanche midi et sans réservation.
Accueil super sympa et de très bon conseil surtout pour le vin. Cuisine Lyonnaise délicieuse et très bien servi. Prix correct en rapport avec la cuisine.
Que du bonheur. 
Des Trois resto pour notre week end lyonnais, cela restera notre meilleur souvenir. On y reviendra"
612,Nico B,864nicob,4 mars 2018,Première venue à Lyon,5.0,couples,106,"Accueil chaleureux, du monde qui patiente mais dans la bonne humeur.
Excellent. Spécialités à tomber.
Le cadre est sympathique, l'ambiance très conviviale. "
613,Lucas D,L8620ZMlucasd,4 mars 2018,Moyen,3.0,none,1,J’ai trouvé que mon plat n’était pas assez savoureux une crème brûlée peux convaincante avec un petit poile dedans bof bof assez moyen ce repas de fête des grand mère 
614,Richard M,richardmN4890AT,3 mars 2018,"Un bouchon, un vrai, un acdre et une accueil",5.0,family,54,"Nous avons pu déjeuner dans ce bouchon au sein de la cave voutée, un régal et un service, gai et enjouée, un régal, et tête de veau, tablier de sapeur ont ravi nos papilles… à recommander"
615,Thierry C,75thierryc,3 mars 2018,EXCELLENT,5.0,friends,12,"Excellent bouchon. Nous y sommes venus à 4 personnes,  sans réservation un samedi midi. Malgré le monde, le personnel nous a accueilli avec un grand sourire et beaucoup d'humour. Nous avons été installé au sous-sol dans la magnifique salle voûtée. nous avons pris des quenelles, tablier de sapeur, tête de veau et pour finir, un énorme baba au rhum. le repas était copieux, vraiment excellent et servi avec humour de la part du serveur. Adresse incontournable."
616,Julien A,831juliena,2 mars 2018,Génial,5.0,couples,54,"Nous sommes allés dans ce restaurant avec ma femme. Cadre agréable, serveur qui a de l'humour.  Que dire des plats à part qu'ils sont exceptionnels.  On voit que ce sont des produits frais et du fait maison. Ça en vaut le prix. "
617,Laurent A,laurenta510,26 février 2018,Impeccable !,5.0,family,11,"Bonne ambiance, très bon accueil, cuisine généreuse et délicieuse. 
Aucune fausse note. Une adresse incontournable."
618,JulieWettling,JulieWettling,26 février 2018,Génial,5.0,friends,31,"3 visites avec des amis parisiens ne connaissant que très peu la cuisine lyonnaise ( un deuxième bouchon testé la veille d'ailleurs ) ils étaient ravis :) Tout était parfait, nous reviendrons."
619,Epicurienne,a_epicurienne,24 février 2018,Fidèle à sa réputation,5.0,family,102,"2nde visite à Lyon et impossible de ne pas passer manger Chez Les Lyonnais. Véritable bouchon, cuisine de qualité et service irréprochable !
Je recommande encore et encore !

P.s:Réservation obligatoire ! Victime de son succès ;)"
620,Sophie G,sophiegU3585MK,24 février 2018,"Bon, agréable, chaleureux, lyonnais !",5.0,family,7,"Plats très bons, serveurs très sympas, et surtout tarte aux pralines excellente ! Allez y les yeux fermés si vous cherchez un bouchon lyonnais !"
621,Antoine M,175antoinem,22 février 2018,"Chaleureux, truculent, confortable, délicieux !",5.0,family,173,"Accueil chaleureux, complice, souriant. Même si on est pas venu depuis..... trop longtemps on se sent accueilli comme en famille et c'est tout de suite confortable.
Tout y est servi généreusement, c'est beau, c'est bon.... on y est divinement bien !
Un clin d'oeil au patron et hop on a la bougie-feu-d'artifice pour cet mouvement anniversaire et la salle bon-enfant entonne ""Happy birthday"" de bonne grâce. C'est cool, c'est drôle. Si on pose des questions de cuisson ou de préparation on engage un chouette dialogue de cuisto et ça aussi c'est drôle."
622,Isabelle F,527isabellef,21 février 2018,Gourmandise,4.0,friends,175,"Une belle journée froide, un lieu simple et convivial. Accueil chaleureux du patron, jolie salle. Une cuisine typiquement lyonnaise, copieuse et goûteuse. Je me suis régalée d'une quenelle de brochet succulente et légère. Au dessert un délicieux baba au rhum. Goûter aussi le communard et le tablier de sapeur accompagné du pot lyonnais ! Un très bon moment entre amis. "
623,ironmike7627,ironmike7627,20 février 2018,Mitigés,3.0,family,14,"Nous sommes allés en famille 3 fois en tout à quelques mois d'intervalle. 

Nous avons toujours très bien mangé, mais avec une qualité parfois variable. 

La carte est sympa et l'on peut manger des plats que l'on ne fait pas chez soit. L'ambiance est sympa aussi. 

Le serveur et sûrement patron avec la barbe grise met dans l'ambiance et n'hésite pas à donner quelques anecdotes sur l'établissement et le quartier. C'est plutôt sympa et les enfants adorent. 

Un gros bémol cependant sur l'attitude du serveur décoloré blond, genre ""Dennis Rodman"" qui a tapé dans ma chaise toute la soirée, puis qui m'a demandé de m'avancer. Étant grand (1,91m) et les tables un peu basses, mes jambes m'empêchaient de m'avancer plus. Ce serveur m'a alors indiqué qu'il serait peut être temps d'envisager un régime. (94kg)
Je n'ai pas réagit vu l'idiotie de sa remarque (et de son look), mais j'ai trouvé ça déplacé. J'aurais pu mettre ça sur le compte de l'humour, mais au bout de 3 remarques du même genre j'ai fini par être lassé. 

Nous irons donc manger ailleurs grâce à cette personne, même si c'était bon. 

Dommage. "
624,smallest2013,smallest2013,18 février 2018,"Un bon bouchon, un vrai!!",4.0,couples,161,"Incontournable un samedi soir dans le vieux Lyon, ce bouchon est toujours complet renommée oblige, le patron plein d'humour fait la police à l'entrée , la cuisine est excellente, que ce soit le paté en croute, la tête de veau, les quenelles, les viandes, les desserts tout est dans la tradition ainsi que les vins régionaux .
Les tables à touche touche permettent la convivialité et le partage!! un excellent moment."
625,les beaujolais,beaujolais692b,17 février 2018,bon bouchon,4.0,family,513,"Accueil sympathique, très belle salle voûtée en sous sol : ça commence bien !
Tables tres serrées,  beaucoup de bruit et service long car restaurant ""bondé"". Normal ! C'est un bouchon réputé.
Aux différents menus : un large choix de spécialités lyonnaises. (Quenelle irréprochable)
Menus à 29,70 et 34,70 : un peu chers mais ... c'est bon !"
626,Ano N,anon180,3 février 2018,Cuisine excellente !!!,5.0,none,21,"Un endroit à ne pas manquer ,les plats sont maitrisés et le service est souriant et très sympathique."
627,Mil092,Mil092,30 janvier 2018,Typique,4.0,friends,179,Bouchon lyonnais typique avec les tables contigues le service va avec le lieu. Ne pas demander de frites le serveur sera vexé !  Quenelle de brochet top.
628,Simone,SimoneBD26,28 janvier 2018,Les lyonnais au sommet !,5.0,friends,16,"Ambiance bouchon comme nous l’aimons ! 
Un accueil très sympathique, Stéphane nous a accueilli avec humour et professionnalisme 
Dans l’assiette? Généreuses spécialités lyonnaises bien sûr ! Que du bon! Excellent moment partagé avec des amis 
Une belle adresse à découvrir "
629,Marsi29,Marsi29,28 janvier 2018,Un peu décevant,2.0,friends,88,"Plats chers pour la qualité et serveurs très lourds et même non professionnels. Le serveur ne voulait pas me servir du bœuf cuit à point (soit disant c'est meilleur saignant), chacun ses goûts non? il m'a donc servis un bœuf saignant que je n'ai pas aimé..."
630,anlare,anlare,25 janvier 2018,Déjeuner quenelle,5.0,solo,128,"Une carte lyonnaise typique.

Une seule quenelle (car volumineuse) de brochet sauce homardine, servie avec du riz et des petits légumes au thym: un vrai délice!!! Moelleuse, goûteuse. 

Beaucoup d’autres choses que j’aurais bien testées: salade de foie de volaille....

Salle très chaleureuse: grandes vitres sur l’extérieur, murs oranges recouverts de photos de personnalités, éclats de carreaux granités au sol.
Les serveurs sont très gentils.

Une formule deux éléments le midi à 14,90 euros.
À faire. "
631,Mag,Galouille,23 janvier 2018,Bon accueil et délicieux repas au rendez-vous,4.0,family,5,"Dimanche midi aux Lyonnais en famille, avec de jeunes enfants. Accueil très sympathique notamment pour les enfants, placement en salle prévu pour que nous soyons à l'aise avec les enfants, et repas vraiment délicieux. 
Service un peu long (mais il y avait beaucoup de clients), mais nous y retournerons très volontiers."
632,73chantou,73chantou,21 janvier 2018,tres cher,2.0,couples,17,"Nous avons pris 1 menu à 34.70€  , 1 menu à 29.70€
le premier , la viande était un peu dur , déco de l'assiette minable un tas de gratin posé à coté de la viande , il ni avait que l""entrée tranche de foi gras  le dessert café gourment   les mignardises qui accompagnaient n’étaient pas maison sans finesse pour un prix de 34.70€ !
mon menu à 29.70€  
une terrine maison très mince et très sèche , plat une tête de veaux , disons 2 morceaux posés dans l'assiette avec une plâtrée de gratin posée à coté  
le plus qui ma affecté c'est que j'ai trouvé une limaille de fer dans ma tête de veau j'en ai fait part au serveur qui ma simplement dit  ,oui nous nous servons d'éponges métallique , il ne s'est mème pas excusé , je n'ai pas voulu faire esclandre dans le restaurant, mais je le regrette je ne recommande absolument pas du tout ce restaurant  qui à le logo du ROUTARD ?, il y a des petits bouchons ou l'on mange très bien pour un prix correcte   ."
633,mari-t08,mari-t08,14 janvier 2018,Très bien accueillis avec les enfants,4.0,family,72,"Repas de famille au restaurant, un dimanche, avec 2 jeunes enfants (4 ans et 1 an) sans avoir réservé...ce n'était pas gagné! Nous avons été très bien accueillis dans ce restaurant et le serveur s'est efforcé de nous trouver une table bien placée pour recevoir la petite famille. De la quenelle à l'andouillette, en passant par l'araignée    de porc et le menu enfant, Tout était délicieux, copieux, servi avec le sourire! Un bon moment!"
634,pascalou f,pascalouf,8 janvier 2018,A conseiller !!,4.0,couples,583,"Bouchon lyonnais où il est nécessaire de réserver si vous désirez une table.
L'ambiance bouchon est là, familiale, simple et conviviale !
Les spécialités lyonnaises , gouteuses et de qualité sont servies par une équipe pro et chaleureuse.
Établissement à recommander !!"
635,florencespitzli,florencespitzli,26 décembre 2017,typique et très bon,4.0,couples,22,"atmosphère jeune, décontractée et sympa. Le velouté de lentilles un vrai délice !!!
l'accueil authentique et sans chichi. Les tables proches obligent à faire connaissance et discuter entre clients. Plutôt sympa."
636,René E,renedu71,25 décembre 2017,Déçu....,3.0,couples,45,"Recommandé par un commerçant du quartier. L'accueil ""bouchon"" est sympa. Le tablier de sapeur et la tête de veau sont sans saveur.... Expérience décevante. La note est relativement élevée pour la qualité.
Bof. Bof.!!!!"
637,Mathieu R,560mathieur,22 décembre 2017,Très bon bouchon. A refaire !,5.0,couples,9,"Très bon service, professionnel et plein d'humour. Les assiettes etaient excelentes et tres copieuse. L'andouillete (de veau, oui oui) et les oeufs sauce meurette etaient parfait ! 
"
638,Jacques M,jacquesm930,12 décembre 2017,"Merveilleux moment, excellente cuisine et accueil plein de bon humeur",5.0,friends,44,"Testé un jour de forte affluence le samedi 9 décembre, l'accueil a été des plus agréable avec beaucoup d'humour et de prévenance. Service efficace, spécialités locales très bien cuisinées. Nous avons mangé en entrée saucisson chaud ensuite quenelle de brochet gratinée et tarte à la praline. Si nous avons l'occasion de retourner à Lyon nous ne manquerons pas de goûter d'autre spécialités."
639,Sabine P,169sabinep,12 décembre 2017,Une merveille !,5.0,none,68,"J'y suis venue avec des amies Lyonnaises, qui ne voulaient pas m'emmener dans un bouchon pour touriste ...
Très bon accueil, malgré la file d'attente (c'était sans réservation samedi 9 décembre). Nous avons attendu que des places se libèrent et la serveuse venait régulièrement nous informer ! Enfin notre tour est venu, salle très chaleureuse, et des plats super savoureux : andouillette divine, quenelles fondantes, salade lyonnaise ... Une merveille ! "
640,MONIQUE DE RUEIL MALMAISON,MONIQUE92500,11 décembre 2017,TRÈS BIEN,4.0,friends,160,"Nous y sommes allés le samedi 09 Décembre pendant la Fête des Lumières. Malgré une clientèle nombreuse, l'accueil a été très chaleureux. Pas d'attente entre les plats et nous avons pu prendre notre temps malgré une file d'attente importante à l'entrée de l'établissement. Les plats étaient copieux et bons.
Seul regret un menu unique (nous n'avons du coup pas pu déguster le tablier de sapeur) mais ce choix de menu unique pour des raisons pratiques se comprend."
641,Thierry G,865thierryg,9 décembre 2017,Lumière,4.0,family,132,Pendant les fêtes de ie lumières.  Plus de réservation possible et c est pas plus mal. Bon accueil. Bonne ambiance en début de service. Merci phiphi. Meme menu que l annee dernière.  Faut remettre la recette de la tarte au pralin. Cette annee. Trop de crème sucrée 
642,Maëva,Maedcld,8 décembre 2017,Très belle surprise,5.0,friends,16,"Jeudi midi, jour de la fête des lumières, nous avions pas pensé à réserver un restaurant, on a été conseillé par un autre bouchon pour venir ici. Et quel beau conseil ! 
Lieu authentique, très convivial, on mange tous sur une grande table avec des gens qu'on ne connait pas.
Menu de la fête des lumières à 31.50€ très bon rapport qualité prix avec des plats typiques et excellents ! On découvre la gastronomie lyonnaise avec grand plaisir !
Service irréprochable, pas d'attente malgré le monde, et serveur avec un humour qui fait passer un très bon moment. 
Ravie d'y avoir été, je recommande vivement cet endroit !"
643,Lily K,948lilyk,6 décembre 2017,Super bon moment,5.0,couples,4,"Le service était génial, dans une ambiance très détendue et très amicale.
Tous les plats avaient l air très bon, difficile de faire un choix.
Très très satisfait de notre soirée et très bonne dégustation.
J'ai adorée la tarte praline"
644,natdu25,natdu25,5 décembre 2017,Bof bof,1.0,friends,177,Le restaurant est plein plein du coup les serveurs sont énervés presses peu convivial. Voir agressif. Les plats sont copieux et bons mais pour le prix il y a mieux.....
645,Gérard H,538g_rardh,3 décembre 2017,Bouchon lyonnais gastronomique et sympa,5.0,none,158,"Un bon bouchon lyonnais à deux pas de la cathédrale St Jean. Le vin au pot est meilleur que la moyenne (St Joseph etc). Les excellentes spécialités lyonnaise (quenelle, gâteau de foie) ou traditionnelle (foie gras, tête de veau) se mêlent à des créations délicieuses du chef (potage de lentilles à la crème). Les desserts sont à la hauteur du reste. Le service est efficace avec en plus une bonne dose d'humour. Je recommande "
646,michel p,710michelp,3 décembre 2017,"A part l'accueil et le service, rien d'extra ordinaire",3.0,friends,179,"nous sommes allés dans ce restaurant avec des collègues de travail un jour à midi.
L'accueil est très sympathique, nous avons pris le menu à 29,90 euros, menu assez cher pour ce qui est proposé par rapport à d'autres bouchons du quartier.
une salade lyonnaise correcte mais en quantité réduite, la tête de veau était réchauffée au four hors de son bouillon, résultat ; un produit collant et trop sec.
Le service est sympathique, l'ambiance est bonne mais cela ne suffit pas à donner envie d'y retourner."
647,bb h,bbjmnrv,3 décembre 2017,superbe ambiance,3.0,family,32,"le plus ,des serveurs chauffeurs de salle au top ; oeuf meurette merveilleux; la petite attention au dessert avec le cierge lumineux pour l'anniversaire de on fils avec une salle reprenant en choeur joyeux anniversaire.
le moins : nos tabliers de sapeur d'une épaisseur de 1 cm , trop cuits donc secs ,cela fut une immense déception"
648,Pierre B,pierreb535,2 décembre 2017,Repas en sous sol réconfortant,4.0,business,1502,Bel accueil souriant et blagueur. Places au sous sol très calme. Bonne salade lyonnaise avec des morceaux de lard généreux . Apéritif maison avant mais avec du porc grillé avec une texture et un goût moyens..pour les papilles. Bonne quenelles de brochet avec sauce excellente. Accompagnement riz sans plus dommage! Tarte pralinée déconcertante un peu chewing gum et trop sucrée. Dommage car le goût praliné disparaît. Service très sympathique et blagueur. Un café et vous êtes revigorée.  A faire.
649,ENZO0674,ENZO0674,1 décembre 2017,bouchon traditionnel,4.0,couples,267,une fois pensez à réserver très bon accueil servie rapide cuisine de bouchons maîtrisée un rapport qualité prix un peu cher mais avec le sourire de la serveuse tout passe pour le mieux a découvrir
650,JeanJacques64,JeanJacques64,28 novembre 2017,Authentique,5.0,business,29,"Nous avons chercher un bouchon Lyonnais authentique. Notre choix s’est arrêté sur celui-ci. Et très honnêtement c’était le bon choix.
Cadre super, je vous conseille la salle du haut, le cadre est top. Sur la carte on retrouve les incontournables de la gastronomie Lyonnaise.
Le service est  parfait et les tarifs corrects."
651,Mailys,mailysf2014,26 novembre 2017,Convivialité,5.0,friends,67,"Accueil chaleureux des serveurs et carte typique des bouchons lyonnais. Tous les plats étaient excellents de l'entrée au dessert. Mention spéciale pour la succulente sauce accompagnant la quenelle. 
Ps : pensez à réserver dans la salle du bas qui a beaucoup de charme avec ses voûtes en pierre et à venir tôt (le service peut être long).. "
652,AudreySardine,AudreySardine,19 novembre 2017,Typiquement délicieux !,5.0,couples,8,"Les plats ont ravi nos papilles, nous avons apprécié le cadre (les citations du jour sur les vitres nous ont faites sourire, surtout celles des marseillais ;-)  )les serveurs toujours adorables au vu de l’affluence; rapidité sans vous expédier dehors. 
Rien à redire! :-)

PS: nous avons mis en application la cotation du jour « Ici pas de wifi, votre meilleur wifi est votre voisin de table »; ainsi pas de portables à table, nous avons fait la connaissance de nos voisines de tables 👏🏻😁"
653,Gerard T,499gerardt,17 novembre 2017,Pour les touristes...,3.0,friends,14,Déjeuner ce midi à deux . Que des tables de 4 que vous êtes obligé de partager. Une seule personne est arrivé!! Un américain très sympathique ( une chance) et parlant très bien le français . Mais pour une andouillette avec trois pommes de terre et quelques carottes en petits morceaux. Un dessert deux cafés et un pot de beaujolais nouveau. Le tout pour 70 euros. En temps que Lyonnais j’appelle cela un piège à touristes. Notre réflexion à tous les deux : bon il fallait connaître pour ne pas y retourner.
654,brmg71,brmg71,15 novembre 2017,Que du bonheur,5.0,couples,26,"Bien reçu dans une bonne ambiance.
Les repas sont typiques et trés bon.
Nous reviendrons avec plaisir"
655,lyopuutjjjjj.,lyop,15 novembre 2017,fameux plat du jour !,5.0,business,28,Un magnifique foi de veau persillade dans la tradition lyonnaise en plat du jour ! assiette généreuse et service irréprochable dans une bonne ambiance de bistrot. A chaque fois (de veau) c'est un régal!
656,annie l,anniezazie,14 novembre 2017,pas extraordinaire du tout ! décevant et cher,3.0,none,33,"nous voulions découvrir un vrai bouchon:, effectivement l'ambiance est là, il y a du monde, on est assis à la même table que d'autres clients, tout cela est fort sympathique mais, mais, que dire de ce qu'il y a dans l'assiette? nous avons pris le menu à 24,70 euros; crème de lentilles servie tiède, puis gâteau de foie de volaille également servi beaucoup trop tiède avec les mêmes accompagnements quoiqu'on prenne comme plat principal (riz courgettes) et enfin faisselle de fromage blanc.... Bof bof !! est il si difficile de servir dans des assiettes chaudes ? nous avons mentionné la ""non chaleur"" des plats mais c'est resté lettre morte:dommage! nous n'y retournerons pas à notre prochain passage à Lyon"
657,Guirrec Daniel,guirrecdaniel,13 novembre 2017,Bon bouchon lyonnais et bon service,4.0,friends,4,"Les plats sont bons, les serveurs et le gérant sympas, l'ambiance au poil !! Je recommande surtout pour le dîner !"
658,fredoud,fredoud,12 novembre 2017,Bouchons lyonnais,4.0,friends,40,"Super petit bouchons lyonnais 
Cadre authentique, service accueillant efficace et sympathique 
Découverte de spécialités locales très bien cuisinées à un prix raisonnable 
À recommander "
659,Véronique B,v_roniqueb643,9 novembre 2017,Découverte,5.0,friends,20,Un restaurant bouchon comme on aime. Un accueil très sympathique et un service efficace. De bons plats qui ravivent nos papilles. On y mange dans une salle bien décorée avec de jolies citations. Bref je recommande!
660,Sophie M,562sophiem,6 novembre 2017,Excellent,5.0,couples,2,"Un des meilleurs bouchons, joliment décoré, du personnel très serviable, une ambiance agréable!
La qualité des produits dans l’assiette est indéniable et le chef assure! Je recommande ++++"
661,Christine M,M5648MCchristinem,6 novembre 2017,Déjeuner en famille en famille,2.0,family,1,"Service très long (1 heure pour un plat). Prix élevé pour une qualité médiocre. Réflexion du patron quand nous faisons part du délai d'attente ""le cuisinier n'a que 2 bras"". A éviter donc"
662,Ana S,anasY7811PA,5 novembre 2017,"Pas mauvais, mais service à revoir",2.0,friends,30,"Avec des amis étrangers, nous avons décidé de tester ce bouchon situé en plein cœur de Vieux Lyon. 
A table, en parlant une langue étrangère je crains l’arnaque et en commandant un pichet de Saint Joseph, la déception est au RDV : c’était bien un banal Cote du Rhône. Pas de problème pour l’échanger, le serveur reconnaît l’erreur. C’était peut-être une confusion, j’ai du mal à y croire. Bien dommage car le resto est sympa..."
663,frederic S,556frederics,4 novembre 2017,Bon mais pas exceptionnel,3.0,couples,42,"Authentique bouchon Lyonnais à la réputation bien assise. Le serveur du caveau est sympathique à souhait et la table collégiale permet de discuter avec des voisins et échanger des tranches de vies. Cote assiette, l’araignée de cochon est trop cuite. Du coup la viande est caoutchouteuse. Les pommes de terre à l’eau avec le saucisson ont un goût de réchauffé proéminent. L’ambiance générale fait que l’impression au final reste positive."
664,Bouiller.s,bouille33,4 novembre 2017,Premier repas dans un bouchon!,4.0,family,114,"Restaurant typique.Personnel sympathique. La cuisine est ouverte sur les convives séparé par une vitre. Bonne cuisine les quenelles un régal !
Petit bémol la chaleur dans le restaurant. Bonne adresse."
665,Tleou,titido,4 novembre 2017,De tres bons plats mais un service à revoir,4.0,friends,417,"Nous étions 4, la décor et l ambiance du restau sont tip top. Les plats sont délicieux et copieux. Coté dessert, nous avons pris un fondant au chocolat avec sa crème anglaise et la on se trouve avec une crème liquide, très liquide, translucide à la texture douteuse. Ca ne donnait pas envie d’en manger. Nous avons fait retourner le plat et pris le fondant sans crème.  Commentaire de la serveuse «  cest comme ca »
 Coté service cest mitigé, certains serveurs sont sympas d’autres un peu moins. On demande de nous prendre en photo avec les plats « pas le temps ... », une autre serveuse passe et nous vois galèrer en selfie et elle nous propose de la prendre pour nous. 
Au final super ambiance, des plats généreux et bons mais service à revoir en parti. "
666,SOPHIE B,E8702MVsophieb,3 novembre 2017,Déjeuner chez les Gones,4.0,couples,29,"Le menu à 29€ était très bon (saucisson chaud+tablier de sapeur+café gourmand). Les serveurs mettent l’ambiance mais oublient parfois de s’occuper des clients, le service est un peu long. Mention spéciale pour la tarte aux pralines."
667,thierryetadaarsac,thierryetadaarsac,2 novembre 2017,Adresse à retenir !,4.0,friends,12,"Super établissement que je recommande. Les plats typiques sont excellents. Nous nous sommes régalés. L'ambiance bouchon lyonnais est au rendez vous. La proximité à table avec les autres convives facilite les échanges. En résumé, nous avons passé un très bon moment. Réservation indispensable."
668,Aurélie L,aur_liel840,1 novembre 2017,Fuyez !!!,1.0,family,4,"Très mauvaise expérience ... Sauvez-vous !
1H d'attente après une entrée réchauffée, viande archi-cuites et légumes froid ... 
On fait la remarque au serveur qui rétorque : eh, c'est pas de ma faute, c'est le cuisinier !
Ok ... Rapport qualité/prix catastrophique, même pas un café d'offert avec plus de 1H30 d'attente avec un petit de 2 ans ..."
