,user,user_profile,date_review,title,rating,type_visit,num_contributions,review
82,Laura B,LABEDG,4 novembre 2021,Topitop,5.0,couples,36,"Parfait, accueil chaleureux, repas excellent, service rapide. L'ambiance feutrée, le serveur est très sympa et à de bon tips pour lyon. Et le service continue l'après midi."
83,Amélie D,am_lied212,3 novembre 2021,Je recommande,5.0,friends,63,"Très rapide, très copieux et surtout très bon! Un choix de carte pour tous les goûts, et même un menu enfant.
Je recommande sans hésitation "
84,christophe b,strof33,26 septembre 2021,"Simple mais goûteux, et très agréable",5.0,business,39,"Simplement bon, simplement et agréablement accueilli, servis. 
Pour y avoir dîner 2 soirs d’affilée, cela semble la norme. 
Bravo"
85,Nicolas ML,nicolasmchl,19 septembre 2021,Belle adresse sur la place Carnot !,5.0,friends,492,"Très bonne adresse qui remplit pas mal de cases :
- cuisine de qualité et savoureuse
- service rapide
- des menus abordables
- une décoration sympathique
- deux terrasses sympathique dont une sous les arbres de la place Carnot."
86,guillaume25000,guillaume25000,4 juillet 2021,"Rapide, efficace, sympathique, très bon.",5.0,couples,32,"Très bon repas (boeuf mariné et gratin de ravioles forestier), personnel sympathique, service agréable et efficace. 
Je recommande"
87,Guenillette,Guenillette,2 juillet 2021,Très belle découverte !,5.0,friends,47,"Excellentes assiettes, apéro « le Micheline » excellent, serveurs très sympas, service rapide, endroit agréable. A recommander !"
88,Françoise L,fran_oisel744,2 juillet 2021,repas amical,4.0,none,46,"très bon restaurant : accueil très sympa, choix de plats, vraiment bien ; je recommande. Le seul défaut : un peu bruyant, on ne s'entendait pas parler et de plus, avec les masques !!!"
89,DeLyonFrance,DeLyonFrance,11 juin 2021,Chez Micheline,3.0,couples,18,"En terrasse, agréable. Carte simple et classique. Un peu cher. Plats bien préparés, service avec le sourire."
90,luciegimenez,luciegim,27 mai 2021,bon emplacement et bonne cuisine,4.0,family,185,"Super restaurant sur la place carnot ! 
Les tapas à partager sont très peu copieuse, par contre le plat l’est vraiment !! le rapport qualité prix est très correct, la terrasse est très bien placé le coin est super.
Je recommande"
91,Breizhcec,Travel08408709704,19 octobre 2020,Notre cantine quand on vient voir notre fille a lyon,5.0,family,4,"Une adresse incontournable à Lyon avec une carte simple mais excellente, des frites maison délicieuses. Aujourd'hui un saumon sur lit de poireaux avec un risotto : un vrai bonheur pour les gourmands que nous sommes.
Nous reviendrons lors de notre prochain séjour à lyon pour une 6ème fois sans soucis."
92,Ritchicloud,ritchicloud,5 octobre 2020,Très belle découverte,5.0,none,46,"Un bon restaurant Place Carnot, non je ne vois pas ?! Mais si ""Chez Micheline"" .
Il n'y a pas de secret lorsque le restaurateur et son équipe aime ce qu'ils font cela se ressent dès l'ouverture de la porte du restaurant à l'adition. 
Nous avons passé un agréable moment et surtout bien mangé (là est l'essentiel)."
93,Foodporn,Gastronome16,4 octobre 2020,Client regulié,4.0,none,22,"Je suis un habitué de l'établissement, le cadre et la décoration sont agréable et moderne. 
En cuisine le chef nous régal et les desserts de Nelly sont excellents et gourmands (surtout le fondant au chocolat).
Côté salle Max est toujours souriant et Flo se montre passionné en véritable maitre de maison. 

Petit bémol quant à la fidélisation client..."
94,Martine G,321martineg,23 septembre 2020,Très bon,3.0,none,48,Repas très bon mais un bémol pour le service oublié de lancer la commande de notre table donc attente très longue
95,bernard c,020857,5 septembre 2020,BON RAPPORT QUALITE/PRIX,5.0,none,20,"Accueil sympa,salades copieuses et succulentes,plats cuisinés avec des produits frais,desserts variés et cafés gourmands agréables,en résumé tout est bien."
96,Delia M,Delia-Mell,26 août 2020,Très bon,4.0,family,73,"C'est très bon et les produits sont frais. De plus, la déco est originale et soignée. Seul bémol : nous y sommes allés un soir où l'ardoise ne proposait pas grand chose... "
97,Lucille S,669lucilles,18 juillet 2020,Excellents plats du jour,5.0,friends,14,"Produits frais, simples mais cuisinés avec finesse. Très sud dans l'esprit : pâtes, risotto, légumes divers, huile d'olive "
98,Cloé D,cloe_d2401,9 juillet 2020,Excellent !,5.0,family,12,"Une nourriture fait maison, délicieuse, un rapport qualité/ prix excellent. Un personnel accueillant et un environnement chaleureux. Excellent ! Nous recommandons."
99,Polo,ppolo12,18 février 2020,"Très bon, je vais fréquemment",5.0,none,5,"Très bon, je vais fréquemment chez Micheline et je n’ai jamais été déçus.
La qualité et la variété des mets est satisfaisante et la cuisine y est bien faite. Un lieu calme faisant de la cuisine traditionnelle.
Je recommande "
100,Simon,Simon6907,12 janvier 2020,Belle découverte place Carnot.,5.0,couples,5,"Belle découverte place Carnot. Choix limité, gage de qualité ! Nous avons très bien mangé dans ce petit restaurant à la décoration vintage très réussie ! Prix raisonnables. 
Habitant le quartier, nous y retournerons volontiers ! "
101,piotrek,376pierreh,21 décembre 2019,Belle surprise,5.0,family,43,"En visite sur Lyon, nous nous arrêtons place Carnot et rentrons chez Micheline bistrot restaurant. Sourire à l accueil, au service, belle table. Andouillette a la moutarde très bonne et thon tataki excellent. Nous reviendrons. Merci pour l accueil, bonnes fêtes à tous. Beaujolais family."
102,Estefilabe,Estefilabe,14 décembre 2019,Bon et copieux,5.0,couples,131,"En déplacement professionnel c'est par hasard que nous nous sommes retrouvées à cette adresse pour dîner. 

Très bon accueil, des plats savoureux et copieux et tout fait maison. 

On a très bien mangé et été agréablement surprises. Je recommande cet endroit. Très bon rapport qualité prix."
103,MrsBill,MrsBill,10 octobre 2024,Absolument fantastique,5.0,friends,133,"Recommandé par l'hôtel. 
Nous sommes à Paris depuis 3 jours et nous avons pensé avoir de bons repas. 
Haut la main c'était 10 / 10 

Flovour, présentation, valeur, service. 
Pate pour commencer suivi de Tuna Tataki, Aperol Spritzers. 
Hmmmmm"
104,Nicholas C,nicholascR6492UC,5 septembre 2024,Buzzy.,4.0,friends,110,"Vraiment sympathique, restaurant de quartier populaire. Vif décontracté avec un personnel vraiment serviable. 
Menu limité mais 'coeureux'. Portions énormes et vraiment savoureux."
