,user,user_profile,date_review,title,rating,type_visit,num_contributions,review
175,Nene69,Inesden,2 mars 2023,Beau décors,5.0,friends,1,"Dès l’entrée, nous sommes entrain de voyager. Le lieu est bien décoré, la musique en arrière plan nous met dans l’ambiance. Personnels très accueillants et avec de bons conseils pour une première fois. Nourriture délicieuse et consistante. Je reviendrai avec plaisir. 
A noter que les jeudis, vendredis et samedis soir vous pouvez venir danser dans la salle cacher au sous sol."
176,H20,helenarH271QC,2 mars 2023,Très bon moment passé entre amies !,5.0,friends,2,"Je recommande l'Empanadas Club, tout est délicieux, le personnel est très chaleureux et aux petits soins et il y a une super ambiance. 
"
177,baetz benjamin,Flyer61682010395,9 février 2023,Super découverte nous reviendrons,5.0,business,2,"Super découverte nous reviendrons ! Personnel très agréable et plats au top dans une super ambiance.
Je recommande vivement :)"
178,Franco A,frannselmo,10 janvier 2023,Incroyable !,5.0,friends,1,"100% recommandé, ambiance argentine super sympa. Testez l’empanada carne vous allez kiffer ! Les serveurs très attentionnés aussi, franchement bravo"
179,isa p,982isabellep,8 janvier 2023,Jolie découverte ❤,5.0,family,141,"Pour fêter mes 50 ans, ce petit restaurant est une jolie découverte.
Un dépaysement total.
Les empanadas nous ont transporté en Argentine. 🇦🇷
Personnel très gentil.😇
Le service est rapide.
Un vrai bon moment.👍"
180,alyssia,a18xly,14 décembre 2022,INCROYABLE,4.0,couples,67,"Vraiment une bonne découverte, les employés très gentil et parlant espagnol.
Les empanadas sont très bon avec un large choix, je vous conseille d’en prendre un de chaque.
Je recommande fortement !"
181,Manevan,Manevan,1 décembre 2022,C’est mignon mais ça devient vite cher!,4.0,friends,57,"Très sympa pour un apéro mais un apéro seulement ! C’est notre erreur! D’abord parce qu’il y a un bruit de malade dans la salle!! Et puis Parce que si vous y manger avec appétit ça va finir par vous coûter aussi cher qu’un resto et vous aurez encore faim après ! 2 bouteilles de vin, 4 empanadas+ 1dessert par personnes = 140€ a 4, et ouais! Mais Pour une mise en bouche c’est parfait, c’est convivial, cosmopolite, les serveurs sont canons et très gentils. Les empanadas sont très bons, ils arrivent numérotés sur le côté pour les reconnaître bref c’est très mignon!"
182,christophe M,christophemC5172GO,27 novembre 2022,Très découverte,5.0,couples,11,"Très belle découverte de ce restaurant où les serveurs , le cadre ainsi que la musique d ambiance sont très sympathiques
Accompagné d'excellents empanadas
A conseiller pour découvrir une cuisine différentes "
183,Dulce D,dulced245,22 novembre 2022,Un peu d'Argentine en plein Lyon,5.0,solo,14,"Endroit très agréable avec sa déco jeune et colorée et ses tables hautes. 
Empanadas délicieuses, bières argentines et salades bien fraîches. Le tout, avec un excellent rapport qualité prix."
184,Camille R,E1425RGcamiller,20 novembre 2022,Super !,5.0,couples,4,"Super bonne expérience ! Le concept est simple et efficace ! Les empanadas sont excelentes. 
Super bon accueil 
Je recommande !"
185,Elodie L,891elodiel,6 novembre 2022,Parfait,5.0,couples,86,"Nous avons goûté 7 empanadas , pris une salade et bu des coca Argentin. Tout était délicieux. De visite a Lyon nous sommes ravie d’avoir découvert se restaurant chaleureux avec de gentils serveurs , la personne qui nous a tous expliqué était au top . Nous reviendrons et bien sur que je recommande cet endroit"
186,Corinne KUREK,CorinneKUREK,3 novembre 2022,Une première et pas la dernière à coup sûr,5.0,none,14,"Accueil charmant et souriant, produits frais et très goûteux, ambiance sympathique et simple, un service rapide, gentil et efficace. Cette première expérience avec nos deux grandes ados fût un vrai moment de plaisir. A consommer sans modération. Le petit plus : parking des Terreaux à 2 mn."
187,Julie J,Z3359OTjuliej,15 octobre 2022,Visite,5.0,friends,2,Super bon merci et bonne ambiance parfait ! Un poil trop de bruit mais pas si dérangeant et les boissons chères
188,Lola A,lolaa371,9 octobre 2022,Ambiance latine avec des empanadas de qualité,5.0,couples,76,"Cadre sympa qui nous plonge directement dans une ambiance latine, a cela s’ajoute les serveurs qui parlent espagnols.
Les produits sont excellents y compris les desserts et tout ça pour un prix très correct. 
Je vous recommande de prendre la version originale du coca qui nous permet de goûter un coca authentique.
Cependant, l’attente entre le plat et le dessert fut beaucoup trop longue, nous avons appelés plusieurs fois le serveur mais le délai entre les deux a été de 20/30min."
189,Jordan B,jordanbJ7214SQ,29 septembre 2022,SUper,4.0,friends,4,Restaurant exemplaire d excellente qualité service très professionnel et sympathiques le tout dans un cadre plaisant et chaleureux. Je recommande
190,Vincent V,nemesys80,28 septembre 2022,L’endroit parfait pour une soirée entre amis,5.0,solo,13,"L’adresse parfaite pour partager un moment convivial entre amis !
Le cadre est très sympa et dépayse tout de suite. Le service est tout simplement parfait (amabilité, conseils, disponibilité), ce qui est rare dans un établissement où on ne laisse pas la moitié de son salaire dans la note finale…
Le concept est simple, efficace. Les empanadas sont délicieux et on n’hésitera pas à en tester le maximum :)
Un vrai bon moment, un super endroit que je recommande à tous !"
191,Laurent2155,Lolo2155,23 septembre 2022,Un avant goût de lArgentine,5.0,couples,8,"Comme d'habitude, parfait. Cette fois, pris en commande pour manger à la maison. Bien servi, bien présenté, copieux, bref, à recommander.
Tout est bon"
192,éric E,535_rice,22 septembre 2022,Dépaysant et excellent,5.0,none,128,"Arrivés juste avant l'ouverture  (19h) accueil très sympathique, service rapide; les 8 sortes d'empanadas proposées couvrent largement les préférences de chacun. Bien garni et excellent. Décoration de la salle originale et typique. Il semblerait qu'il est préférable de réserver. Nous y reviendrons."
193,Romain A,tiromh,27 août 2022,"Super, à refaire à l’occasion !",4.0,friends,97,"Super acceuil, personnel très agréable, les empanadas vraiment bon. La rue n’est pas trop passante, donc terrasse sympathique en cette saison. A refaire sans hésiter à l’occasion"
194,Victor S,victorsR5237HA,27 août 2022,Très bien.,5.0,family,1,"Très très belle découverte, décoration originale et à l’image du pays. Repas en accord avec le pays, empanadas délicieux et varié ainsi que des végétariens. Le service exemplaire et simple. Très bon restaurant rien à redire."
195,Frederic,Sightsee19275558485,22 août 2022,Bonne surprise,5.0,couples,11,"Intrigués par le classement Numéro 1 à Lyon, et amateurs d’empanadas, nous tentons l’expérience. Bonne pioche, c’est une cuisine simple et goûteuse, et les serveurs sont très sympathiques, on y est retournés, et on y retournera."
196,billjack69250,billjack69250,16 août 2022,Un peu d’Argentine en plein Lyon,5.0,family,13,Restaurant avec décor typique et spécialités argentines. Un bon choix d’empenadas de bière et de vins argentins. Très belle expérience.
197,sophie m,T4736HQsophiem,16 août 2022,Extra !,5.0,family,2,"Nous avons très bien mangé. Le"" tout fait maison"" était très coloré, savoureux. Les cocktail très équilibrés. Nous reviendront!"
198,Caroline,Caro2897,15 août 2022,Parfait,5.0,couples,4,"Bonjour, 
Moi et mon compagnon visitons la France , originaire d’Australie, nous avons tester certains restaurant à Lyon. 
Nous avons adorée notre repas chez vous. 
Continuez ainsi."
199,Hortense D,hortensed956,14 août 2022,Rien à redire,5.0,couples,10,"Nous sommes allé testé par curiosité vu son classement et n’avons pas été déçu! Tout était excellent, du service chaleureux au repas savoureux et généreux. Je suis fan du concept, de la scénographie du lieu au détail des numéros sur les empanadas, tout est parfait et typique argentin!"
200,Véro W,v_roa416,14 août 2022,N'hésitez pas,5.0,couples,32,"Excellente adresse!
Quelle magnifique surprise! Ambiance, accueil et surtout cuisine. Tout et parfait! 
Un goût d'Argentine fin et précis. 
On a adoré. "
201,Léa S,leaaaaaso,13 août 2022,Excellent !,5.0,friends,1,"Service impeccable et rapide, la nourriture était délicieuse, endroit tres charmant et serveur.se.s chaleureux et accueillants !"
202,bruno b,U3578LTbrunob,31 juillet 2022,Super adresse,5.0,couples,13,"Le concept est super simple.
Et cela leur permet de servir des plats super bon, d'une très bonne qualité, et le tout avec sourire et efficacité.
Je recommande cette adresse de plat argentin."
203,Sophie,sophiemrtz,30 juillet 2022,Excellent très belle découverte !,5.0,couples,8,"Très belle découverte !! Tout est excellent les empanadas, les desserts ainsi que le personnel hyper aimable et joyeux !"
204,Elodam38,Elodam38,26 juillet 2022,Une belle adresse qui vaut vraiment le détour,5.0,couples,62,"Superbe adresse 
Tout est fait maison 
8 sortes de empanadas tous aussi bons les uns que les autres,pour ceux qui aiment la viande comme pour les végétariens . 
Personnel agréable, avenant et rapide 
Tout était parfait pour passer un bon moment !!!"
205,Xavière L,xavi_rel2016,25 juillet 2022,A mì me gusta Empanadas Club 🥰,5.0,business,19,"De passage à Lyon pour le boulot, j’avais envie de tenter quelque chose de nouveau et de pas forcément très cher. 

Après un petit passage sur Tripadvisor , j’ai vu cette adresse qui m’a tout de suite interpellée ! J’ai proposé à mon patron , et la soirée était bookée 🤩

Cadre super sympa, accueil souriant, des explications pour la commande et des recommandations pour les boissons… bref tout était parfait 😍 

Les empanadas arrivent vite, chaudes , et super bonnes , avec une vrai bière de la bas , et l’envie d’en recommander même si le ventre est complètement full 😭 

Les desserts ont donc été pris à emporter pour être déguster plus tard , et la surprise a été parfaite une nouvelle fois. 

Mon seul regret ? Manque un peu de musique latine pour finir de nous transporter, mais ce n’est rien par rapport à l’excellent rapport qualité / prix / lieu / gentillesse…… 

A quand une adresse à Nantes SVPPPPPP ?"
206,Cynthia R,cynthiarC8005PV,15 juillet 2022,Super !,5.0,couples,21,Super restaurant ! Nourriture de qualité avec plusieurs choix d'empaniadas salés. Un grand choix de boissons et quelques desserts. Très bon moment passé. L'équipe est très accueillante. J'y retournerai !
207,Sébastien B,sbar5000,14 juillet 2022,Belle découverte,5.0,couples,94,"Très original et très bon nous avons passé un très agréable moment .
Accueil très sympa avec toutes les explications pour faire son choix .
A refaire"
208,Karene IsaCat,826karenei,13 juillet 2022,Découverte gustative,4.0,couples,32,"Si rien ne peut concurrencer la gastronomie Lyonnaise, il est rare de découvrir d’autres contrées. C’est pourtant le cas ici , avec ces empanadas déclinées sous 8 saveurs différentes.

L’ambiance du lieu est jeune , dynamique et sympathique.
Pour le prix d’un plat , vous dégusterez une petite salade , accompagnée de 3 empanadas , et un dessert .

Les gourmands comme nous , voulaient goûter tous les parfums . 
C’est copieux , vraiment. 

En conclusion .
C’est original, très agréable, bon , pas cher ( prix corrects pour les vins) 
A découvrir"
209,Marie P,mariepA4776MM,7 juillet 2022,Un voyage en Amérique du sud,5.0,friends,1,"Un délice ! Parfait pour manger sur le pouce, service très agréable ! Le concept est sympa, je recommande !"
210,gilles B,gillesbS8606UB,6 juillet 2022,EXTRA !,5.0,couples,1,"serveuses jolies et souriantes ! c'est délicieux empanadas et rosé super 😊
merci pour la découverte, le goût et l'accueil "
211,Lydia,Hungrydia,4 juillet 2022,Un air d'Argentine à Lyon,5.0,none,19,"Super atmosphère (décoration soignée, musique latina) et très bonnes empanadas. Je recommande vivement !"
212,Clem L,501cleml,1 juillet 2022,Qualité au rdv !,5.0,couples,11,"Petite adresse tentée grâce aux avis sur TripAdvisor et une super découverte ! Tout est fait maison, on n'avait jamais vraiment goûté les empaladas et c était une très belle surprise , du coup on en a pris un de chaque sur la carte et 3 desserts sur 4, on a tout partagé et on s est régalés .
L accueil et le service au top avec un grand sourire , très avenants , il a fallu qu on vienne de Marseille pour tomber dessus alors que l on apprend qu il y en a un à Aix ? le rdv est pris en rentrant !
Merci pour tout 
Adios 😊"
213,Thierry,thierryf77,28 juin 2022,Vraiment bien,5.0,business,4,Merci !! Cuisine service accueil !! Rien à dire!!! Nous reviendrons avec les collègues !! Bonne surprise et bon conseils!!
214,gregoire B,gregoireb730,26 juin 2022,"Original, délicieux et très agréable!!",5.0,couples,3,"Très immersif, une super ambiance avec un service original et très agréable, des empanadas très bons et diversifiés, servis rapidement et des cocktails géniaux! Tout ça pour un prix abordable et modulable en fonction de votre faim🤩"
215,Myriam M,Moumoudetoulouse,22 juin 2022,L’argentine dans vos assiettes,5.0,couples,12,"Très satisfaits de notre passage 
Une belle découverte pourquoi sait apprécier les mets hors du commun!"
216,Kevin S,Z9413HYkevins,20 juin 2022,Délicieux,5.0,family,12,"Délicieux, service et personne irréprochable 
Merci milles fois notre passage à Lyon nous manques déjà. Dès nous revenons nous repassons !"
217,Antoine M,I1495VLantoinem,16 juin 2022,Excellent !,5.0,couples,1,"Super restaurant dans lequel on ressent toute la passion de la culture Argentine. Les plats sont super bons et beaucoup de choses sont très bien penses (carte, prise de menu, numérotation des plats, etc.)
J’ai adoré !"
218,Elie M,eliemonge,12 juin 2022,Bienvenidos a Buenos Aires,5.0,friends,3,"Accueil super chaleureux, empanadas et cocktails tres bien préparés. La décoration est rapportée d’Argentine par le propriétaire, chaque détail du lieu est réfléchi !"
219,emiliepompelle,emiliepompelle,12 juin 2022,Un des meilleurs endroit pour partager un bon moment !,5.0,friends,6,Incroyable ! Un accueil merveilleux et une cuisine vraiment excellente! Un moment avec nos amis parfait ! Nous recommandons vraiment la terrasse est au calme et à l abris de la chaleur.
220,lucasbter,lucasbter,8 juin 2022,On mange très bien Accueil très chaleureux,5.0,friends,3,"Très bon endroit je conseille vivement c’est très bon!! 
L’accueil est très sympathique et le personnel très sympa!! Je recommande vivement"
221,Andréa C,275andr_ac,7 juin 2022,un incontournable lyonnais,5.0,friends,22,un incontournable depuis longtemps. Je ne peux que recommander Empanadas pour son accueil chaleureux et ses délicieux empanadas (mentions spéciales pour les serveurs)  😋
222,Oceanne M,945oceannem,1 juin 2022,Très bon !,5.0,couples,1,"Fortement recommandé, un choix varié pour les différents régimes alimentaires. Nous en avons testé 7 ainsi que 2 desserts et toutes les recettes proposé sont réellement uniques"
223,mickael p,mickaelp117,1 juin 2022,Excellent,5.0,couples,9,De très bons Empanadas argentins. Une vraie surprise dans une petite rue Lyonnaise. On reviendra avec joie
224,jc892017,jc892017,29 mai 2022,"Jolie découverte,  dépaysant",5.0,family,31,"Nous avons testé l'ensemble de la carte. 
Une petite erreur sur la commande,  rien de grave, largement compensé par l'accueil chaleureux et réactif.
Le choix est varié, et il est appréciable de tester toutes les saveurs proposées ! Repas très convivial."
225,Mégane B,68m_ganeb,28 mai 2022,Super endroit,5.0,friends,1,"Endroit super, les empanadas sont succulents ainsi que les desserts
Les personnes qui y travaillent sont également tres sympathique"
226,Cécilia B,339c_ciliab,27 mai 2022,Parfait !,5.0,friends,1,"La nourriture était délicieuse, de même pour le service ! Très bonne ambiance, qui vous ramène directement en Argentine"
227,AlixM,AlixMarco,27 mai 2022,Très bien,5.0,friends,3,"Je suis venue suite aux recommandations d’une amie. Et résultat : bonne ambiance, service au top et super plat ! Je recommande également :)"
228,Nicole J,MamieNicoleJ,26 mai 2022,Les meilleurs Empanadas de Lyon !,5.0,family,2,"Tres bonne ambiance, cuisine delicieuse 
 Restaurant adapté pour tous les âges sauf pour danser sur les tabourets !

Mamie Nicole"
229,Mathieu M,mathieumM5382MG,26 mai 2022,Super restaurant,5.0,friends,1,"Les Empanadas sont excellents, tout comme le service et l'accueil. Super Barman et coktails dans une ambiance chaleureuse !"
230,Jerem0857,Jerem0857,21 mai 2022,A découvrir ou re-découvrir au plus vite !,5.0,friends,17,"Une super ambiance et des bons produits !
Les ingrédients parfaits qui me feront revenir !
Un voyage gustatif à venir découvrir ou re-découvrir ! "
231,Antho B,anthob532,21 mai 2022,A faire absolument,5.0,friends,19,Accueil au top ! Restaurant au top ! Nourriture tien à dire et l'ambiance est parfaite !!! ça vaut vraiment le coup d'y passer
232,Matthieu C,matthieucS2459KA,21 mai 2022,Very good,5.0,friends,5,"Très bon empanadas, personnel grave cool, je vous conseille le copetin pour le dessert, super nickel"
233,Caroline H,carolinehX6566RA,21 mai 2022,L'argentine à Lyon,5.0,couples,1,"Super resto avec des produits frais, des recettes maison et variées. Prix très abordables par rapport à la qualité des produits. Personnel souriant et très sympa !"
234,Chloé B,chlo_b724,20 mai 2022,Charmant et sympathique,5.0,couples,10,"Le cadre et l’ambiance est tellement chouette ! Le personnels très accueillant et les empanadas très bonnes ! 
Pour une petite soirée bien sympa en amoureux ou entre amies et famille. Je recommande à 100% ce lieux super cosy ✨"
235,Goyo T,Goyotanguy,20 mai 2022,Excellent accueil,5.0,couples,2,"Nous avons mangé en couple dans ce restaurant.
L’accueil est très chaleureux l’ambiance est dans la continuité de l’accueil et surtout les ampanadas sont succulents. Attention à ne pas avoir les yeux plus gros que le ventre car au bout de 4 empanadas j’étais déjà calé haha. 
Nous recommandons vivement ce restaurant"
236,Annabelle T,annabelle-hiney,20 mai 2022,Yum!,5.0,family,1,"Empanadas trop bonnes, super ambiance et service très chaleureux. Je recommande à ceux qui souhaitent retrouver des saveurs authentiques de l’Amérique latine."
237,Syndi A,syndia2015,14 mai 2022,Meilleurs empanadas de Lyon,5.0,friends,49,"Service impeccable et rapide ; empanadas de choix et délicieux ; tout est fait maison, et les tarifs sont abordables, je recommande vivement ! "
238,Olivia R,V8604NColiviar,14 mai 2022,Une soirée qui fait voyager,5.0,friends,1,"Un très bon moment entre amis ! Les empanadas sont délicieuses ☺️
Le personnel est top ! Je recommande ++++++"
239,Capucine C,831capucinec,14 mai 2022,Meilleur restaurant d’empanadas de Lyon !,5.0,friends,2,"Un excellent restaurant d’empanadas !! 
Le personnel est adorable et les empanadas excellentes, allez y les yeux fermés."
240,Camille D,Camille0812,14 mai 2022,Des empanadas délicieuses 😋,5.0,friends,1,"Un très bon restaurant, les empanadas sont excellentes. Il y a du choix pour tout le monde, même pour les végétariens ! 
L'ambiance est top, un personnel sympathique et un veritable air d'Amerique du Sud. 
Je recommande !"
241,Pierre B,H7677POpierreb,14 mai 2022,"Petite soirée entre amis, accueil très chaleureux et des empanadas de haute volée, autrement dit une belle soirée!",5.0,friends,1,"Petite soirée entre amis, accueil très chaleureux et des empanadas de haute volée, autrement dit une belle soirée en terre ibérique en plein centre de la capitale des Gaules!"
242,Morgane A,24morganea,14 mai 2022,Best place,5.0,couples,7,"Après avoir testée toute la carte , je ne peux que vous recommander cet endroit , pour l’ambiance, la qualité de la comida , et surtout l’accueil (service rapide)  . Foncez les yeux fermés"
243,Marion L,A6055VGmarionl,14 mai 2022,Amazing,5.0,friends,2,L’accueil vaut la qualité des plats 🥰 si on pouvais avoir les serveurs sur la carte ce serait mieux
244,Chloe J,chloejxxxxx,13 mai 2022,Empanadas club,5.0,friends,1,"Très bonnes empanadas et bon cocktails faits maison, bonne ambiance, personnel très sympathique . On recommande! ⭐️"
245,Pierre F,Y227,12 mai 2022,Los quiero un montón,5.0,friends,2,"Le meilleur endroit latino de Lyon ♥️: l’ambiance, les employés, les cocktails, les empanadas et les desserts !!"
246,Inès B,ines_boud,11 mai 2022,Meilleure ambiance de lyon,5.0,friends,1,"Super cocktails 
Super ambiance 
Super musique 
Super cours de salsa
Empanadas delicieux
Super serveurs 😏"
247,Papatwin69008,Papatwin69008,7 mai 2022,L'argentine pour 45 euros à deux,5.0,couples,14,"Une découverte.
Un cadre qui fait voyager, une ambiance conviviale (bon, ok, un peu bruyante, mais dans l'ambiance), un accueil serviable et chaleureux, un dîner au budget plus qu'abordable, et j'allais oublier : c'est très bon.
Ps : essayez les Malbec. L'argentine sait (aussi) faire du vin."
248,vincentcbx,vincentcbx,7 mai 2022,Bonne découverte !,5.0,none,3,"Ma copine et moi sommes tombés par hasard sur ce restaurant. Malgré les nombreuses réservations ce soir là, le serveur nous a vite trouvé une table. Les empanadas, spécialités de la maison, était absolument délicieux ( Mention spéciale pour le Pollo et le Carne Picante) 3 suffiront à vous rassasier même si vous pouvez en recommander à volonté. De plus, le prix est minime face à la qualité des produits et du repas (fait maison !). Il est aussi possible de commander à emporter avec Deliveroo. L'accueil est irréprochable et le serveur très gentil (il nous a offert un shot de liqueur argentine à la fin). Super expérience, à refaire. "
249,Arnaud G,arnaudg501,5 mai 2022,Buen provocho,5.0,friends,7,Une dégustation de qualité avec un personnel très agréable !! Bienvenu en Argentine 🇦🇷 On reviendra pour goûter l'Anielllo 🍷
250,Jc T,160jct,5 mai 2022,Super restaurant,5.0,couples,1,"Personnel chaleureux avec une super ambiance
Et les meilleurs emplacements que j'ai manger
Je recommande fortement"
251,Louise B,loubrouise,30 avril 2022,Friends retrouvailles,5.0,friends,1,Très bon lieu pour partager un repas entre amis. Le choix des empanadas est varié et elles sont très bonnes !! À visiter sans hésiter
252,Marine A,marinea856,30 avril 2022,Incroyable!,5.0,friends,1,"Les empanadas sont exceptionnels et l'ambiance est chaleureuse ! Les serveurs sont au top !
Une adresse de fou !"
253,Leslie S,lesliesF4921FK,30 avril 2022,Belle découverte,5.0,family,4,"Voyage le temps d’un repas en Argentine avec les empanadas. Produit frais et savoureux 
Accueil chaleureux & jolie deco d’inspiration Argentine.
Adresse très sympa en famille ou entre amis"
254,DOSSET O,dosseto,29 avril 2022,Super soirée,5.0,family,1,"Accueil sympathique et souriant.
Les empenedas sont délicieux 
Et il y a même des maillots de foot sur les murs 
Excellente adresse !"
255,Maéva P,974ma_vap,26 avril 2022,Repas entre amis,5.0,friends,1,"Excellent et pas chère ,nous sommes venus à presque 20 et cela n'a pas impacter le service impeccable et l'amabilité des employés.

Recommandations à 100% et bonne appétit"
256,Joran J,joranj561,23 avril 2022,Adresse incontournable,5.0,family,2,"Super accueil, super service, super ambiance, convivialité au rendez-vous et on s'est régalé !!! Une super adresse à faire impérativement !! Bravo à toute l'équipe ! Vraiment au top !"
257,lucie L,lucielH6896AT,23 avril 2022,Excellent moment !,5.0,family,2,"Une belle découverte de la cuisine Argentine ! Nous nous sommes régalés. Le personnelle est très sympathique, à l'écoute et souriant. Un petit avant goût de vacances dans une salle bien décorée et avec de la musique locale. Encore merci ! Nous recommandons cette adresse."
258,malory dijon,Malotte69,23 avril 2022,Parfaite soirée,5.0,couples,2,"Accueil très sympathique, bon rapport qualité/prix, on s’est vraiment régalé !! On reviendra c’est sur"
259,elodie p,elodiep323,23 avril 2022,Fonceeez,5.0,family,1,"Les empanadas sont au top, l'ambiance géniale et les cocktails délicieux !! 
Tout ça pour un prix plus que raisonnable.
Le service est parfait, les serveurs sont accueillants et souriants.
Je recommande ++++ pour une soirée en famille, entre amis ou en amoureux."
260,Antoine P,antoinepL785CA,23 avril 2022,Très bonne adresse !,5.0,family,1,Super bon moment! Service génial et convivial et empanadas excellentes ! L'ambiance est au rendez-vous
261,Clementine,Clementine-et-Alain,23 avril 2022,Excellent!,5.0,friends,3,"Nous allons régulièrement à l’Empanadas Club avec des amis. Ce sont les meilleurs de la ville. Les serveurs sont très sympas, la déco aussi."
262,Arnaud L,A7904CKarnaudl,22 avril 2022,"Très bon restaurant, bonne ambiance",5.0,friends,1,"Très bonne adresse à Lyon, les patrons sont accueillant, et le service chaleureux.
On y mange très bien, et pour un prix raisonnable.
Idéal pour se dépayser un peu, je recommande. "
263,Rémi P,PasdlRemi,22 avril 2022,Bon p'tit resto d'empanadas,5.0,friends,2,"Bon restaurant pour se poser, multiples choix (végé notamment) pour un prix raisonnable
Je recommande"
264,Emilie,Emilie0049,22 avril 2022,Très bonne soirée,5.0,friends,1,"De très bons empanadas, des cocktails et digestifs fabuleux, et un accueil chaleureux, le tout pour passer une bonne soirée."
