,user,user_profile,date_review,title,rating,type_visit,num_contributions,review
0,Béatrice P,794b_atricep,6 janvier 2025,Simple et efficace,4.0,couples,6,Cest un lieu sympa.n bien décoré. Ambiance calme le midi. Le repas est bon. Mais j'aurai mieux fait de prendre une formule ça m'aurait coûter moins cher.
1,Maud,Maud_Sacco_94,20 décembre 2024,Superbe adresse,5.0,friends,3,"Les empanadas sont délicieux, les cocktails sont au top, et l'ambiance est superbe donc je n'ai rien à redire ! Je recommande."
2,Frédéric P,R2903YKfr_d_ricp,15 décembre 2024,Muy bien !,4.0,couples,2,"Tout est bon : les empanadas, le service, la musique, l’ambiance. Et ils servent à manger jusqu’à 23h30 au minimum ce qui est rare à Lyon et très bien pour une petite faim après un spectacle !"
3,Antoine L,antoinelF7526DU,13 décembre 2024,Vendredi soir,5.0,friends,1,"Un repas excellent servis rapidement dans une ambiance chaleureuse. Très bon service d'Amelia et super ambiance générale 👍
Une super piste de dance au sous-sol"
4,Thomas S,A9840AEthomass,7 décembre 2024,"Un restaurant sympathique très bien, un lieu on peut venir à plusieurs",5.0,family,1,"très bien pendant les fêtes des lumières et en plus tard le soir, ambiance caliente.
Restaurant très  sympathique et l’équipe 
Muchas gracias"
5,Joachim J,joachimj556,6 décembre 2024,Très belle découverte dans le quartier,5.0,friends,2,Très bel accueil et très belle variété d'empanadas qui ont régalé toute la troupe et pour un prix très correct et ceci toujours avec le sourire !
6,BEAL C,bealc2017,2 décembre 2024,Une super soirée entre amis,5.0,friends,3,"Très belle soirée passée entre amis dans ce lieu si typique et accueillant au personnel super  professionnel et souriant. Et cerise sur le gâteau,  les empanadas sont délicieuses !"
7,Marie-France M,790mariefrancem,1 décembre 2024,Empanadas club : c'est toujours un plaisir d'y aller !,5.0,couples,1,"Que ce soit sur le pouce avant une séance de ciné ou en prenant son temps, en couple, en famille ou entre amis, c'est toujours un bon moment ! Les empanadas sont bonnes, les vins aussi ! Le service au top ! Le cadre est sympa ! La localisation idéale ! Pour moi, un restaurant ""feel good"" qui donne le sourire et me fait voyager : j'adore !"
8,Lucie B,681lucieb,30 novembre 2024,RDV en Amérique latine,5.0,couples,16,"Endroit convivial et très latino pour manger simplement en étant dépaysé !
Empanadas savoureux et servis bien chauds
Par contre pas de possibilité d'enlever des ingrédients 
Dommage pour les allergies"
9,Maïa D,213ma_ad,17 novembre 2024,Dépaysement,5.0,friends,1,"Détente, accueil chaleureux en toute simplicité...
Je recommande à tout le monde...
Les empanadas de qualité, à tomber ! Et après, vous pouvez aller danser 💃 !!!"
10,El loco,567renaudc,9 novembre 2024,Bienvenido a Buenos Aires,5.0,couples,3,"Dépaysement assuré dans ce restaurant!
Une ambiance argentine qui met tout de suite à l’aise.
Coup de cœur pour la décoration.
Un personnel souriant et accueillant.
Des empanadas succulents et variés. Mention spéciale pour le ""carne picante"".
Les desserts permettent de finir sur cette note sucrée que l’on aime.
Très belle découverte
Petit bémol : le mange-debout pas très confortable (mais en arrivant à 20h sans réservation on ne va pas se plaindre d’avoir été accueillis)"
11,Bianca R,I9356HSbiancar,3 novembre 2024,Je recommande,5.0,couples,1,"Service très bon, les jeunes serveurs sont attentionnés . Le service est rapide après la commande. Nous, on a bien apprécié."
12,Laurence P,G3579YVlaurencep,2 novembre 2024,Repas amis famille,5.0,friends,1,"Le service est rapide et efficace.
Ambiance conviviale, nos amis venus en famille d’une autr région ont bien apprécié aussi.
L’offre est variée pour les Empanadas salés et du coup à 10 on a tous trouvé ce qui nous convenait.
Les desserts étaient tous très bien sont en particulier le copetin; mais je trouverais top, d’un jour proposer un Empanadas sucré à recette variable (un peu comme le surpresa mais en sucré)."
13,Luce T,337lucet,2 novembre 2024,Parfait,5.0,friends,1,"À l'occasion d'une soirée entre amis. Personnel très agréable, empanadas  au top. Une adresse que je recommande sans hésiter. Nous reviendrons assurément !"
14,maylisdemauroy,maylisdemauroy,1 novembre 2024,Voyage gourmand en Argentine,5.0,couples,2,"Ambiance très chaleureuse à l'Empanadas Club. La déco, l'équipe, la carte: on voyage en Argentine. Le système de commande est efficace, le service rapide et les empanadas sont très bonnes ainsi que la fameuse sauce chimichurri. À découvrir !"
15,Agathe,agathemrd,31 octobre 2024,Très bon restaurant !,5.0,business,2,"Nous sommes venu avec mes collègues pour un pot de départ et nous avons passé un super moment ! Les empanadas étaient super bons, le coktails également ! 
Le personnel était très chaleureux et accueillant ! 
On reviendra sûrement !"
16,Aurélien L,15aur_lienl,30 octobre 2024,Belle découverte,5.0,family,3,"De passage à Lyon, excellente découverte en famille,on s'est régalés. L''accueil est très chaleureux. Je recommande sans hésitation !"
17,Damss,65damienc,28 octobre 2024,Voyage en Argentine,5.0,family,5,"Un super moment passé dans ce restaurant qui vous embarque en Amérique du Sud par son décor et sa musique. Les empaladas sont a tomber et le service irreprochable. Bref,vous l'aurez compris,n'hésitez pas a pousser la porte de cet etablissement..."
18,Elie D,ElieD158,28 octobre 2024,"Délicieux, à faire !",5.0,friends,31,"Délicieux, les meilleurs que j'ai pu manger. Je recommande vivement, l'accueil était très chaleureux. 
C'était varié "
19,isa v,487isav,26 octobre 2024,Délicieux voyage gustatif argentin à Lyon,5.0,family,119,"Petit resto bien décoré, avec des superbes empenadas variées et délicieuses. Le principe du choix des empenadas sur petit papier est original. Service rapide, salle un peu bruyante quand elle est remplie.
Bon voyage gustatif argentin.
Service impeccable. Merci, on a passé une bonne soirée. "
20,Paradise13898976316,Paradise13898976316,26 octobre 2024,Chaleureux et bon !,5.0,friends,1,"Atmosphère agréable, empanadas délicieux et des serveurs vraiment adorables ! Pour une petite soirée entre amis c’est parfait !"
21,Orane N,582oranen,21 octobre 2024,Un repas entre amis comme on aime,5.0,friends,1,L'endroit est très sympathique et concept original ! Les Empanadas étaient excellent et l'équipe très sympa !  On y retounera !
22,sébastien C,s_bastiencU8262HV,13 octobre 2024,Superbe expérience en famille,5.0,family,1,Deuxième visite et toujours aussi plaisant ! L endroit est sympa les empanadas très bonnes… tout comme les cocktails et les serveuses très sympas ! Un sans faute ! Bravo
23,Sightsee41662377972,Sightsee41662377972,12 octobre 2024,Nous reviendrons c'est certain.,5.0,family,2,"Nous connaissions déjà le principe... L'établissement situé à Montpellier.
Nous n'avons pas été déçu, nous avons bien mangé, dans une bonne ambiance.
Donc un grand bravo à toute l'équipe car vous avez été au top."
24,Stéphanie G,st_phanieg475,10 octobre 2024,Top - A refaire,5.0,family,26,"L'ambiance est très sympa, les serveurs très sympathiques et les empanadas divins. La prochaine nous testerons le coté bar"
25,Daydream00207903644,Daydream00207903644,10 octobre 2024,on reviendra avec plaisir,5.0,couples,1,"Accueil toujours aussi chaleureux. Cuisine pleine de saveurs tant pour les empenadas que pour les desserts. Service rapide, idéale pour les courtes pauses déjeuners"
26,Renée-Marie S,ren_emaries2024,9 octobre 2024,Un moment agréable,5.0,friends,1,"Très bon repas et jeune serveuse accueillante.  Très bon rapport qualité prix. Je suis venue 2 fois en un semaine .Mais 100 caractères, ça fait trop 😄😄"
27,Annette,N826YHannev,6 octobre 2024,PAR-FAIT!,5.0,couples,7,Tout était tout simplement PARFAIT et DÉLICIEUX !!! Concept/ambiance/service/accueil/GOÛT !!   C'est un sans faute !
28,Aurélien V,aur_lienv311,6 octobre 2024,Un vrai voyage en Argentine,5.0,friends,1,"Super expérience, bien accueillis et les empanadas étaient vraiment très bons. La déco est faite avec goût. À recommander."
29,Loris Buhagiar,Lorisb6938,24 septembre 2024,"Surtout, n’hésitez pas !",5.0,friends,231,"Un vrai voyage en Amérique Latine ! Les serveurs ne sont pas français, les empanadas sont vraiment ressemblant voir identique à ceux d’Argentine. Le vin est originaire de Mendoza. 
Il faut réserver à l’avance et les soirs en semaine, des activités sont proposées (soirées, tango, musique…)"
30,CHRISTINE E,B7559AGchristinee,24 septembre 2024,Bienvenue en Argentine,5.0,friends,2,Très bon moment passé dans votre établissement. Personnel souriant et agréable et les empanadas sont délicieux. Hâte de revenir chez vous.
31,Rahyan,Culture44032957603,7 septembre 2024,Repas 2 couples,5.0,friends,1,Le serveur doit nous offrir les shot je suis bourré à voir par la suite mais on a très bien mangé et on a été très bien reçu merci à toute l’équipe
32,Lisa R,lisarB2813UB,5 septembre 2024,Au top !,5.0,friends,1,"Super ambiance, serveurs très gentils et serviables. Je recommande! 

*ps : nourriture délicieuse et toilettes très propres"
33,rach d,968rachd,2 septembre 2024,Super adresse,5.0,friends,1,"Excellente adresse pour partager un bon repas 👌, empanadas au top , service impeccable aux petits oignons 🧅, recommande vivement"
34,Barbara B,barbarabQ3081CQ,1 septembre 2024,Très bien,5.0,family,1,"Le Personnel  était souriant et accueillant ! Plats très bons  , on reviendra  c'est certain !
TRES BON  rapport qualité prix !"
35,Marco,franceameriquelatine,25 août 2024,Delicioso !!! Les vrais empanadas Argentinas,5.0,couples,1,"Les meilleures empanadas Argentine de Lyon, un service au top (ou vous pouvez vous entrainer en espagnol) des desserts à tomber de la chaise et un Quilmes…aussi bonne qu en Argentine"
36,Fabrine F,fabrinef2018,25 août 2024,A découvrir,5.0,family,1,"Bel endroit, facile d'accès, juste un peu bruyant même à la cave, mais très bonne découverte et personnel très sympa.
On y retournera facilement d'autant plus qu'il y a des plats veggy !"
37,Nicolas B,G5014BKnicolasb,24 août 2024,Adresse pépite pour les adeptes d’Amérique Latine,5.0,friends,1,"Restaurant/bar latino avec une super ambiance. Les empanadas sont très bonnes et le personnel est très accueillant. Une adresse idéale pour venir entre amis ou avec sa/son chéri(e).
La surprise se trouve à l’étage du bas 💃"
38,Catherine Q,965catherineq,24 août 2024,Good experience,5.0,friends,1,"Tout était parfait ! Les conseils et explications, le service, les empanadas. Le verre de vin est trop cher : une alternative à  3 E au lieu de tout à 4 à 5 serait bienvenue."
39,nanoubo1,nanoubo1,21 août 2024,idéal pour passer une bonne soirée et découvrir de nouveaux mets,5.0,couples,32,Très bon accueil . Amabilité des serveuses. Lieu et ambiance agréables. Coût modeste et produits assez légers. A faire découvrir
40,Julie B,T1516KNjulieb,8 août 2024,Parfait !,5.0,family,2,"Super restaurant, l’ambiance est très sympa, les serveurs sont très agréables et surtout le repas est délicieux ! Les empeñadas sont savoureuses et les desserts très bons ! C’était un régal une fois de plus, cette adresse est vraiment top !"
41,emmanuelle g,651emmanuelleg,8 août 2024,Super,5.0,friends,2,"Lieu super sympa. Empanadas très bons, serveur de très bon conseil pour le vin. Je recommande et j y retournerais. Un petit peu bruyant quand il y a du monde."
42,GP,Resort17367656342,6 août 2024,Peut mieux faire,2.0,couples,9,"Rien de très copieux ni très appétissant, le menu est même particulièrement médiocre avec sa salade basique, ses empanadas trop classiques (boeuf poivron, poulet jspkoi, et le flamekueche/carbi) et son dessert, un empanada au chocolat resté trop longtemps au sec avant dégustation."
43,Didier B,H1544EBdidierb,1 août 2024,A découvrir absolument !,5.0,friends,1,"Nourriture excellente, serveuse/serveurs top, lieu très agréable, prix raisonnables.
Je recommande donc beaucoup cet endroit !"
44,Mat'ador,hostelandfoodtrip,31 juillet 2024,Délicieuses Empanadas,5.0,couples,488,"Pas en kiff pour l'Albiceleste, c'est tout le contraire lorsqu'il s'agit d'évoquer les enpanadas de cette enseigne argentine. Il y en a pour tous les goûts et tous les regimes. Un vrai régal qui mérite la meilleure note!"
45,Thomas G,Z6688ONthomasg,28 juillet 2024,Génial,5.0,friends,11,"Empanadas et cocktails au top, bonne atmosphère argentine et déco sympa 
Il pourrait y avoir encore 2-3 empanadas de plus à la carte!
Sinon, un sans faute"
46,Clotilde O,clotildeo206,28 juillet 2024,Satisfaite!,4.0,family,1,"La nourriture est très bonne. Tout est fait maison. Un régal. Je recommande ! 
On a peut être attendu un peu trop longtemps pour les desserts."
47,Mathilde Q,310mathildeq,20 juillet 2024,Dîner à deux,5.0,couples,1,Un dîner délicieux et original à deux.  Une découverte très agréable de la cuisine Argentine. L'équipe est très souriante et accueillante.
48,Samanta I,samantai939,16 juillet 2024,Une belle adresse pour manger des Empanadas !,5.0,family,8,"Nous avons mangé lors d'une visite sur Lyon dans ce restaurant.
Les produits sont frais et très bien cuisinés. 
Le personnel est sympa et les prix tout à fait corrects.
"
49,Galindo O,galindoo2024,14 juillet 2024,Moment convivial et agréable,5.0,family,1,"Comme à chaque fois pas déçu  je le conseille ça change des restaurant traditionnels et en plus c est super bon 
Merci encore"
50,lolo0571,lolo0571,14 juillet 2024,PARFAIT,5.0,couples,66,"3ème visite en 2 mois et 3ème satisfaction 
- accueil
- repas
- rapport qualité/prix
tout est parfait  ! ne changez rien surtout !!"
51,MaëlleYZ,MaelleYZ0,14 juillet 2024,Belle découverte,5.0,family,2,"Endroit parfait pour manger des empenadas sans prise de tête ! C'est un sans faute sur les goûts et les saveurs, et le rapport qualité/prix y est très correct.
Le personnel est vraiment accueillant et agréable.
Petit + : une belle offre d'empenadas végé !

Nous sommes partis trop tôt pour profiter de la soirée dans la pièce du bas, mais nous avons pu y jeter un œil : superbe ! Cette cave joliment décorée se transforme en bar dansant de 22h30 à 1h.

Bref, c'est sûr, nous reviendrons !"
52,Julien M,U8098MWjulienm,11 juillet 2024,Une pépite a découvrir,5.0,family,1,"Superbe restaurant !! Très bon plats , desserts inattendus , super ambiance latina,  accueil chaleureux, au petit soin !! Bravo l équipe  je recommande a 100% ..."
53,Juan,FarAway56800401547,10 juillet 2024,Ay que bueno ! :D,5.0,friends,2,"Nous avons passé une excellente soirée entre amis chez Empanadas Club ! Les empanadas sont variées et très bonnes, la déco' de la salle nous plonge dans la culture argentine et l'équipe est très accueillante. Merci, nous reviendrons sans hésitation :D"
54,Pioneer36979330919,Pioneer36979330919,7 juillet 2024,Endroit sympa pour une collation,5.0,family,1,"Equipe jeune agréable et souriante.
Les empanadas sont délicieux.
Les boissons sont originales.
Moment tres sympa.
Merci"
55,Ninon,Flyer57770812971,5 juillet 2024,Vraiment excellent !,5.0,family,19,"Le concept est génial, tout est tourné vers le partage, de la déco à la façon de commander ! On y mange très, très bien, les empanadas sont garnis, on s’en tire pour 90€, boissons comprises, pour 5, et on est tous repartis repus ! Le service est rapide, les employés sont forts agréables. Le lieu est effectivement un peu bruyant, mais ce n’est pas excessif et à mon sens ça fait partie de l’ambiance. Bref, une très bonne expérience, on y retournera !"
56,Damien Z,486damienz,22 juin 2024,Voyage en argentine,5.0,friends,90,"Nous avons passé un très bon moment, les plats sont très bons et copieux. 
Les cocktails à tomber, la musique sympa. 
Bref une très bel endroit à découvrir"
57,Léonie V,l_oniev164,20 juin 2024,Excellent !,5.0,friends,1,"Un vrai voyage culinaire ! Vous mangerez dans une ambiance musicale, aux saveurs argentines : un vrai délice !! 
Je vous recommande d’y aller les yeux fermés !"
58,3rach,3rach,8 juin 2024,Foncez ! C'est trop bien,5.0,friends,3,"Endroit est très sympa, les empanadas délicieuses, il y en a pour tous les goûts et le personnel hyper agréable. Belle experience"
59,Ben B,R3570CFbenb,7 juin 2024,Excellentes empanadas,4.0,friends,3,"Les empanadas sont excellentes et les serveurs super sympas.

Les cocktails sont bons mais sans plus.

Le rapport qualité/prix est bon."
60,Valar M,Atarys,3 juin 2024,J’ai payé 9€ de trop à l’addition 😢,2.0,couples,2,"C’était très bon, malheureusement on m’a facturé 9€ de trop à l’addition. Je n’ai pas réalisé tout de suite. Nous avions pris 8 Empanadas (32€), 1 verre de vin (4€), 1 Club Mate Cola (4€), 1 Alfajor (3€) et 1 Volcan (6€). J’ai payé 58€ au lieu de 49€. J’ai choisi de faire confiance au moment de payer. Ce n’est qu’après, sur le chemin du retour, que j’ai réalisé que j’ai payé plus que je ne devais. Je suis dégoutée 😢"
61,Caroline C,G1518OXcarolinec,2 juin 2024,Victime de son succès,1.0,solo,1,"Ayant beaucoup apprécié mes visites à l’Empanadas Club de Montpellier, j’ai voulu tester celui de Lyon. Quelle déception !
Le restaurant avait vraisemblablement pris plus de réservations qu’il ne pouvait honorer ou les serveurs ont vu des tablées plus intéressantes que la mienne dans la file d’attente. À mon arrivée, j’ai mentionné que je serai seule et pas deux comme indiqué dans la réservation et j’ai été installée. Or après que je me sois assise, alors que j’étais prête à commander, le serveur est venu me demander confirmation que j’avais réservé, a pris un air embêté quand je lui ai dit oui, puis m’a donné le choix entre partager la table d’un inconnu qui déjeunait seul, et m’assoir au comptoir utilisé pour le service. Suite à mon refus, ferme mais ni impoli ni agressif, il m’a rétorqué : « C’est une table pour deux ! C’est comme ça ! ». Autant dire que je suis partie sur le champ.
J’ai vécu des mésaventures au restaurant mais ne m’était jamais sentie insultée à ce point. Pas un mot d’excuse, pas une tentative pour arrondir les angles, juste du mépris. C’est d’autant plus dommage qu’Empanadas Club vante sa convivialité. Je suis prête à excuser beaucoup de choses, les problèmes logistiques, le manque d’expérience, mais quand on travaille au contact de clients, il faut avoir le sens du service."
62,Manon d,F667WEmanond,2 juin 2024,Une expérience mitigée mais la nourriture est bonne.,3.0,family,1,"Nous n’avons pas eu de chance, le responsable est accueillant et la nourriture est bonne. Mais nous avons fait un service à 21h pour l’anniversaire de ma sœur, nous avons été placé en bas dans la pièce qui sert de club, sans service à table, sur une table collante. On a du se faire encaisser à la fois au bar et aux cuisines et de faire nous même nos commandes, et on nous a demandé de partir vers la fin de notre plat car le club ouvrait, mais nous n’avons pas été replacé en salle pour qu’on puisse continuer notre repas. On nous a proposé d’acheter nos desserts à emporter et une serveuse peu agréable nous a fait taire en nous disant « qu’ils faisaient comme ils pouvaient ». 
On a eu l’impression d’être des numéros, et nous avons subis leur manque d’organisation à anticiper notre table, ils avaient accueilli de nouveaux clients entre temps au lieu de nous replacer…
Pas très bonne expérience, mais je ne pense pas que ce soit représentatif, par contre il n’y a eu aucun geste commercial…"
63,Christophe R,ChristopheR988,31 mai 2024,Très sympa,5.0,family,36,"Réservation en ligne en 2 minutes. Accueil, ambiance et service parfait. Les empanadas sont délicieuses. Merci et bravo à tous."
64,lolo0571,lolo0571,26 mai 2024,Allez y vite !!!,5.0,couples,66,"superbe !!!

une équipe jeune, dynamique et souriante 
des empanadas à tomber par terre … tout est fait maison et succulent 

allez y les yeux fermés !!!

et qui plus est, les prix sont plus qu’abordables

nous reviendrons c’est certain !"
65,Marine R,marinerC2798DV,19 mai 2024,Foncez !,5.0,family,1,"Super expérience ! Le repas était délicieux, on s’est régalé, les serveurs super sympas, efficaces et aux petits soins."
66,Sébastien B,skjdb69,18 mai 2024,Bonne expérience,4.0,couples,49,"Bon accueil et service rapide malgré le monde. Les empanadas sont de qualité et à un prix raisonnable. Nous n'avons pas testé le bar au sous sol. Petit bémol, une sensation de devoir libérer rapidement la place une fois terminé."
67,Emilie M,G124ASemiliem,18 mai 2024,Restaurant au top,4.0,friends,1,"Très bonne expérience pour une première fois, j’ai beaucoup aimé l’empanadas aux fromages c’était mon préféré ! Merci à l’équipe fort sympathique, Que Dieu vous bénisse !"
68,Marie F,Y9826TZmarief,15 mai 2024,Super soirée,5.0,friends,1,"Super restaurant ! 
Les empañadas sont excellentes et les serveurs très gentils et accueillants.
Les prix sont très abordables, parfait pour une soirée entre amis ! 
Adresse vivement recommandée."
69,Julia L,P9496TIjulial,9 mai 2024,Top!,5.0,friends,7,"Super expérience!!! Empanadas au top ainsi que les desserts, comme en Argentine. Le service est rapide et efficace!!!"
70,Lea M,leamB5272SQ,8 mai 2024,Délicieux,5.0,couples,1,"Nous avons étaient super bien accueillis, les empanadas étaient délicieux et les desserts maison incroyable, je recommande"
71,Maria D,mariadS7824UP,29 avril 2024,Belle découverte !,5.0,couples,122,"C'est une sans faute. Des petits empanadas (on recommande 3 par personnes) aux saveurs parfaits. J'ai aussi essayé une petite salade qui était également très bon et original.  
Le service est rapide, le local agréable. 
Et ce n'est même pas cher! 14€ pour une personne ! "
72,Philip Harris,philiph35213,26 avril 2024,Voyage en Amérique latine,5.0,solo,17,Des empanadas délicieuses dans une ambiance chaleureuse ! Des saveurs authentiques et une variété de garnitures alléchantes. Parfait pour une expérience rapide et savoureuse.
73,Guillaume C,543guillaumec,23 avril 2024,Excellent,5.0,friends,3,"Accueil chaleureux, service discret et impeccable et par dessus tout un délice ! L'impression d'être ailleurs le temps d'un repas."
74,Sylvie R,sylvier855,23 avril 2024,A découvrir. Très bonne adresse.,5.0,family,2,"Organisation originale et innovante.
Service rapide,
Très bonnes recettes,
Ambiance sympathique,
Prix attractif."
75,Isabelle O,397isabelleo,20 avril 2024,Excellent,5.0,friends,1,"Excellent empanadas. Déco sympa , service très bien.
Dîner avant un spectacle à l’opéra. Juste à côté très pratique et rapide"
76,Alice,Go28532785164,18 avril 2024,Une très belle découverte !!,5.0,friends,13,"Une très belle découverte. Des empanadas à tous les goûts, très bons. Je recommande à 100%. 
Bon rapport qualité prix également."
77,Emma G,L7758ACemmag,17 avril 2024,Empanadas Club Lyon,5.0,friends,1,"J’y vais régulièrement et c’est toujours un plaisir d’y aller, les serveurs sont très sympathique et réactif, les cuisiniers aussi font du super travail, tous leurs empanadas sont juste divins ! Et même leurs desserts. À chaque fois il y a peu d’attente avant d’être servi, c'est très rapide. Je recommande à 100% !"
78,Estherajamais,Estherajamais,13 avril 2024,On retournera sans hésiter même plus à conseiller,5.0,family,45,"Les empanadas sont excellents, variés et vite préparés. Parfait pour un repas avant le retour avec des kilomètres à faire. Personnel sympa et bien situé. "
79,marc l,956marcl,11 avril 2024,Excelente !,5.0,friends,5,"Accueil souriant, plats arrivés vite, et empanadas excellentes. La salade est délicieuse. Avec un peu plus de choix de bières ce serait top :)"
80,Célestin C,c_lestinc2024,4 avril 2024,Bonne expérience,4.0,friends,1,"Endroit très agréable, serveurs aimables et nourriture à tomber. Peut-être un peu cher pour la quantité, si je voulais dîner à ma faim, cela aurait dépassé les 40 euros."
81,Andrea D,W6891AHandread,31 mars 2024,Très bonne découverte argentine !,5.0,couples,2,"L’ambiance était très sympa, les empenadas que nous ne connaissions pas étaient vraiment bons !
Je recommande vivement ce petit restaurant typique argentin"
82,Célia B,535c_liab,30 mars 2024,"Incroyable, foncez !",5.0,friends,1,"Restaurant incroyable, je recommande. 
Le concept est super bien pensé, l’équipe est chaleureuse et les empanadas sont excellents !"
83,Aude D,auded700,28 mars 2024,Première expérience,5.0,friends,1,"Premier fois que je mange des empanadas, c'était trop bons ! Surtout avec la sauce au thym
La salade est excellente !
La boisson Mai tai était bonne aussi"
