,user,user_profile,date_review,title,rating,type_visit,num_contributions,review
84,Octave A,octavea2015,26 mars 2024,"Très bon, mais...",2.0,family,101,"C'est bon. C'est TRÈS bon.
Mais alors, direz-vous,  pourquoi une si mauvaise note ?
Plusieurs raisons.

1 - il n'y a pas de carte. Il y a une liste des ""plats"" disponibles, mais on ne vous donne pas de description sur une carte classique. Juste un QRCode et démerde-toi.
Eh bien NON, je ne vais pas au restau pour m'emmerder avec un smartphone comme quand je suis au travail !
Il y a bien une ardoise, mais j'ai pas vraiment envie de me lever -et encombrer la petite allée- pour la lire.
(Heureusement quand on m'a proposé ce restaurant j'avais consulté la carte sur internet, mais sur mon ordinateur, tranquillement, à la maison, et j'avais mémorisé tout ça ...)

2 - c'est bruyant. Très bruyant. MONSTRUEUSEMENT bruyant. Comme quasiment tous les petits restaus de Lyon, vous me direz... 
Mais ça n'enlève rien au caractère très désagréable de cet endroit où on se croirait plus dans un hall de gare que dans un restau sympa. C'est très pénible, et pour les gens sensibles au bruit, ça en devient douloureux.
Ça coûterait pas cher de mettre cinq centimètres d'isolant et une jolie toile au plafond et sur quelques murs...

3 - mais surtout ...
c'est long ...
LONG ...
TRÈS LONG !
Presque deux heures pour manger deux ou trois empanadas, une salade et un dessert, non, c'est insupportable !
À tel point que nous avons fait l'impasse sur le café, nous n'avions pas envie d'y rester une demi-heure de plus. (dans le bruit, rappelons-le)

Bon, concluons sur une note optimiste ; en dépit des défauts susmentionnés :
- C'est SUPER bon, et
- c'est VRAIMENT pas cher : 20 euros par personne pour bien manger (avec apéro), c'est pas facile à trouver dans le coin."
85,Anne Laure Crlt,AnneLaureCrlt,17 mars 2024,Foncez,5.0,couples,7,"Très bonne adresse, les empanadas sont fabuleux, à chaque bouchée un peut dépaysement. L'ambiance est bonne, les serveurs au top! Nous recommandons vivement ! "
86,Philippe V,P1977WUphilippev,15 mars 2024,A découvrir.,5.0,friends,1,"Parfait pour une petite collation avant spectacle. Bonne cuisine, cadre agréable et accueil très sympathique. Service rapide et souriant."
87,Alicia B,aliciabK9187WD,15 mars 2024,Excellent !!!,5.0,friends,1,"Adresse que je ne connaissais pas et découverte par hasard

Le voyage en Argentine est une réussite !!!!

Très bon rapport qualité-prix"
88,Doriane L,dorianel559,15 mars 2024,Toujours ravie,5.0,friends,190,"Cela fait déjà plusieurs fois que je viens, c’est toujours un plaisir ! Une équipe chaleureuse accueillante et souriante , des empanadas pour tous les goûts ! Super rapport qualité prix"
89,Yann P,Youliic974,12 mars 2024,Delicieux.,5.0,friends,38,Excellent concept et des empanadas délicieuses et irrésistibles. Le personnel très accueillant et d'une gentillesse remarquable. Un univers et cadre magnifiques pour faire découvrir l'Argentine.
90,Fanny Pouzol,fannypouzol06,11 mars 2024,Allez-y en courant !,5.0,friends,5,"Super moment ! L’équipe est géniale, on a passé un super moment grâce à eux, ça fait plaisir de voir une équipe comme celle la en restauration. La cuisine est sublime,  merci pour ce super moment !"
91,SULLIVAN69,SULLIVAN69,8 mars 2024,Les saveurs d'Argentine,5.0,couples,304,"On se croirait en Argentine aussi bien par le cadre que dans l'assiette. Les empanadas sont excellents, variés, avec beaucoup de goût et une pâte très fine comme là-bas 😉. Et en plus, le service est agréable, bienveillant, souriant et efficace ! Par contre, n'oubliez pas de réserver car l'adresse est bien connue."
92,Nora F,norafY4074NP,6 mars 2024,parfait,5.0,friends,1,"J‘ai célébré mon anniversaire et c‘était l‘endroit parfait! Chez Empanadas Club, c’est simple, amicale, gentille :)"
93,Julie C,P7004BYjuliec,2 mars 2024,Bon et original !,5.0,couples,37,Comme d'habitude un régal et un service impeccable !  Un repas original parfait en famille ou entre amis. Je recommande .
94,Jesus R,jesusrP5775XE,27 février 2024,Super empanadas,5.0,friends,1,"Súper endroit pour partager avec des amies, les empanadas sont incroyables et l’espace pour danser au top, à refaire une autre fois !"
95,CHEZFAB,CHEZFABSAVOIE,24 février 2024,Saveurs d’Argentine,5.0,couples,1,"Empañadas variées et de qualité, service au top et souriant. Bon rapport qualité prix ! Allez y sans hésiter ! Jolie découverte"
96,Trip41932818736,Trip41932818736,24 février 2024,Que rico !,5.0,couples,1,"C'est toujours une bonne expérience de venir ici. Accueil très sympa, bonne musique et biensur très bonnes empanadas !"
97,ficare69,ficare,23 février 2024,L'Argentine à Lyon,5.0,family,1,"Propose des empelladas, très original et excellent !
Accueil super sympa, on nous a trouvé une petite place meso n'avait pas réservé 
On reviendra"
98,Chloé P,chlo_pO4082TF,23 février 2024,À tester !,5.0,family,1,"Bon endroit pour manger maison et frais à un prix abordable, nous nous sommes régalés et avons été très bien accueillis et servis par Grecia et ses collègues ! Merci à vous pour cette belle découverte"
99,Alik,AlikOpinions,23 février 2024,Le meilleur des empanadas,5.0,family,4,Une superbe expérience et d’excellents empanadas. Accueil chaleureux et service impeccable. Je reviens la semaine prochaine.
100,Lea B,leabO8550HC,23 février 2024,Je recommande les yeux fermées,5.0,friends,1,"On a testé plusieurs empanadas, je recommande fortement ! Les goûts sont divers et variés , le dessert est plus que bon et les serveurs sont super gentils !"
101,Pauline R,Q2066NVpauliner,23 février 2024,Good moment,5.0,friends,1,"Superbe ambiance, plats copieux et savoureux. Le staf est charmant et très serviable. On recommande et on reviendra prochainement"
102,Cruiser554244,Cruiser554244,23 février 2024,"Délicieux, personnel très sympathique",4.0,friends,4,"Dîner un vendredi soir
Ambiance très sympathique, plats délicieux 
Concept plutôt original à Lyon
 Desserts très bons mais peut être un peu petits 
"
103,matthieub358,matthieub358,19 février 2024,Sympathique et bon,5.0,couples,102,"Le lieu est très convivial (du coup un peu bruyant)  et le mode de commande sympathique. 
Les plats sont bons, variés et bien présentés (sur une planche en bois).
"
104,CyrilleMx,CyrilleMx,17 février 2024,Excellent,5.0,couples,9,Excellent. Extrêmement bien reçu.  Les Empanadas sont divins. Adresse conseillée pour un repas atypique. De bons vins argentins proposés. 
105,Sofia Mitre,SofiaMitre,8 février 2024,Bonne expérience,5.0,friends,3,Un très bon resto pour manger avec tes amis ou en couplé. Les serveurs étaient très sympa! Je l'aimes trop bien et aussi mosquito qui est sous empanada c'est 🥳
106,Barthelemy G,barthelemyg2024,7 février 2024,Perfect,5.0,couples,1,Très bonnes empanadas et  les desserts sont délicieux. Le tout avec un super service. Expérience très agréable à Empanadas Club Lyon.
107,LaNissarda,LaNissarda,3 février 2024,À essayer,4.0,couples,48,"Jolie découverte dans un joli quartier lyonnais. 
Le concept mérite d’être connu.
Les empanadas’sont très bons.
D ailleurs c est le plat unique du restaurant accompagné de salade très bien assaisonnée.
La déco est sympa et colorée."
108,Anne H,annehB6551KH,19 janvier 2024,Merci !,5.0,friends,2,"J’ai passé un très beau moment avec mes amis ! C’était très bon et les équipes sont adorables ! Je reviendrai ! 
Un grand merci !"
109,Emilia P,X5481WMemiliap,18 janvier 2024,Tout cacao tout chaud,5.0,friends,2,Endroit et personnel très chaleureux ! La nourriture est excellente. Il faudra revenir pour tester l’ambiance le samedi soir 💃
110,Manon F,manonfJ5744PS,18 janvier 2024,Super adresse,5.0,friends,1,"Super adresse, les empanadas sont très bonnes, le service est parfait, les serveurs sont super gentils et accueillants"
111,Floriane,Feuillane,18 janvier 2024,Foncez c’est trop bon !,5.0,friends,14,"Un très bon et beau voyage gustative où les Empanadas et desserts sont délicieux et surtout fais maison.
L’équipe est souriante et l’endroit très bien placé : je recommande !"
112,François F,fran_oisf858,13 janvier 2024,"Très bien, très bon, très gentils",5.0,couples,9,"Très bon, rapide, service avec attention, juste bravo et merci, tout ce qu'on aime avec simplicité et efficacité. Adresse qui mérite d'être connue et reconnue "
113,Emmanuel R,O8265GJemmanuelr,13 janvier 2024,Dépaysement garanti,4.0,family,3,"Excellentes empanadas choix restreint mais très bonnes
Très bon accueil par une équipe sympathique  
Juste un peu trop bruyant quand la salle est pleine"
114,Louna42,Louna42,24 décembre 2023,Chaleureux bar à empanadas !,5.0,family,24,"Très agréable bar à empanadas !
Personnel jeune, souriant, sympathique, disponible, un vrai plaisir !
Empanadas très bon, produits frais, faits maison et bon rapport qualité prix
Cocktails au rhum très bons
Très bon  moment - ambiance chaleureuse et on se sent bien toute génération confondue"
115,Stephane B,R8709EGstephaneb,22 décembre 2023,Bistrot Argentin avec Empanadas au top.,5.0,friends,2,"Superbe découverte, une vraie bonne ambiance de bistrot, personnel très souriant et accueillant avec musique latine au top.
Je recommande…"
116,Victoriane V,vic2rianev,22 décembre 2023,good good goood,5.0,friends,1,"meilleurs resto latino de lyon, je recommande les empanadas sont incroyable large choix et bonne ambiance merci à l’équipe"
117,Laukaraba,Laukaraba,19 décembre 2023,Super repas!,5.0,family,2,"Super bon repas à bon prix, équipe super sympa!! Il y avait assez de plats végétariens! Et nous avons pris des desserts délicieux"
118,Agathgs,agatheh961,15 décembre 2023,Le top !,5.0,friends,10,Super adresse ! Un concept innovant et un lieu chaleureux ! Les empenadas sont délicieux ! C’est une adresse idéale pour partager un bon repas entre amis !
119,lnclaustre,lnclaustre,9 décembre 2023,Jeune et délicieux,5.0,couples,7,"Petite salle bien optimisée et bien décorée. Ambiance jeune, intime et chaleureuse.
Le concept est top, les empanadas très bons et le personnel jeune et vraiment agréable.
Nous avons pris beaucoup de plaisir à y manger. Nous recommandons fortement."
120,Rodolphe D,160rodolphed,26 novembre 2023,Quelle belle découverte,5.0,family,1,"C'est un endroit super convivial. Nous nous sommes sentis comme chez nous. A l'occasion de l'anniversaire de mon épouse nous avons réuni nos enfants. L'équipe de l'empanadas a ajouté une bougie sur le dessert sans même que nous l'ayons demandé. Très belle attention. L'équipe est super sympa, très attentive et réactive. Sourire des serveuses garanties. Nous reviendrons sans aucun doute. Belle découverte en tout cas. "
121,Biscot1000,Biscot1000,21 novembre 2023,Lieu très charmant,5.0,couples,5,"L’ambiance, le service, la cuisine et la présentation impeccable. On a adoré ce petit bout d’Argentine, y’a plus qu’à revenir tester le bar latino au sous-sol ;-)"
122,Leindryna b,leindrynab,1 novembre 2023,EL MOSQUITOO,5.0,friends,1,"Un super endroit qui allie fête, convivialité et qualité. 
Les serveurs sont tres chaleureux, dynamiques et joyeux . Willi manage l’établissement à la perfection accompagné de son barman Clayder qui nous régal avec ses délicieux cocktails.

Nous y retournerons avec grand plaisir! "
123,Mickaël 9-9-9,Bodyloc,26 octobre 2023,Adresse incontournable,5.0,friends,2,"Bar sous les auspices d'une équipe vertueuse. L'empanadas c'est avant tout une aventure humaine, un accueil sans borne, une joie de vivre au rythme de la musique latine, des danses survoltées... En somme, un lieu au sein duquel une superbe expression de l'inconscient, une catharsis incomparable s'expriment. "
124,RMutt1917,rmutt19172019,21 octobre 2023,Empanadas Club,5.0,couples,1,Un endroit extra ! Les meilleures empanadas de Lyon. Un petit coin d’Argentine et un super accueil ! Je recommande vivement !
125,Wanissa S,wanissas,18 octobre 2023,Super endroit,5.0,friends,10,"Super endroit ! Nous avons très bien mangé et le personnel est très sympa ! Super accueil ! ☺️ 
Nous avons passé une excellente soirée"
126,Az D,679azd,14 octobre 2023,Tout y est,5.0,friends,242,"C'est un restaurant qui a tout juste, qui a tout compris. L'ambiance, les prix, la qualité du repas, l'originalité... Tout y est. C'est tellement rare de nos jours. Ce n'est pas ce genre de restaurant qui sera très coûteux, l'idée et l'esprit sont ailleurs. Alors soulignons-le et profitons d'un tel restaurant.

Cerise sur le gâteau, le numéro des empanadas se trouvent dessus et ça c'est très cool.

NB : Je note que par rapport aux précédents commentaires il y a eu une hausse de prix, mais cela reste accessible. "
127,Bodivit V,bodivitv,8 octobre 2023,Great place,5.0,family,1,Tres bon endroit pour passer un moment entre amis dans le centre de Lyon. Je recommande fortement à tous. 
128,lisa2369,lisa2369,6 octobre 2023,Délicieux un super endroit pour un bon moment entre amis,5.0,friends,29,Accueil super agréable les empanadas sont vraiment délicieux. La formule est ludique et le fondant au chocolat était parfait ! Merci 
129,cécile,Cecile8569,6 octobre 2023,Top adresse!!!,5.0,friends,2,"Very good food!! 
Hyper bien accueillies!! 
Cocktails hypers bons!!! 
Super soirée!!! 
Bravo 👏👏 super "
130,Stéphanie F,st_phanief188,6 octobre 2023,Parfait!,5.0,friends,1,"Très bon !! Les cocktails originaux et parfumés. Et accueil chaleureux, je recommande vivement ! Merci pour ce bon moment ! "
131,Victor F,Victor-Fer69,30 septembre 2023,Un bon moment,5.0,solo,7,"Superbe endroit. Une équipe top, une bonne ambiance ! La nourriture était bonne et c’est très simple pour commander.

Merci pour ce moment 😌"
132,YB1972,YB1972,26 septembre 2023,Quelle belle trouvaille,5.0,friends,28208,"Nous nous sommes arrêtés ici par hasard lors de notre journée de visite de la ville. Groupe de neuf personnes, pas de réservation, nous avons pu trouver une table.

Le concept est simple, petite carte d'empanadas à choisir à la pièce, salade, et quatre desserts. Nous avons pris toutes les sortes.

Lors du service, il est facile de repérer son choix, chaque empanada a un numéro sur la carte, ce dernier sera gravé sur la pâte durant la cuisson. 
Gustativement c'est délicieux et la portion est conséquente. Les desserts sont assez petits mais bien faits. Un Malbec d'Argentine pour accompagner le tout. 

Au final, une addition très correcte, un service agréable malgré un oubli, et un concept qui fait mouche. On a beaucoup apprécié.

Empanadas Club, à quelques mètres de la Place des Terreaux."
133,alf,Journey30572348619,23 septembre 2023,Une adresse à conserver !,5.0,couples,34,"Bonne ambiance, empanadas succulents et desserts au top, rapport qualité prix excellent, que demander de plus ? Peut être un cocktail sans alcool serait le bienvenu car pour nous le choix était limité "
134,delphine b,H5721JOdelphineb,13 septembre 2023,Voyage en argentine !,5.0,business,1,"Très très bon, plat original, copieux, excellent, bonne ambiance de l’argentine, équipe très sympathique "
135,Mathieu K,mathieuk243,13 septembre 2023,Voyage gratuit en Amérique du Sud,5.0,business,2,Tres bonne ambiance ! Des serveurs très agréables et de très bons Empanadas ! Les cocktails y sont très jolis. Dépaysement garanti…
136,Emilu,Emilulu11,13 septembre 2023,Excellent,5.0,friends,8,"Endroit super, décoration fantastique, serveurs très sympathiques et empanadas excellents ! Je recommence à 100% ! "
137,Sad2b,Sad2b,9 septembre 2023,Spécialités au Cœur de Lyon,5.0,couples,147,"Belle découverte dans ce petit établissement place dans un joli quartier
Belle accueil. Carte courte. Quelques bouteilles de vins avec un vin de Patagonie très intéressant.
Système de commande original : sur une feuille vous indiquez votre choix. Pour changer des spécialités lyonnaises vous pouvez tenter l’aventure. Ça vaut le détour !!"
138,jph g,jphg,31 août 2023,Excellent.  Merite sa place dans le top des restaurants de Lyon,5.0,solo,350,"Excellent.  Vous remllisset votre petit bon de commande avec un crayon de papier en mode ikea et vous recevrez d excellents empanadas,  des petits chaussons fourrés à la viande ou pas. Bref, un restaurant argentin vrai, et Excellent.  Je ne peux que conseiller d en profiter. "
139,coralie p,Departure28693882991,23 août 2023,Une très belle découverte,5.0,couples,2,"Une très belle découverte. Le lieu est charmant, les empanadas et la salade sont top et le personnel très gentil. Simple, efficace, copieux. Nous reviendrons en famille "
140,Malhu,malhuko,15 août 2023,Un très bon restaurant à un prix abordable,5.0,couples,37,"La salle est décoré aux couleurs de l'Argentine avec pléthore de références sympas. L'accueil est chaleureux et les explications parfaites pour passer un bon repas. Les empanadas sont bons, variés et permettent de voyager le temps d'un repas. Eu égard le coût de ces derniers, ce restaurant défie tout concurrence. Je recommande grandement "
141,Loïc G,LokGL,3 août 2023,Bon moment,5.0,couples,4,Ce fut Très bon. Le prix est vraiment raisonnable. Personnelle accueillant. Et un dessert a tomber. 
142,Virginie,laurelainawela,21 juillet 2023,Génial !,5.0,friends,2,"Super adresse, l'ambiance est top, beaucoup d'options végétariennes, le fondant au chocolat et au dulce de leche : incroyable ! 
Je recommande à 100% "
143,Eloïse A,elo_sea12,21 juillet 2023,Ravies !,5.0,family,1,"Super lieu pour un repas convivial à partager entre amis ou en famille ! 
La carte est variée et ne déçoit pas (empanadas et boissons)"
144,PayMeche,PayMeche,21 juillet 2023,Endroit à découvrir !,5.0,friends,22,"Personnel très aimable et disponible, les empanadas trop bons !! Et le dessert excellent ! 
J’ai adoré la décoration original, tu fais une voyage en argentine ! 
Je retournerai ! Merci "
145,Catherine D,catherinedebelle2020,21 juillet 2023,amazing place,5.0,friends,2,"super adresse typiquement argentine ambiance chaleureuse, équipe au top les empenadas sont délicieuses,il y a unetage au dessous avec un bar atypique qui passe de la musique latine je recommande! buen lugar los felicitó!"
146,Chloé S,319chlo_s,21 juillet 2023,Dîner entre amies,5.0,friends,1,"Les empanadas sont très bonnes, les serveurs et serveuses sont très gentils et souriants, très bonne ambiance pour dîner ou boire un verre et décoration qui rappelle des voyages !"
147,jeremy d,jeremydK7171WG,20 juillet 2023,Good time,5.0,business,1,"Pépite lyonnaise , bonne ambiance, petit décor sympa ! Franchement c’est le top ! 
Foncez vous ne serez pas déçu !!!!! 
Thanks guys "
148,Lydia,Hungrydia,19 juillet 2023,Toujours une bonne idée,5.0,couples,19,Les empañadas sont très bonnes (mention spéciale pour la jamón y queso). Les cocktails sont également très bons !
149,Mayada B,mayadab2023,19 juillet 2023,Ambiance et qualité du repas,5.0,friends,1,"Nous sommes venu avec mes amies et tout était parfait 
Un grand merci à l’équipe qui s’est très bien occupée de nous "
150,Manon91590,manon91590,19 juillet 2023,Y aller les yeux fermés,5.0,friends,1,"Soirée parfaite ! Je viens ici très souvent et je ne suis jamais déçue, tant pas l’ambiance, la gentillesse des serveurs que des empanadas"
151,Destination285758,Destination285758,18 juillet 2023,"Très  bonne adresse, ambiance conviviale",5.0,family,1,Bonne expérience culinaire et ambiance très conviviale. Très bonne adresse entre amis ou en famille. Cuisine délicieuse. Merci !
152,christou04,christou04,15 juillet 2023,Un vrai dépaysement !,5.0,family,11,"Accueil et service très sympathiques de la part de l’équipe de serveurs. Les empanadas sont délicieuses et pleines de saveurs. L’ambiance est vraiment très cool !!
Nous recommandons chaleureusement cette adresse !!!"
153,Damien G,damiengW4624YO,14 juillet 2023,Empañadas club,5.0,couples,1,"Endroit très agréable. Personnel à l'écoute, souriant et attentionné. Les empañadas sont très bonnes. Nous recommandons."
154,Cathy,fafoular,10 juillet 2023,L'Argentine goûtue,5.0,couples,1,"Un super restaurant ouvert tard en plein centre de Lyon.
Les serveurs sont hyper accueillants et la serveuse qui nous a servit était d'Argentine.
Les empanadas étaient excellents!
A refaire avec grand plaisir!"
155,Théa L,32th_al,4 juillet 2023,La découverte du mois !,5.0,friends,1,"Très bonne découverte ! Les empanadas sont délicieuses et conviennent à tous les goûts. Elles sont généreusement garnies pour un prix attractif. En plus, les serveurs sont très gentils 😁 je recommande !"
156,Daydream47178671269,Daydream47178671269,2 juillet 2023,Au top !!,5.0,friends,1,"Service et nourriture au top ! Très bon et chaleureux, équipe au top, merci pour le moment ! 
Je reviendrais, merci à vous !"
157,Sofia G,sofiagK1518GB,27 juin 2023,Super bon,5.0,solo,1,"Les meilleures vraies empanadas sur Lyon ! Goût excellent, prix raisonnable et équipe sympathique ! "
158,leslie c,lesliecX2394XQ,25 juin 2023,Je recommande,5.0,friends,1,"Ce lieu est une très bonne découverte, les produits sont très bons,  bien accueillis, je recommande ce restaurant sans hésiter. "
159,Antoine,AntoineMrld,25 juin 2023,Un air d'Argentine à Lyon 😍,5.0,friends,10,"Très belle accueil, produits de qualité, décoration sympathique, personnels charmant, un bol d'air frais en plein centre de Lyon ! 🥰"
160,Apolline G,apollineg176,25 juin 2023,Je recommande,5.0,friends,1,"Le service est très agréable, nous avons étés très bien accueillis.
Les empanadas sont très bons avec des produits de qualité"
161,Aglaé V,374agla_v,23 juin 2023,On adore !,5.0,couples,1,"C’est notre valeur sûre ! Tout est frais et fait maison, on se régale à chaque fois. C’est rapide et l’équipe est adorable ! "
162,Audrey R,audreyrE3528RM,21 juin 2023,Adresse exceptionnelle,5.0,friends,3,"Super adresse ! 
Ambiance au top !
Cuisine excellente !
Et une équipe géniale pro, souriante et aux petits soins
Je recommande vivement"
163,Marlene F,61marlenef,20 juin 2023,Excellent voyage culinaire argentin !,5.0,couples,19,"Un véritable voyage culinaire en argentine. Simple, efficace mais surtout délicieux avec une équipe très sympathique !"
164,anglaise_8,anglaise_8,7 juin 2023,Agréable découverte,4.0,solo,56,"Repas original et délicieux. Idéal pour les petits budgets.Accueil sympathique. 
Les empanadas sont petits mais l intérieur est très goûteux,les sauces des salades sont très parfumées. 
J y retournerai!"
165,antoine niel,antoine-niel69,5 juin 2023,Super restaurant argentin,5.0,friends,22,"Super !! Cuisine délicieuse avec un cadre très agréable ! Les serveurs sont très gentil.

Une super adresse sur Lyon. Je recommande"
166,ugo,Paradise56100384965,3 juin 2023,Parfait pour se réunir,5.0,friends,2,"Tout simplement excellent : de l'ambiance, passant par la déco style Amérique latine, par les planches apéritives et par les délicieux cocktails réalisés par un personnel souriant et agréable, l'Empanadas est sans aucun doute l'endroit idéal pour une soirée mémorable entre amis.
Je recommande !"
167,Seb,Scenic13693615371,26 mai 2023,Bonne soirée argentine,5.0,family,5,"Empanadas très bons et variés. La décoration est sympa ! 
Les serveurs sont très agréables et commerçants, digestifs offerts !"
168,sissy83d,sissy83d,19 mai 2023,Un super endroit !,5.0,friends,5,Une cuisine excellente et une super équipe ! Merci beaucoup ! Nous ne sommes pas de la région mais nous reviendrons ! 👍
169,David,Voyager40053801632,18 mai 2023,"Bon, rapide et pas cher",4.0,family,31,Le service est rapide et les serveurs sont sympathiques. Les tabourets sont très inconfortables et les tables sont petites et très proches les unes des autres. La nourriture est bonne et le prix est très convenable. A privilégier pour une soirée entre amis.
170,kevin v,B6187RZkevinv,7 mai 2023,Voyager sans trop dépenser 👌,5.0,solo,3,"Je prends souvent à emporter une fois par mois minimum, la serveuse toujours souriante un plaisir  de pratiquer mon espagnol avec elle, les empanadas toujours délicieux ça me rappelle de bons souvenirs de mon voyage en Argentine, le vin et la Quilmes me font toujours de l'œil difficile de résister.
Même 15min je recommande fortement ce lieux très agréable le midi, et le soir très bonne ambiance. "
171,lima-chloe,lima-chloe,4 mai 2023,Très bon et beau moment,5.0,couples,3,"Personnel très souriant et disponible 
Nous avons passé un très bon moment .
Il y a du choix dans les empanadas et elles sont excellentes bravo au cuisinier. 
Service rapide.
Je recommande à 100%"
172,Lucia M,luciamH9255IT,2 mai 2023,Dame mas gasolina 🎶,5.0,friends,1,"Un endroit qui vous emmène en amérique latine. 
Bonne ambiance, les empanadas sont délicieuses et le serveur argentin est très beau  😉 "
173,jezanine,jezanine,25 mars 2023,Une super adresse à recommander plus d une fois,5.0,couples,18,"Délicieux les empanadas sont variés et tous bons
La bière est excellente 
Le service très pro
Le cadre est sympathique avec une déco chaleureuse"
174,e.f. Cece Cece,jeanninec_linee2023,2 mars 2023,L’endroit où manger à Lyon!,5.0,friends,9,"Ce restaurant est l’endroit où manger les meilleurs empanadas de Lyon. Une équipe au top, un service dans la joie, dans la bonne humeur et en musique ! On se croit en direct de l’argentine, un dépaysement total ! 
Le meilleur empanadas : CARNE ! mais il y a un qui est nommé “sorpresa del mes” qui comme le nom l’indique… nous surprend !!! 
Merci au serveur William qui nous a transmis sa super bonne humeur ! 
Ne doutez pas… ALLEZ À EMPAÑADAS!"
