,user,user_profile,date_review,title,rating,type_visit,num_contributions,review
265,Lauriane F,351laurianef,22 avril 2022,Parfait,5.0,friends,2,"Accueil, cuisine, tout est parfait. A découvrir absolument.
Les serveurs ont envie de nous faire partager leur culture."
266,Maud V,770maudv,21 avril 2022,Super adresse sur Lyon !,5.0,friends,1,"Serveurs au top et menu délicieux ! Arrêtez vous y, vous ne serez pas déçu. Plongé en Argentine, c'est génial !"
267,Jeremy B,jeremybD5103YM,21 avril 2022,Superbe adresse,5.0,couples,1,"Excellente adresse. Une ambiance vraiment sympa. Une cuisine pleine de saveur. Je recommande vivement l’adresse pour une sortie entre amis, en couple ou en famille"
268,Sylvain R,69sylvainr,21 avril 2022,Le meilleur de l’Argentine au cœur de Lyon,5.0,friends,1,"Empanadas parfaits et surtout équipe toujours très accueillante !
J’y viens très régulièrement, entre amis ou couple et je ne suis jamais déçu."
269,Clémence D,cl_menced832,21 avril 2022,👍,5.0,friends,1,"Délicieux et bonne ambiance !
Les serveurs sont très sympas et nous conseillent ! Je recommande vivement !"
270,Fanny C,fannyc171,21 avril 2022,super restau !,5.0,friends,5,Super restau les empañadas sont très bonnes ! Le personnel super sympa et le service très rapide je recommande
271,Lolo,lolorem,20 avril 2022,Super restau!,5.0,friends,23,"Super restau ! L’ambiance est top et les empanadas sont très bonnes.
Les desserts sont très bons aussi.

Je recommande!!"
272,javanaise45,javanaise45,20 avril 2022,Une escale en Argentine,5.0,couples,8,"Un petit restaurant typique argentin où tout est fait maison ! Nous y sommes allés un mercredi soir et même si le monde était présent, le service a été très rapide et de qualité ! 
Une superbe découverte ! J’y retournerai avec plaisir !"
273,Camille B,camillebW9014TC,19 avril 2022,Team solaire,5.0,business,3,"Excellent et accueil chaleureux.
Très bonne qualité.
Un service rapide, on voyage,on boit et on mange bien..Viva Argentina !"
274,Mathieu G,Y3532FSmathieug,19 avril 2022,Urbasolar teams,5.0,business,1,"Très bon, je recommande.
Rapide, service souriant, empanadas et dessert délicieux.
Urbasolar, solar energy for green planet."
275,Maïeul R,ma_eulr2022,19 avril 2022,"Petit contrat à 10M de pesos à fêter avec ma collaboratrice, que j’espère bien bouyave ce soir.",5.0,business,1,"Restaurant de qualité supérieure, foncez y sans zéziter.
Vraiment nésitez en aucun cas. 
Les empanadas c’est trop bon !! 
MIAM. 🤤"
276,Agustín C.,agusteed,17 avril 2022,Buenísimo!,5.0,friends,2,"Meilleur endroit pour manger des empanadas comme en Argentine! Staff au petits soins et bien sympa. Le combo parfait pour une bonne soirée. Gracias chicos, Agustín."
277,LindaBecameil,Libecam,16 avril 2022,Apéro Dinatoire,5.0,family,1,"Une très bonne adresse, personnel très souriant et des super empanadas 😋 à voir absolument...Bon voyage en Argentine !"
278,Alice D,V4512MGaliced,16 avril 2022,"Super, comme d'habitude.",5.0,friends,1,"On y vient et revient encore. On trouve toujours des empanadas à notre goût !
Allez y sans hésiter 😀"
279,romana722,romana722,15 avril 2022,Ambiance très cool !,5.0,friends,5,"Les empanadas délicieuses ! A recommander !
Les gens très souriants, l'ambiance latino, on a vraiment passé un super moment.
Le copetin à goûter absolument !"
280,Alex S,N8747KQalexs,15 avril 2022,Meilleur restaurent Sud Américain de Lyon,5.0,friends,2,"Excellent restaurant, des empanadas top ! 
Très bon vins, bonnes bières et super desserts, en plus de l’ambiance mucho caliente 😋"
281,Fabrice P,132fabricep,15 avril 2022,Magnifique empanadas !,5.0,friends,47,"Super découverte, très convivial, accueil très sympa et empanadas excellentes !!! Cadre agréable et très local, super musique"
282,Flor,197florr,11 avril 2022,Las mejores empanadas !,5.0,none,1,On a passé une super moment ! Les empanadas sont très bonnes et il y a des options pour les végétariens ! Les serveurs sont tous sympas (Ils sont même chanté et dansé de la cumbia !).
283,Vincent R,Sheeep7,10 avril 2022,Les meilleurs empanadas de Lyon.,5.0,none,3,"Équipe souriante et super sympa ! Empanadas excellents, cocktails au top. C'est toujours un plaisir de venir."
284,Charlotte C,charlottecC4650SZ,9 avril 2022,Super decouverte,5.0,couples,49,Très très bonne découverte pour nos papilles. Tarif raisonnable. Super service très gentil et accueillant.. je recommande+++++
285,François,maradomarado,5 avril 2022,Magnifique découverte,5.0,none,1,"Excellents empanadas argentins à côté de Terreaux, service efficace, simple et rapide 👌 je me suis régalé avec le dessert du weekend😍
Prix juste pour les empanadas et le cocktail (le tout fait maison d'ailleurs)
Le personnel toujours à l'écoute et souriant nous a fait passer une superbe soirée 💯🥰
On y reviendra pour le prochain empanada du mois!!"
286,Baptiste A,969baptistea,2 avril 2022,Très bon,5.0,friends,1,"Très bon et abordable 
Personnel agréable 
Je recommande nous avons passé un bon moment
Les cocktails sont également très bons !"
287,docilriccio,docIlriccio,2 avril 2022,Excellente découverte,5.0,couples,1,"Nous sommes rentrés par hasard et finalement avons fait une excellente découverte.
Dans ce restaurant vous mangerez très bien, d'excellentes empanadas, vous boirez du bon vin argentin et vous serez extrêmement bien reçus.
Toute l'équipe est très bienveillante et vous mangerez sous le regard de D10S (Diego), aussi célèbre à Naples qu'en Argentine.
N'hésitez pas ... allez-y !!!"
288,Les épicuriennes torturées,epicuriennetorturees,20 février 2022,Si vous voulez des empanadas généreux et délicieux c'est par ici !,4.0,friends,14,"Nous avons testé empanadas club et on a pas été déçu du voyage !!! 🇦🇷🇦🇷

A la carte vous pouvez retrouver 8 empanadas différents dont 3 végétariens. 
On les a tous testé mais gros coup de cœur pour le Pollo au poulet grillé avec oignons et poivrons. 
On a adoré la garniture qui était hyper bien cuisiné et généreuse comme on aime. 
Les chaussons sont au prix de 3,50€ (avec 3 ou 4 chaussons vous êtes bien callés). 
Les desserts sont également abordables et très sympa!! 

Si vous voulez des bons empanadas bien garnis pour pas trop cher alors foncez 🥰🥰. "
289,DamSlyon07,DamSlyon07,20 février 2022,Resto à tester!,5.0,couples,6,"Musique sympa, dans un lieu sympa, avec des serveur sympa ainsi que les cocktails et les empanadas,  sympa quoi! ☺️ Nous recommandons"
290,Alexia G,902alexiag,27 janvier 2022,Moment convivial,4.0,friends,58,"Belle découverte, le concept est original puisque vous pouvez prendre librement le nombre d’empanadas que vous souhaitez parmi un panel de 8 choix : viande, végétarien, fromage etc…
Le service est rapide et les empanadas étaient très bons."
291,hugo,Cruiser66573268001,23 janvier 2022,Très bon ! Je recommande,4.0,friends,5,"Nourriture très bonne, prix correct. Accueil chaleureux, personnel agréable, et servi rapidement, les empanadas ont le même goût que celles que l’ont mangent en Argentine. 
Je recommande"
292,Arnaud V,519arnaudv,30 décembre 2021,Découverte,5.0,couples,7,"Belle découverte … mention spéciale pour le numéro 1 carne .. petit conseil garder le pour la fin.
Acceuil et déco très sympa… 

Ne passez pas devant sans vous arrêter"
293,Bon vivant français,72lo_cb,21 décembre 2021,Ne jamais se fier à tripadvisor,2.0,friends,1,"Restaurant un peu surcôté…

Les empañadas sont ok tiers mais ne cassent clairement pas des briques.

N’y allez pas en pensant vous désaltérer avec une bière bien fraîche : ne sont servis que des heineken argentines…

Les empanadas ne sont pas très chers à l’unité 3,5€ mais comptez bien 5 minimum, soit 17,50€,  si vous ne voulez pas ressortir en ayant faim.

Je conseille plutôt les bouchons lyonnais qui proposent des menus complets avec des plats locaux pour seulement 20€ !"
294,Julien,Aupireazy,10 août 2021,Au top,5.0,family,29,"Empenadas top. Le concept est bien, commande pratique, les numéros sur les empenadas etc..
Le personnel est au top. Ainsi que le décor."
295,Manon D,D7629VAmanond,30 juillet 2021,Excellent et original,5.0,couples,4,"Très bon, permet de goûter à la cuisine argentine, original, de qualité et les serveurs sont accueillant."
296,NKMDB,NKMDB,27 juillet 2021,Rdv en Argentine,5.0,family,20,"Super expérience. Ambiance du restaurant te transporte. Les empanadas sont à ""tomber""...et la sauce !!!! Le personnel très souriant, très agréable."
297,Candy,candycZ5883BC,19 juillet 2021,Super,5.0,none,3,"Commande passée à emporter  (12 empanadas+ deux sauces chimichurri).
Très bonnes empanadas, les sauces sont un peu juste en quantité pour autant d'empanadas.
Les bières argentines étaient super bonnes.
Nous commanderons de nouveau avec plaisir."
298,Läo M,253l_om,5 juin 2021,Un joli coin d'Argentine,5.0,couples,2,"Nous sommes tombés sur ce petit coin d'Argentine par hasard... Quelle chance !

L'équipe est aux petits soins, chaleureuse et appliquée, à l'image de la cuisine.

Que vous soyez plutôt viande ou végé, les empanadas sont variés et tout aussi savoureux les uns que les autres.

Foncez !"
299,Floriane0169,Floriane0169,29 mai 2021,Belle découverte,5.0,friends,14,"Très belle découverte argentine ! Cocktails et boissons du pays,  empanadas variés (y compris pour les végêariens) et desserts excellents. Le tout fait maison et à petit prix. "
300,LoicGT,LoicGT,23 mai 2021,"Pour une première,  cela a",5.0,none,34,"Pour une première,  cela a été une belle découverte : 
Le serveur a pris le temps de nous expliquer la carte en détail , que ce soit les boissons ou bien les empanadas. 
Dans l’assiette, tout est excellent: des empanadas( carne et carne picante en ce qui me concerne) à la salade en passant par la petite sauce dont j’ai oublié le nom! 
Concernant le cadre , nous avons mangé sur la terrasse( COVID oblige )qui est agréable . 
Au moment de régler, à l’intérieur, j’y ai vu une déco fort sympathique orientée  football, évidemment, avec entre autres, un joli maillot de River Plate me semble-t-il  et quelques posters d’un certain Diego... 
Bref, j’y retournerai avec plaisir! "
301,Baptiste B,515baptisteb,23 mai 2021,Des empanadas excellents garnis,5.0,none,2,"Des empanadas excellents garnis de produits de qualité 
Service rapide et personnel chaleureux 
Pour tous les fans de cuisine argentine, adresse à ne pas louper "
302,Babeth78200,Babeth78200,22 mai 2021,Une petite pause s impose,5.0,family,108,Incontournable pour les amateurs de ces petits chaussons gourmands. Du fait maison et on le sent dans la dégustation. Et petite surprise en bonus sur le dessert. Une émotion sucrée avec leur dessert façon banofi avec une chantilly toute douce et légère
303,MelKev2011,MelKev2011,20 septembre 2020,Un régale !,5.0,friends,8,"Super pour manger sur le pouce.
Le personnel est très accueillant, le concept très sympa et les empanadas délicieux ! Ne pas hésitez à un faire un arrêt ;)"
304,Aubin,aubin1773,19 septembre 2020,À faire,5.0,none,1,"Juste un délice merci pour ce voyage gustatif 
Les empanadas sont délicieux et la petite boisson au mate est splendide à refaire "
305,PRAD,PRADOU71,19 septembre 2020,Invitation au voyage,5.0,none,1,"Les posters de saviola, trezeguet, carlos tevez et autres grands noms du football vous entourent, un air de ""buena vista"" raisonne à vos oreilles, vous devinez alors le ravissant sourire sous le masque de la serveuse. L'accueil est parfait, vous avez la carte des empanadas en main et la perspective d'une Quilmes bien fraiche semble tout indiqué."
306,Olivier C,oliviercU3466HL,22 août 2020,Très bien. Carte assez restreinte,5.0,none,13,Très bien. Carte assez restreinte mais empanadas bien préparées. Service agréable. Cadre sympa. A refaire.
307,AurelienGI,AurelienGI,22 août 2020,Un retour en Argentine !,5.0,solo,8,"J'ai enfin retrouvé ce que je cherchais. Les empanadas sont vraiment excellentes sans parler de leurs Alfajores ! 

Une mention spéciale pour la Guilmes qui me manquait tant 

J'y repasserai à chaque passage sur Lyon c'est sûr"
308,Saitama M,soufito,18 août 2020,Succulent !,5.0,friends,1,"un vrai régal ces empanadas vraiment délicieux, puis les serveurs ainsi que le gérant sont au top ! J'y retournerai sans hésiter."
309,nahema,nahemac2020,18 août 2020,Au top,5.0,friends,1,"Accueil très chaleureux, bonne ambiance et empanadas super bons! Et mention spéciale pour la pampita, un petit cocktail très appréciable!"
310,Saïd,591sa_da,18 août 2020,Un petit coin d'amérique latine à Lyon,5.0,none,2,"Les empenadas sont délicieux et l'ambiance est super, j'adore!
Pour passer une soirée décontracté tout en faisant plaisir à ses papilles gustatives, c'est l'endroit idéal."
311,Math Rocknfool,306mathr,7 août 2020,Super adresse !,5.0,family,5,"Des empanadas comme si on était en Argentine. La formule est attrayante, ludique avec son menu à numéro que l'on retrouve ensuite gravé sur l'empanada et avec un bon rapport qualité prix. Du choix et des empanadas absolument délicieuses ! Le seul reproche serait que la terrasse sur le trottoir n'est pas épargnée par les odeurs de pisse des zonards des terreaux 😒 ce serait sympa que la ville vienne nettoyer plus souvent... Mais sinon il fait bon vivre à l'intérieur avec une équipe jeune et hispanisante. Un vrai régal !"
312,Chico M,779chicom,4 août 2020,Les meilleurs empanadas de Lyon,5.0,friends,2,"Un très bon moment passé entre amis en mangeant des empanadas typiques d'Argentine !
Un pur régale que ce soit au niveau du goût et de l'ambiance.
Je recommande fortement. "
313,Mathilde I,mathildei2019,3 août 2020,Magnifique découverte,5.0,friends,1,"Magnifique découverte au cœur de Lyon qui nous a plongés directement en Amérique Latine. Décoration typique et accueil chaleureux, les empanadas accompagnés de leur cocktail signatures nous ont fait voyager en plus d’être délicieux. 
Rapport qualité prix imbattable. 
Nous avons passés une excellente soirée et le service et la propreté sont irréprochables. 
Je recommande vivement!! 
Belle découverte et soirée agréable garanties "
314,Juliette25000,Juliette25000,31 juillet 2020,Bons empanadas,4.0,family,123,"C'est un restaurant agréable pour déguster quelques empanadas à un prix raisonnable.
Nous avons bien aimé celui au poulet. À l'inverse, nous avons été un peu déçues par l'empanada du mois aux crevettes. En effet, ces dernières étaient insipides et minuscules.
Toutefois, nous avons passé un agréable moment dans un cadre joliment décoré, visible depuis une terrasse calme.
Enfin, le dessert était très bon. "
315,69voyageurdumonde69,69voyageurdumonde69,30 juillet 2020,Au top,5.0,couples,547,"Une belle ambiance, un cadre sympa,  un bel accueil,  une cuisine délicieuse ! Très sympa, à faire pour découvrir les spécialités de l'Argentine!"
316,Leila Mckenna,lp_mckenna,18 juillet 2020,Délicieux,5.0,none,1,C'était super! Le service est impeccable et le personnel est très aimable. Les empanadas étaient savoureuses et diverses avec des options végétariennes. Les boissons sont délicieuse avec des spécialités latino-américaines! Pris un dessert à mourir! Délicieux et à refaire
317,patdeG,voyageuse411,16 juillet 2020,"Original, simple et goûteux",4.0,none,14,"Contentes d'être entrées par hasard dans ce petit restaurant argentin. Très bon accueil ... agrémenté d'un charmant petit accent !
Choix de 8 empanadas (végétarien compris). La pâte est bonne ;  les farces variées et savoureuses. Je me suis régalée avec le "" carne"". Le tout accompagné d'une petite salade bien goûteuse.
Testés 2 desserts sur 3 : un régal;
Le tout fait maison à prix fort raisonnables. 
Je recommande cet endroit et j'y retournerai."
318,Marie D,mariedK782UU,12 juillet 2020,Simple mais efficace,5.0,couples,41,"Un décor moderne, un accueil efficace et agréable nous avons prit a emporté. Le temps d'attente était correct. Pour les plats nous avions prit différents empenadas pour en tester le plus possible (écouter les conseillés du serveurs 3 par personnes c'est en effet suffisant) bonne équilibre pâte/farce et beaucoup de saveur. En bref une cuisine généreuse et un accueil confortable. De quoi donner envie d'y retourner !!!"
319,Seb G,335sebg,11 juillet 2020,Super!!!!,5.0,couples,7,"Découvert totalement par hasard en se baladant... Du coup on s’est installé à midi!
Super bon et très aimable!
Je le conseille très fortement!!!!"
320,Jérôme F,jeromeflorent,25 mai 2020,Les meilleures empanadas en dehors d’Amérique du Sud,5.0,solo,2,"J’ai commandé 4 empanadas avec une sauce chimichurri (obligatoire!).
Pollo, carne, caprese et verdura. Malheureusement la jamón y queso n’était pas dispo ni l’afajor, victimes de leurs succès! Ce qui ""m’obligera"" d’en commander à nouveau. Toutes celles que j’ai goûté sont excellentes! On retrouve le goût, l’assaisonnement, la qualité du produit argentin. Un vrai plaisir!"
321,Megane Q,Megmeg1503,15 février 2020,Un superbe restaurant argentin,5.0,family,2,"Une belle ambiance, les empanadas étaient délicieux, un choix variés avec des saveurs délicieuses. Un très bon concept de commande avec possibilité de pouvoir recommander si vous restez sur votre faim. Service très rapide et qualitatif. J’y retournerai avec un très grand plaisir."
322,Annick B,258annickb,12 février 2020,À visiter sans hésitation,5.0,couples,34,"Découvert par hasard, nous avons tout apprécié : l’accueil, les conseils, les saveurs de ces délicieux empanadas, la fraîcheur des produits et les desserts ! 
Un choix sympathique de vins argentins et l’impression d’être déjà un peu en voyage avec des tables occupés par des petits groupes d’habitués de langue espagnole , dans un cadre chaleureux "
323,Thierry F,thierryf57,1 février 2020,Une belle découverte,5.0,friends,42,"Le hasard d'une facade allumée à 22 h30 et une magnifique découverte pour des produits frais et originaux.
A refaire avec plaisir "
324,Ornella,Ornellametz,30 janvier 2020,Magnifique découverte !,5.0,none,1,"Excellent restaurant où vous pourrez y déguster de délicieux Empanadas ! L'ambiance est chaleureuse, le personnel est à l'écoute et la décoration a été choisie avec soin et bon goût !

Je remercie particulièrement Alexis pour son accueil et dont le sourire irradie le lieu ;)"
325,Laura Gaz,lauragazarian,30 janvier 2020,SUPER,5.0,none,2,"Bonne ambiance, super déco, accueil impeccable, un sans faute pour cette nouvelle adresse lyonnaise. 
La cuisine est très bonne ainsi que les cocktail !

Je recommande a 100% !!!"
326,Sh T,476sht,28 janvier 2020,Soirée entre copines,4.0,none,3,"Nous avions choisis ce restaurant pour fêter un évènement entre amies et nous y avons passé un très bons moment. Le personnel est adorable. Nous avons adoré le concept, original et à la fois nous pouvons manger une spécialité argentine revisitée avec des goûts occidentaux. Je recommande"
327,Caroline M,carolinemU3881NA,26 janvier 2020,Excellente expérience,5.0,solo,1,"Très joli lieu où vous pourrez savourer de délicieuses empanadas ! L'équipe y est très agréable et chaleureuse, je recommande vivement !!"
328,Joaquin D,226joaquind,20 janvier 2020,Magnifique,5.0,friends,2,"Vraiment super
Le personnelle 5 étoiles  
L’ambiance 5 étoiles 
Nourriture 5 étoiles 
Décoration 5 étoiles 
C’est comme manger à Buenos Aires"
329,celia n,792celian,27 octobre 2024,Restaurant sympa pour déguster des empanadas,4.0,family,88,"Nous avons commandé une de chaque empanada, elles étaient très savoureuses, en particulier la spéciale (mensuelle ? ). Salade et desserts sont également savoureux. Les serveuses étaient très gentilles et sympathiques. Le seul mauvais point (à mon avis) est de manger sur des selles hautes, je préfère les chaises ordinaires mais ça ne dégage pas la qualité de la nourriture : )"
