,user,user_profile,date_review,title,rating,type_visit,num_contributions,review
116,Thomasawyer,Thomasawyer,7 avril 2017,Delicious,5.0,family,318,"Que dire de plus par rapport aux autres commentaires! J'ai opté pour le menu poissons grillés à 18€.C'est très bon et bien dressé. 
C'est cependant légèrement cher mais ca le vaut donc ca passe.
Petite info, la salle n'a jamais été pleine et pourtant au moins un client n'a pu déjeuner, car le restaurant était soit disant complet. Pensez donc à réserver ;)"
117,Bernard.C,Bernard-69890,20 février 2017,Le goût authentique du Japon,4.0,couples,307,"On retient du Japon la finesse, la délicatesse et la subtilité que l'on trouve dans la décoration des boutiques, dans l'assiette des restaurants ou dans l'agencement de leurs jardins.

Le Wasabi en est une illustration tant dans la discrétion et la gentillesse du service que dans les saveurs fines et gourmandes des sushis concoctés avec passion et talent par le chef.

La déco tamisée et chaleureuse de la salle rajoutera une pincée de romantisme à ce moment authentique.

Un bémol tout de même et pas des moindres : Les tarifs des formules sont élevés (de 32 € jusqu'à 53 € ...).
La qualité des produits et les quantités servies peuvent les justifier mais ils seront à coup sûr trop onéreux pour ceux qui sont habitués à d'autres établissements certes moins savoureux mais beaucoup plus économiques.

Le Wasabi, une parenthèse japonaise au cœur de Lyon."
118,Camil75,Camil75,18 février 2017,Très bonne adresse,5.0,couples,36,"Je vais manger au Wasabi depuis longtemps et malgré son succès, la qualité n'a pas baissé. Pour moi, c'est l'une des meilleures adresses de Lyon et c'est toujours un plaisir de faire découvrir ce lieu à des amis.

Plus: La qualité et la fraîcheur des produits, la finesse de la préparation, l'ambiance et le cadre, la gentillesse et la passion du chef. Je ne me lasse pas de la séance de dégustation proposée par le chef!

Le service est un peu lent (mais la cuisine fait vite oublier cette attente). C'est indéniablement cher, mais quand la qualité est là..."
119,Karoline M,karolinem21,10 février 2017,Dépaysant !,5.0,friends,9,"Avis aux amateurs de sushi !
La décoration nous plonge tout de suite dans un univers dépaysant et très relaxant !
Les plats sont excellents ! Les produits utilisés sont frais et de qualité."
120,macerathea,macerathea,10 février 2017,Un anniversaire en or!,5.0,family,2,"Une belle surprise pour mon anniversaire !
Repas traditionnel et délicieux en famille. De quoi se plonger à fond dans la culture japonaise quitte à ce que le chef lui-même vienne expliquer comment manger telle ou telle pièce ! Un régal, je recommande!"
121,La-dupe-69,La-dupe-69,2 février 2017,Réveillon du 31,5.0,couples,16,"À découvrir tout simplement grandiose ! Plongez dans la culture japonaise, avec son chef très typique et sa cuisine gastro !"
122,Gourmetdelyon,Gourmetdelyon,26 janvier 2017,Meilleurs sushi de Lyon !!!,5.0,friends,14,"Aucun égale sur lyon.

Alors oui!!! la déco est dans sont jus, on est pas dans les chaine de sushis avec une atmosphère ultre moderne et sobre. Mais l'important c'est l'assiette !!!

Et alors la, la qualité du poisson est sans pareil et le chef est un véritable passioné.

Il vient meme vous prendre vos baguette quand vous prenez le menu dégustation pour vous dire dans quel ordre dégusté les sushis, la sauce qu'il faut mettre etc.

Vraiment sans pareil sur lyon.

Je recommande pour les fan de sushi de qualité."
123,Hélène O,h_l_neo,19 janvier 2017,Le sushi sublimé !,5.0,friends,16,"Vous allez redécouvrir la gastronomie japonaise en goûtant les préparations de ce Maitre sushi japonais ...
Cadre bucolique, malheureusement mal situé rue d'Anvers ...
Les plats sont fins, frais, savoureux. Vous aurez en plus la possibilité d'un cours de dégustation du sushi par le propriétaire (très instructif)! 
Allez y les yeux fermés."
124,erinadupres,erinadupres,14 janvier 2017,Le sushi gastronomique,4.0,business,11,"Les meilleurs sushis que j'ai pu goûter sur Lyon. Des produits sans comparaison possible avec les géants du poisson cru ou les petits resto de sushis à volonté?

La déco est agréable, le service discret et professionnel, avec en prime des explications pour manger ses sushis. Le poisson est frais et fondant, c'est un régal pour les papilles. Et on vous propose des produits qui changent de l'ordinaire comme un sushi d'anguille grillé.

Attention cependant, la qualité et le plaisir ont un prix chez Wasabi..!"
125,ToutesDesSimone,ToutesDesSimone,14 janvier 2017,Une agréable curiosité japonaise,4.0,friends,20,"L'endroit est atypique, charmant, dépaysant... Les plats sont raffinés et très savoureux et les serveurs sont purement adorables. Une très agréable soirée."
126,THE116,THE116,12 janvier 2017,J'ai saigné du nez comme dans les mangas,5.0,couples,101,"Alors non, je n'ai pas saigné du nez parce que j'ai vu une jolie fille mais parce que mon dîner était excellent. LMAO

Le restaurant ne paie pas de mine vu de l'extérieur mais la déco est très sympa à l'intérieur. Ce n'est pas donné, il faut compter environ 40€ par personne pour un menu, mais c'est le prix à payer pour vivre une expérience culinaire japonaise différente.

Ici on vous explique tout : quel saké choisir, comment manger un sushi, dans quel ordre manger ce que l'on vous sert, à quel moment boire...

Et ça, ça fait la différence, car on redécouvre le restaurant japonais et c'est drôlement cool.

Bien sûr tous les produits sont frais, bien sûr le personnel est souriant et ultra sympathique.

Aucune fausse note, je reviendrai !

Mais juste une question : pourquoi ce nom ? C'est comme si j'ouvrais un restaurant chinois et je l'appelais : Le Nem."
127,Célia,celiafrl,11 janvier 2017,Très bon,4.0,family,41,"Ce restaurant japonais change vraiment des autres. Les produits sont très bons, le poisson est très frais (les brochettes de saumon sont délicieuses). Dessert étonnant qui permet de découvrir de nouvelles saveurs. Seul bémol, les prix sont un peu élevés."
128,Greg Sandrine Z... M,gregsandrinezackm,10 janvier 2017,2 ème fois au wasabi,5.0,couples,2,"Cette fois nous avons pris le menu wasabi à 49 euros c'était délicieux et bien copieux 
Nous nous sommes régaler
Restaurant très propre, accueil chaleureux et sympathique
"
129,LNAnt,LNAnt,8 janvier 2017,Superbe expérience,5.0,couples,11,"Amateurs de sushis, nous avons décidé de tester ce restaurant aux critiques positives.
Très bonne surprise : décoration origininale, salle non bruyante (mais l''heure était tardive). Choix varié de sake. Poisson ultrafondant. Saveurs très intéressantes.
Le fait que le chef se déplace pour expliquer le déroulement du repas et l'art de manger, est certainement un plus!
Nous y reviendrons!"
130,manueh,manueh,1 janvier 2017,Ça change vraiment des restaurants A Sushis,5.0,friends,229,"Je pense à une Chouette qui réchauffe les mains ...

WASABI est donc un restaurant japonais. Situé dans le 7eme arrondissement, la salle de restaurant dispose d'un demi-niveau ce qui donne une impression de volume et d'espace et pas de cantine avec les tables les unes à côté des autres.

On se retrouve très vite dans une ambiance zen (musique de fond douce) et japonaise, le personnel étant assurément issu de ce pays.

Au déjeuner, de nombreuses opportunités se proposent à nous. Les prix ne sont pas les mêmes que dans un restaurant classique mais la qualité justifie ce coût différent. 
Nous avons opté pour le menu appelé SUSHIS (24€) composé de Sushis, Makis et Roll (pas sur du nom). En préambule, une belle salade accompagnée de saumon mariné

En résumé, c'était très bon et fin, préparé à la minute par le chef qui vient vous présenter votre assiette et vous demande de déguster votre 1er Sushi tout en vous expliquant au préalable comment et dans quel ordre procéder.

J'ai beaucoup apprécié les Makis et les Rolls d'une taille imposante. C'était goûteux, fondant.

Voila quelques années que je souhaitais y venir. Voila c'est fait ! J'y retournerai.

"
131,Kasia J,345kasiaw,19 décembre 2016,Perfection absolue!,5.0,couples,921,"On est retournés à Wasabi, après une première expérience très réussie, il y a env. 2 ans. 
Et cette fois, on était encore plus émerveillés par cet endroit absolument parfait. Le décor est très sophistiqué et n'a rien à voir avec le décor dans 99% des restaurants sushis. On peut vraiment se laisser transporter ailleurs... 
Le service est impeccable, rapide et d'une grande gentillesse. 
Et enfin, les sushis, tout simplement divins! Le menu sont composés de plusieurs petits plats, les sushis servis dans un ordre spécial, en fonction de l'intensité de gout. 
C'est un restaurant assez cher, certes, mais ça vaut absolument le coup! Je recommande vivement."
132,DietAddict,DietAddict,18 décembre 2016,La perfection Japonaise,5.0,couples,302,"Meilleur Japonais que j'ai pu tester dans ma vie. 

La fraicheur du poisson et l'art de le cuisiner, le trancher et de l'assortir vous permet de découvrir une authenticité culinaire asiatique juste parfaite.

Les serveurs méritent aussi beaucoup de reconnaissance par leur accueil, leur gentillesse et leurs explications des plats et techniques de les déguster, irréprochables.

Pour finir le repas avec légèreté, je vous conseille vivement la glace au sésame !

Merci pour ce voyage culinaire .."
133,_ppaturel,_ppaturel,8 décembre 2016,Un havre de paix et de sophistication culinaire,5.0,couples,8,"Quand vous pénétrez dans ce restaurant dont la devanture a-priori ne vous attire pas mais vous rappelle qu'il ne faut pas se fier aux apparences, vous entrez immédiatement dans un cocon de sérénité; le cadre est reposant, raffiné et simple à la fois: toute la délicatesse du savoir-faire japonais; l'accueil est agréable, un savoir-être exemplaire; le propriétaire et maître sushi possède à la fois une  discrétion et un charisme appréciables; les menus attirent la curiosité et le menu choisi fait écho à la musique de fond reposante: du piano qui m'évoque le célèbre auteur de la musique du film ""In the mood for Love"" du compositeur Shigeru Umebayashi, un chef d'oeuvre qui sied à merveille en accompagnement de cette cuisine raffinée que l'on va déguster;
le menu choisi composé de sushis,sashimis, thon et saumon crus et autres délicates bouchées est un véritable délice, un chef-d'oeuvre pour le palais;la salade d'entrée au préalable parfaitement dosée et légère à souhait aussi ; la chance est d'avoir le maître qui vient nous expliquer comment déguster ces mets  dans un ordre établi pour savourer au mieux leurs parfums et leur texture;on apprend dans les règles de l'art tout en se délectant de ces exquises bouchées avec la soupe et le thé pour ""se rincer la bouche,"" comme dit le maître, entre chaque douceur; oui c'est le cas: on s'évade au japon et cette expérience nous invite à vouloir en connaître d'avantage et donc à partir un jour là-bas; le repas est plus que copieux , on pourrait en fait manger à deux sur le plateau géant de ces nombreux mets; le maître sushi nous offre même le café et est heureux d'entendre le ""Domo arigato gozaimasu"", réminiscence de termes japonais retenus; c'est un restaurant où la qualité est maître mot;l'hospitalité aussi et la détente de même; à faire en amoureux, entre amis, en famille ou entre midi et deux pour s'aérer du travail , en gourmets passionnés;le décor  de charme tamisé avec petites lumières entrelacées dans des filets, des étoiles, des bambous et autres jolis estampes nous font rêver et offrent une quiétude du début à la fin; Excellent endroit à découvrir ou redécouvrir; on a envie d'y revenir encore et encore; il faut absolument s'y rendre il vaut tous les restaurants chics;et la simplicité rajoute à l'envie de rester; les repas sont des tableaux : beaux et bons, voire excellents;parfait!"
134,Marion B,128marionb,25 novembre 2016,Sushis parfaits !,5.0,family,3,"Deux visites chez Wasabi en 3 ans, c'est définitivement le meilleur restaurant japonais que j'ai pu tester ! On vous apprend à les manger selon un rituel précis, ils ont un gout et une fraicheur inégalés ! On en a pleins les papilles directement !"
135,Didier C,didierc836,23 novembre 2016,S'il n'en fallait qu'un,5.0,friends,33,"Si vous cherchez un Resto rapide et froid pour avaler vite fait quelques sushis ne venez pas là, car ici La deco est chaleureuse et originale, les menus ont une raison d'être et on indique meme dans quel ordre manger. C'est sans doute le meilleur restaurant japonais de Lyon d'ailleurs la communauté asiatique y va régulièrement, signe de plus s'il en fallait un que l'authenticité est là. Seul bémol : il ne faut pas être pressé, mais ce n'est pas grave"
136,Cissou20,Cissou20,19 novembre 2016,A tester absolument !,5.0,family,3,"Nous avons passé un super moment ! La déco est très sympa, chaleureuse.
Nous n'avons rien à redire, le service et l’accueil était top, les serveurs tous très sympa et la cuisine très bonne ! 

Nous recommandons vivement ce restaurant et nous y retournerons !!"
137,AymericM,AymericM,30 octobre 2016,"Authentique, Excellent repas",5.0,business,9,"Repas excellent, qualité supérieure des ingrédients.
Le chef vient à table pour donner quelques conseils.
Décoration typique, atmosphère agréable.
Le tarif est à la hauteur de la prestation"
138,Eric S,ericsW9513RV,23 octobre 2016,Très bonne cuisine japonaise,5.0,family,31,"Je me décide à mettre un avis aprés plusieurs fois dans ce restaurant. Le service est en général bien souriant et professionel. Les menus sont copieux, et préparés avec des produits (poisson) très frais. Le sushi saumon yuzu est exceptionnel.  Si je doit trouver un défaut c'est le prix "
139,Nana.17,Nana_soko,20 octobre 2016,Une bonne expérience mais sans plus,4.0,couples,63,"Nous avons choisi ce restaurant pour feter nos deux ans, et etant des amateurs de sushis-makis nous voulions absolument tester un restaurant gastronomique spécialisé en sushis pour cet evenement. Le cadre est super, la musique douce est discrete et parfaite pour l'ambiance. Attention pensez a reserver 2 j a l'avance ! le temps d'attente est long mais on c'est dit que c'est pour la bonne cause...Pour moi un menu wasabi et pour mon copain un menu maki que l'on c'est partagé pour pouvoir en découvrir toutes les saveurs.Je n'ai jamais gouté une aussi bonne dorade, les sushi son extra mais les makis ne changent pas des autres restaurants. le tartare de saumon est en verité une salade accompagnée de quelques lardons de saumons, le dessert certe original mais pas extra au niveau du gout. en revanche un bon point pour les serveurs qui n'hésitent pas remplir nos verres vides. pour conclure a part pour la dorade je n'ai pas été spécialement conquise."
140,Pierre V,pierrev883,19 octobre 2016,Une merveille,5.0,couples,132,"Le Wasabi est vraiment le restaurant de Lyon où il faut déguster les sushis.
Le cadre est reposant, et les sushis sont une vrai merveille.
Le chef les confectionne et viens vous expliquer comment les manger.
Le personnel est attentionné.
Un must..."
141,Sasha B,sashab812,15 octobre 2016,Un vrai délice !,5.0,family,84,"Un vrai asiatique pour amateur de sushis mais pas que ! Tout est bon dans ce restaurant où nous allons régulièrement 
Un réel plaisir de découverte en plus du cadre magnifique 
Le petit plus, la venue du chef à table qui nous explique comment manger son plat et dans quel ordre car oui il y'a une façon de manger les sushis et un ordre en fonction du poisson 
Vraiment génial je conseille fortement !"
142,Ellimacdee,Ellimacdee,12 octobre 2016,Bon mais tout de même déçue,3.0,couples,22,"On m'avait énormément parlé de ce restaurant, j'adore la cuisine japonaise donc je m'étais fait une vraie joie d'aller manger la bas...
Après un menu à 50 € je dois reconnaitre que je suis déçue. Les beignets de crevettes, les sushis, les sashimis étaient assez banals. Il y a eu quelques pièces un peu meilleures, la soupe miso, la salade au tartare de saumon était bonne. La glace à au sésame noir une délicieuse découverte...mais dans l'ensemble ce n'était pas si différent de notre restaurant de sushi habituel qui est largement moins chère....
Je trouve que le rapport qualité / prix n'est pas celui que j'attendais."
143,veroniquep638,veroniquep638,9 octobre 2016,Un court instant au pays du soleil levant,4.0,family,252,"On ne s'attend pas à une telle décoration quand on franchit le seuil. Une fois installé, on part à la découverte de la carte : grands choisir de menus - de bière japonaise et de saké. Nous voilà prêt à déguster, nous sommes guide dans la dégustation par des explications et quel plaisir d'avoir la venue à notre table du chef kim qui nous fait une démonstration précise de comment bien manger à la façon japonaise. Fraîcheur des poissons. Une belle adresse "
144,Daniel T,DanielT7537,5 octobre 2016,Enfin un restaurant japonais ...,4.0,couples,5,"Très belle découverte.

Grand amateur de cuisine japonaise et passant tous les jours devant ce restaurant, j'ai décidé de m'y rendre avec mon épouse.

Le cadre est atypique et très sympa, la carte également avec un menu découverte où on vous apprend à déguster les sushis comme il se doit.

Très belle expérience.

Les prix sont un peu élevés certes, mais il faut savoir se faire plaisir et manger ""vrai"" plutôt que d'accumuler les bouis-bouis pas chers"
145,Patrick C,PatrickC479,29 septembre 2016,Tout simplement très bon,4.0,business,31,"Même si ce n'est pas donné, il clair que la qualité est là et le Sushis... sont excellents. Le chef et le personnel vous conseillent sur la manière de déguster (ordre défini). Un bon moment de découverte. Ouvert le soir et fonctionne avec principe de menu uniquement."
146,Alex,S3826AOmartinp,28 septembre 2016,Partagé,2.0,couples,27,"On m'en a beaucoup parlé en bien, peut être trop...car j'ai été un peu déçu.
Mon amie et moi avons pris un menu à 33€. Le miens composé de brochettes, le siens de sushis.
Salade de saumon en entrée vraiment basique, peu de saumon, quelques feuilles vertes et une vinaigrette. 
Mes brochettes n'avaient rien d'exceptionnel, celles au bœuf limite et il fallait décortiquer les gambas...mais mon amie a adoré les sushis. La soupe miso est basique aussi.

En dessert, un financier au thé vert et une boule de glace au sésame noir. Le dessert était original et bon.

Niveau service et cadre, ce n'est pas grandiose et pas cohérent avec les tarifs (toilettes modeste, le gel mains en plastique et les serviettes de toilettes premier prix...)

Au final bon, mais rien de transcendant surtout pour le prix. Mon amie m'a avoué que la qualité avait baissé depuis 3 ans."
147,Cle,984cl_mentl,25 septembre 2016,Whaou les sushis !!,5.0,family,119,"Je n'avais pas mangé de sushis aussi bons depuis... le Japon!! Vraiment excellents. Ils vous expliquent même le sens de dégustation pour le goût. 
Personnel très agréable. 
Tarifs élevés (comptez 35€ en moyenne par personne) "
148,WilDeLyon,WilDeLyon,15 septembre 2016,Sushis,5.0,couples,1284,"Toujours aussi bon, mais certes cher.
Les sushis sont vraiment excellents, préparés avec rigueur, avec des produits de choix.
La déco est atypique.
L accueil est japonais, le chef pédagogique."
149,Siphie26,Siphie26,31 août 2016,Gastronomique,5.0,couples,59,"Ce restaurant propose un repas gastronomique autour des sushis. 
Le prix est certes onéreux mais justifié par le cadre, la qualité des produits et par les explications données par les serveurs. 
Un très bon moment. "
150,Eugénie,eleeena29,29 août 2016,Quel beau restaurant !,5.0,family,78,"Petit dîner entre frère et soeur passionés du Japon et pas déçus ! Sushis frais, bento bien garni, belle présentation et alors une décoration du restaurant super jolie ! Romantique si vous y allez en amoureux !"
151,Expedition151442,Expedition151442,26 août 2016,Pour une 1ère quelle belle découverte!,5.0,none,8,Parfait du début à la fin. Le poisson est frais et toutes les saveurs sont là. Service très agréable juste un tout petit peu long. Mais on oublie cela très vite quand nos papille se régalent. Restaurant enregistré je reviendrai!
152,zazadebellaigue,zazadebellaigue,18 août 2016,Excellent et cadre agréable,5.0,family,7,"Que du plaisir !
Des mets de qualité cuisinés par un chef cuisinier adorable et passionné qui aime partager les traditions japonaises.
Un cadre original qui reprend toute la symbolique de ce pays."
153,Randazzo G,randazzog,16 août 2016,Au top,5.0,none,6,"Au top ..... Le meilleur des restaurants japonais que je connaisse... Le meilleur tout simplement ... Une
Prestation et une nourriture haut de gamme fait par un chef haut de gamme .."
154,Rouge K,rougek949,31 juillet 2016,Génial,5.0,friends,11,"Cuisine et alcool typique vraiment délicieux. Une référence pour qui aime le poisson bien frais. Décoration intérieure sympathique, pas trop d'attente, personnel aimable. Prix un peu élevé mais c'est à faire. "
155,Samantha,sam_crvh,25 juillet 2016,Un régal,5.0,couples,15,"Ce restaurant figure parmis mes préférés ! Certes les menus tournent principalement autour du poisson cru, mais le chef s'emploie à nous faire de bons sushis avec des sauces étonnantes. Le personnel n'est pas très causant, mais toujours près à répondre à nos questions. Je conseille vivement cette adresse. "
156,PhilF01,PhilF01,12 juillet 2016,A essayer absolument,4.0,couples,64,"La vitrine ne paie pas de mine, mais l'accueil, le service et les plats sont succulents. Reçu en fin de service et partis les derniers, cet établissement est un incontournable Japonais Lyonnais."
157,Junipaja,Junipaja,2 juillet 2016,Le voyage des papilles !,5.0,couples,20,"Le cadre : un restaurant intimiste , déco fleurie et lumière tamisée !
Les boissons : whisky japonais, thé au jasmin ...
Les plats : tout est délicieux et délicat : saumon fondant, poissons sauvages, assaisonnement parfait !
Le petit plus : le Chef vient vous expliquer à table dans quel ordre déguster l'ensemble des réjouissances de votre plateau Bento !"
158,finconnaisseur,finconnaisseur,14 juin 2016,un vrai japonais avec des très bons produits,5.0,family,80,dépaysement total tant par la cuisine que par la décoration ainsi que par le service. Véritables sushis frais et de qualité. La fraîcheur et la propreté sont au rendez-vous. Je recommande fortement.
159,Bladecobra,Bladecobra00,12 juin 2016,Décevant,3.0,family,22,"Nous sommes aller dans ce restaurant pour découvrir une autre dimension de la cuisine japonaise. Un accueil très réserver mais efficace. En ouvrant la carte des menus nous avions été frustré par le peux de choix et le prix des menus qui étais trop excessif. Nous avons pris une soupe miso succulente et des sushis très décevant. En effet nous avons eu des sashimi de saumon de mauvaise qualité (ogm). Le thon étais en fait de la thaunine. Les sushis à la dorade et à la sol n'avait aucun goût pourtant je n'étais pas enrhumé mais toute fois les California Maki étais d'une très bonnes qualité. Le dessert qui étais un financier au the vert n'avais aucun goût. Au final addition très salée, et nous sommes rester sur notre faim. Je ne reviendrais pas."
160,Veronique Z,veroniquez2018,30 mai 2016,Poussez la porte : partez en voyage !,4.0,friends,109,"Laissez vous conduire par le personnel attentif et souriant vers des mets raffinés, des gouts différents venus d'un Japon non standardisé.
La décorations est adorable, les portions sont copieuses, la soirée s'écoule  sereinement. Goutez au The au Yuzu Youjacha pour finir !"
161,Stéphanie B,386st_phanieb,29 mai 2016,excellent !,4.0,friends,1,"nous avons passé une très bonne soirée entre amis. la déco est travaillée et nous avons l'impression d'être sous un ciel étoilé avec toutes les petites lumières au plafond ! les menus sont très copieux et nous nous sommes régalés. La serveuse très souriante a pris le temps de nous expliquer chaque plat, et surtout comment les manger (dans quel ordre). Bref, nous avons voyagé le temps d'une soirée, et reviendrons c'est sur !"
162,Nina,nina19901,7 mai 2016,Un régal,4.0,couples,3,Un régal. Bon accueil. La déco est très bien aussi. Le chef nous explique son plat. En revanche le menu complet et beaucoup trop chère!!!!
163,TT69,tatal69,25 avril 2016,Bon mais...,4.0,family,40,"Trop cher, pas assez de choix, et serveurs prétentieux. Les california maki sont à tomber par terre, mais les sushis sont insipides..."
164,CortoMalteseLyon,CortoMalteseLyon,18 avril 2016,Excellent !!!! A tester de suite et en toute confiance !!!,5.0,couples,118,"Réservation obligatoire même pour un vendredi soir....Atmosphère à la fois cosy, feutrée et originale dans un mélange de déco traditionnelle et moderne/vintage...Acceuil des plus agréables...Attention, c'est vite blindé du fait d'une renommée que ce restaurant est en train de se faire.

C'est un régal.....Tout est fait maison et fond dans la bouche avec du goût....Des sushis, makis et autres curiosités gastronomiques...Tous les produits sont expliqués...Je ne sais pas si il s'agit de spécialités coréennes ou japonaises...Mais un endroit et un moment culinaire top !!!! On nous explique comment manger les produits et dans quel ordre. A tester et à recommander à tous les coups !!!

Très bon rapport qualité prix pour ce type de cuisine aussi raffinée !!!"
