,user,user_profile,date_review,title,rating,type_visit,num_contributions,review
0,Filipe d,964filiped,24 avril 2024,Le meilleur restaurant Japonais de Lyon,5.0,couples,3,"C’est incontestablement les meilleurs restaurants Japonais (même si Mr Kil est Coréen) les suchi, sashimi, nigiri de Lyon.
C’est un Itamae pour moi."
1,Kriskova,nataliakriskova,29 mars 2024,"Cher, plutôt bon, mais je n'y retournerai certainement pas",3.0,family,5,"Nous avons voulu partager un menu (la quantité est énorme pour une personne), on nous a dit que ce n'était pas possible, puis que si, ok, on ferait une exception. Résultat, on a eu des choses redondantes (plusieurs sushis crevettes) là où on aurait dû avoir une plus grande variété de poissons. Bref, ils ont économisé sur la marchandise. Je trouve cela malhonnête. Trop cher pour ce qu'on a dans l'assiette, et service pas aimable, le personnel n'est du reste, pas plus japonais que dans des maisons de bas de gamme."
2,Expedition184324,Expedition184324,5 février 2024,Pour un moment Zen,5.0,family,6,"Pour un moment Zen, vous êtes à la bonne place. Nous sommes difficiles sur le plan culinaire, mais c’était une belle expérience. Ici le décor, le service, la fraîcheur et le goût des sushis, tout devrait vous satisfaire, comme nous l’avons été. Prix un peu plus élevé qu’ailleurs mais mérité."
3,chloe,Pioneer14728317716,30 décembre 2023,Juste wahou !!!,5.0,family,68,"Une qualité incomparable, des saveurs mémorables… par gourmandise on aurait réussi à en manger plus sans problème.
Le menu enfant était parfait pour notre fille.
À recommander"
4,Anna S,D8509VUannas,15 septembre 2023,Évidemment le meilleur restaurant japonais gastronomique de Lyon,5.0,friends,3,"Pour les amateurs de cuisine japonaise et coréenne. Un cadre somptueux, j'ai été  estomaquée en entrant ! Les sushis/makis/sashimis d'une qualité incroyable. Bravo !"
5,Marion C,890marionc,18 août 2023,L'univers de Miyazaki,5.0,couples,132,"Sans conteste le meilleur restaurant japonais de Lyon, dans un lieu magique qui pourrait sortir tout droit de l'univers de miyazaki ou de  makoto shinkai . Les prix sont plus élevés qu'ailleurs, mais la qualité est toujours au rendez-vous . Le chef est passionné et viens vous expliquer l'ordre de la dégustation à la table . Nous l'avons découvert il y a plus de 10 ans et y retournons occasionnellement depuis . "
6,Berrymcgregor,Berrymcgregor,10 août 2023,"Superbe, comme toujours",5.0,couples,332,"Venus ici plusieurs fois, nous sommes à chaque fois émerveillés par la qualité des produits et la délicatesse de la présentation. Le goût des poissons est incomparable, le service est impeccable. Les sushi à l'anguille sont à tomber. Merci encore."
7,DomDeLay,dominiquedY4864OK,8 août 2023,Toujours très bon 🙏,5.0,couples,49,"Maître Kim ""le vrai"" que je connais depuis presque 20 ans🙏 où la qualité est toujours au Top 👏
#wasabilyon"
8,JLMR C,Jlmrc,13 février 2023,Une très bonne adresse pour manger de bons produits japonais,5.0,family,63,"Une adresse où on vous apprend à apprécier et à déguster de bons produits japonais. 
Peut être un petit peu cher mais les menus sont excellents et de type gastronomiques. 
Belle découverte, nous reviendrons sans hésitation pour passer un moment culinaire asiatique. 
Merci au chef !"
9,maxrvp20,maxrvp20,20 janvier 2023,Un très bon moment,5.0,friends,928,"Quel joli restaurant, particulièrement bien décoré, c’est très joli. Ambiance douce. 
Les mets sont très bons , les poissons sont frais et variés, le service est aux petits soins. Attention ce n’est pas donné mais c’est du semi gastro asiatique donc cela se justifie ! N’hésitez pas"
10,Franck D,DrHLyon,4 novembre 2022,Bon mais trop cher,3.0,family,138,"Rien à reprocher. Mais pas d’effet waow non plus. 

Et vu le montant de l’addition, j’attendais plus de surprise et d’originalité."
11,Kawotte,Kawotte,5 août 2022,Ne plus jamais manger de sushi ailleurs....,5.0,none,34,"Juste parfait. Ce n'est pas un restaurant de sushi habituel, mais un gastro, aucun doute. N'y aller pas pour manger un vulgaire California Maki, mais pour y déguster des sushis dans l'art de ceux-ci. 
Avec un vrai maitre sushi aux couteaux, un service attentif et qui vous explique la tradition et la façon de faire (quand on a l'habitude d'engloutir ses sushis quasi préfabriqué aujourd'hui).
Une excellente expérience pour les afficionados de la cuisine japonaise, même s'ils se cantonnent à des plats simples qui plaisent à tout (du moins quand on est Français et qu'on y connait rien.
J'aurait aimé un peu plus de variété dans les plats avec des propositions plus typiques, mais même s'ils ne font que des plats classiques (sushi, sashimi, tempura). Aucun doute, la qualité est au rendez-vous et vaut grandement le prix. 
De très bons conseils sur la carte des sakes.
Un service attentif et bienveillant.
Bref nous on a adoré. Ma fille a déclaré que suite à cette expérience, elle ne pourrait plus manger de sushi ailleurs..."
12,Romain A,tiromh,23 mars 2022,Au top !,5.0,couples,97,"Vraiment tout au top, du cocktail apéro, au dessert, en passant par les sushis, les explications et le service. A refaire sans hésiter. Attention c’est un semi-gastro, les prix sont plus élevés"
13,Patrice G,867patriceg,19 février 2022,De belles retrouvailles,4.0,couples,189,"Dîner en amoureux un soir de semaine. Nous n'y étions pas retourné depuis le Covid ! La carte est dorénavant constitué de menus. Si vous voulez des sashimis, ce sera à la carte et il faut passer commande 48 heures à l'avance. Sinon, nous avons été très satisfait par nos deux menus (Ebli et Taï). La carte des sakés est toujours aussi généreuse. Wasabi reste un incontournable de la cuisine japonaise à Lyon, parce qu'il est tenu par des japonais ! "
14,EmyMalik-24,EmyMalik-24,18 février 2022,Excellent,5.0,couples,4,"Un délice ! 
Une première fois pour moi et sans regret 
Alors certes les menus sont élevés mais c’était un vrai régal. 
Un nuage en bouche , très très bon ! 
Nous avons passé un très bon moment."
15,Berrymcgregor,Berrymcgregor,30 décembre 2021,Magnifique,5.0,none,332,"Absolument incontournable si vous aimez la vraie cuisine japonaise et souhaitez changer des sushis bas de gamme. C'est un peu cher, c'est certain, mais la qualité est indéniable. Tout est raffiné et délicieux. Et on ne repart pas en ayant faim.
Le service est impeccable, la présentation juste parfaite et le personnel est adorable. Nous n'avons jamais été déçus et nous reviendrons encore."
16,Hédia M,h_diam2021,22 septembre 2021,les prix grimpent et la qualité se dégrade,2.0,none,1,"il y a deux ans le gros menu était à 50 euros et le petit à 30 euros.  C'était très bon et copieux. C'était parfait
Hier, le menu à 50 est passé à 68 et le menu à 30 est passé à 32, mais sans sushis!  Ils sont remplacés par un pavé de thon  que personne n'a apprécié à table.
Nous n'y retournons plus, et ne recommandons plus"
17,jean v,154jeanv,14 septembre 2021,excellent japonais à Lyon,4.0,none,172,"Les menus sont complets et savoureux. J'ai essayé de challenger la serveuse sur certains plats (cailfornia rolls, excellents dans ce resto) que je ne pensais pas originaires du Japon : au bout d'un moment elle a confié qu'elle n'était pas japonaise !
Tout était bon, un peu trop de saumon représenté dans les sushis sashimis.
Nous avons passé une très bonne soirée."
18,Azalahis B.,Azalahis,18 août 2021,Très cher pour la quantité et ambiance froide,2.0,family,1,"Les produits sont indéniablement frais mais il n'y a que des menus qui commencent à 39€, pas de carte, les quantités sont moyennes. Les plats pas plus originaux, malgré les apparences, que dans le 1er restau de sushis venu. L'ambiance est froide. Les vins sont tous chers pas moyen de prendre au verre.
Bref c'est surfait, un restau qui ne mérite pas le détour."
19,Mathieu K,746mathieuk,7 octobre 2020,Un petit voyage à l'est,5.0,couples,11,"Petit restaurant convivial ou le chef n'hésite pas à venir en salle expliquer l'ordre dans lequel déguster les sushis sashimis makis...
Les mets sont frais très bien réalisés et surtout très bons"
20,25Philippe25,25Philippe25,29 août 2020,Excellent,5.0,none,17,"Première fois pour moi dans un vrai japonais .
Habituellement grand fan de restaurant « traditionnel «  et de viande sous toutes ces formes je viens pour faire plaisir à ma femme et à ma fille et la patatra tout est excellent . Je me mets à manger du poisson cru ...et j’aime ça !!
À refaire lors de notre prochaine escapade lyonnaise 
Je recommande sans aucunes modérations👍👍"
21,John Bap,johnbapyes,26 août 2020,J’ai joui de joie,5.0,none,1,"J’ai joui de joie, c’était orgasmique! Les sushi son frais, succulent, délicieux et cela fond dans la bouche. Le service est impeccable. I loved it !!"
22,Bérénice,Berenice_loire,14 août 2020,Excellent,5.0,couples,46,"Très bon repas accompagné d’un délicieux saké, les poissons sont frais et très tendre
Serveur très sympathique 
Tres belle salle
"
23,Eloo,elodieMassa,7 août 2020,Laissez vous guider par ce,5.0,none,3,"Laissez vous guider par ce restaurant 
Nous avons été agréablement surpris
La qualité est au rdv 
À bientôt "
24,Olivier B,olivier38b,26 juin 2020,Un vrai restaurant japonais,5.0,friends,216,"Un vrai restaurant japonais à lyon. 
Qualité exceptionnelle qui vaut largement le prix. 
Portions parfaitement adaptées. 
Des conseils prodigués sur la façon de déguster chaque plat. 
Un must à Lyon "
25,fda,Fatihaaaaaa,6 mars 2020,Sushis sashimis !,4.0,family,2,"Un accueil comme au Japon, des produits frais, un service impeccable et des préparations au top.  A refaire "
26,Jean-Yves,155jeanyves,31 janvier 2020,Sushi d'or,5.0,none,9,"Quel plaisir de revenir dans cet établissement! Tout est frais et préparé par le Maître Sushi au dernier moment. Californian rolls comme nul part pas même en californie! Même les accompagnements sont frais et délicieux. Et le Maître prend le temps à chaque fois de faire le tour des tables et vous expliquer l'art de la dégustation des Sushis, l'ordre de dégustation. Et quelle merveille en bouche. Mon restaurant Japonais préféré et de loin à Lyon.
Je lui décerne mon Sushi d'or! "
27,JFD,Jfdeparis,30 janvier 2020,Vrai japonais,4.0,family,206,"Rares sont les bons restaurants japonais, wasabi fait parti des exceptions. La rue dAnvers se rapproche de Tokyo. Sushi excellents, fraîcheur et qualité du poisson, cuisson du riz parfaite (avec sa pointe de wasabi), si ils avaient été servi tièdes alors c’était 5 étoiles.  Thé vert grillé, glace sésames. Service efficace et agréable. "
28,jbpp73,jbpp73,19 janvier 2020,Excellentissime,5.0,none,14,"Très bonne table de spécialités japonaises, Cadre et personnel agréable, Menu Wasabi plus que copieux, j'ai testé tout les plats ils sont délicieux ! mention spéciale a l'apéritif au yuzu et à la glace au sésame noir, un délice."
29,Fabaca,Fabaca3,16 janvier 2020,Délicieux suchis,5.0,friends,7,"Fondue au top, suchis vraiment délicieux, dans un décor pleins de détails. Mon restaurant japonais préféré !"
30,Jajaja003,Jajaja003,11 janvier 2020,Deuxième passage au wasabi,5.0,couples,25,"Deuxième passage au wasabi ! Tout y est toujours parfait : le service, la salle , le repas . Merci encore ! "
31,JM_Bien74,JM_Bien74,4 janvier 2020,Superbe moment !,5.0,friends,68,"Superbe moment !

Loin des sushis « fast food », ce restaurant offre une vrai dégustation de sushis fins et de qualité. 

Tout est fait minute et maison. Les conseils de dégustation viennent avec le service et le cadre est extrêmement reposant. 

Tout pour faire de cette expérience un moment très agréable !

Merci !"
32,Jolecado,Joce_Aldo,10 décembre 2019,Très bon restaurant japonais,4.0,couples,99,"Le cadre est très raffiné avec vue directe sur la cuisine
Le chef est un artiste 
La nourriture est tout simplement excellente 
Le seul petit bémol est le prix 
A tester au min à une fois car le goût du poisson est tout simplement divin "
33,Thomas Kim,beomj_k,25 octobre 2019,Le meilleur restaurant japonais de Lyon,5.0,friends,1,"1. Une déco géniale qui nous emmène loin loin loin, on ne dirait pas qu'on est à Lyon.
2. Le chef aimable qui nous explique l'art de déguster les sushis (l'ordre des poissons, se rincer le palais...)
3. Leur belle collection de saké (le Dassai était fantastique) et le cocktail prune 😍
4. La vision plus que plaisante des plats
5. Les succulents sushis: le poisson est plus que frais, l'assaisonnement du riz excellent, les sushis spéciaux magnifiquement bons. 
6. Le dessert à couper le souffle (surtout la glace au sésame noire)

En somme: allez-y. Ce seront les meilleurs sushis de vos vies.

Le restaurant est un semi-gastro donc c'est un peu cher, mais l'expérience vaut le coup largement. 
"
34,Gilles K,gillesk225,15 octobre 2019,Un délice,5.0,couples,6,"Nous avons suivi les avis trip Advisor pour choisir ce restaurant.
Accueil très courtois avec une décoration très apaisante de ciel étoilé.
Pour la dégustation, le chef nous conseille afin de sublimer notre repas.
Nourriture excellente.
Je recommande sans hésiter."
35,Berrymcgregor,Berrymcgregor,22 septembre 2019,La perfection !,5.0,none,332,"Si vous aimez la vraie cuisine japonaise, vous pouvez venir les yeux fermés. La qualité des poissons est juste incroyable, la présentation des plats est magnifique, tout est raffiné et délicieux.
Ce n'est pas le restaurant le moins cher, c'est vrai, mais c'est juste incomparable avec les chaînes de sushis classiques que l'on trouve ici et qui, pour la plupart, n'ont rien à voir avec la vraie gastronomie japonaise.
Et super service, comme d'habitude."
36,phr0d,rhododendrite,3 septembre 2019,La magie n'opère plus,2.0,none,35,"Chef Kim ne fait plus rêver, pire, il surcuit les poissons. Cette adresses qui fut l'un des sinon le meilleur japonais traditionnel est tombée dans la facilité et ne justifie plus, loin de là les tarifs de ses menus. Les nouvelles formules sont quelconques et surfaites.

Une très grande déception après tant de plaisir. A revoir complètement au niveau produits et prestations du chef. Peut-être est-il trop âgé pour servir autant de tables?"
37,Aurélie G,Aurelie69620,17 août 2019,Au top !,5.0,none,9,"Le restaurant est joliment décoré, les serveuses et le chef sont très agréables, souriants et gentils. La cuisine est raffinée, les poissons d'une très bonne qualité, le saumon fond dans la bouche et la glace au sésame est excellente. Nous nous sommes régalés dans ce restaurant."
38,Emarie71 🏝✈🌵🌻🏖🌞,Emarie71,21 juillet 2019,Succulent,5.0,family,1677,"Premier japonnais pour ma part : superbe découverte 
Serveurs de très bons conseils 
Nourriture d'une finesse exceptionnelle 
Un régal "
39,Gladys Z,616gladysz,26 juin 2019,Bien,3.0,couples,110,"Bel accueil . Gentillesse des serveuses à noter... une belle décoration dans le restaurant.
nous voulions partager un gros menu à 58 euros qui nous a été refusé ... pousse un peu à la consommation. Car le menu était très copieux.. 
Donc nous avons pris deux menus plus petits a 38 euros et 42 euros (salade plat ou Makis, riz, dessert)
La carte n’est composé que de menus donc pas le choix et les Makis et sushis sont très classiques. Dommage pour le manque d’originalité.
Cependant belle qualité des ingrédients tels que les poissons crus. 
Il faut prévoir un certain budget .
Note à 110 euros pour deux menus, 2 boissons et une demi bouteille de rose de Provence. "
40,Olivier M,W9208UAolivierm,19 juin 2019,Exceptionnel,5.0,business,79,On est tous à avoir mangé japonais à la va vite un midi pour 15 euros. On a un repère . On sait bien que ce n’est pas du haut de gamme mais ce n’est pas si mauvais. Et bien avec ce repère allez chez wasabi et vous découvrirez ce que c’est que la finesse de la cuisine japonaise. Les goûts et les saveurs sont juste incroyables. Certes le prix est là plus du double de 15 euros mais à la première bouchée c’est justifié.
41,KAB,kim-arth,31 mai 2019,Tout simplement parfait,5.0,couples,11,"Sushis maîtrisés de bout en bout, un voyage au japon le temps d'un repas, Wasabi est certainement l'une, si ce n'est LA meilleure adresse de sushi de Lyon !"
42,YVES F,yvesf414,28 avril 2019,Excellent,5.0,friends,12,De vrais sushis préparés devant vos yeux dans une ambiance qui s'accorde parfaitement avec les plats
43,John,johnsmith000000,14 avril 2019,Un régal,5.0,none,7,"Certainement les meilleurs sushis de Lyon.
Ça n’a rien à voir avec toutes ces chaînes qui travaillent du poisson congelé, la on a du poisson frais et de qualité et en plus on est servi par le chef en personne 😍"
44,Nicolivia,Nicolivia,7 avril 2019,Enfin un vrai restaurant japonais à Lyon,5.0,couples,13,"Ravi .... ravi de trouver un restaurant qui propose de manger comme dans les VRAIS restaurants japonais, avec les coutumes qui vont avec ... frais frais et goûtu je dis juste bravo
Merci"
45,Baptiste G,880baptisteg,7 avril 2019,Excellents sushis,4.0,friends,71,"À tester !! Tout est très bon de l'entrée au dessert (nous avons pris le plus gros menu à 58€ le soir). Les poissons sont frais, le riz délicieux, le service est très pro avec des explications sur les différents sushis. A faire au moins une fois car l'addition est tout de même élevée ! "
46,Leya67,Leya67,7 avril 2019,Excellent,5.0,family,44,"Découverte cette semaine suite aux excellents avis... pas déçue!! une excellente soirée avec un service charmant et un défilé de saveurs. Les sushis sont vraiment un délice, une vraie expérience pour moi qui ai l'habitude de sushis de ""chaines"", bons mais sans plus. (les makis cependant ne sont pas très différents d'ailleurs, mieux vaut prendre les sushis ou même les california rolls). C'est plus cher bien sûr, mais la qualité le vaut largement! Nous reviendrons!"
47,ascel69,ascel69,31 mars 2019,L'excellence même des spécialités japonaise,5.0,couples,1,"Un maître dans l'art de la gastronomie japonaise. Nous poussons la porte de ce petit restaurant cosi où l'instant d'un repas, le temps s'arrête. Nos papilles sont bousculées dans un mélange de saveurs incroyables. A chaque fois, nous revenons inlassables."
48,Marion L,marionlL3100PR,23 février 2019,Excellentissisme,5.0,couples,1,Le meilleur japonais personnellement ! Les sushi spéciaux sont une tuerie ! Et en plus il y a les conseils du chef !! Très bon a refaire
49,Gama1801,Gama1801,14 février 2019,Les meilleurs sushis de lyon,5.0,couples,5,"Certe le prix est un peu cher pour des sushis mais ça vaut la qualité, c'est un délice ! 
La décoration est très jolie parfait pour une soirée en amoureux."
50,Tania et Damien t,taniaetdamient,14 février 2019,Excellent!,5.0,couples,55,"Très très bon restaurant, nous avons été ravis! Les morceaux de poisson ultra frais et généreux. Les meilleurs sushis que j'ai jamais mangés! Le service est charmant et discret, les conseils du chef précieux. Je recommande vivement !!!"
51,mass74fr,mass74fr,8 janvier 2019,Bel accueil et jolie lieu,4.0,family,97,"L'accueil était très sympathique, au dessus de nous avions une rivière d'étoiles, magnifique. Le midi c'est menu à 24 euros, trois choix sushi, maki et saumon, thon cuit, avec une salade de saumon très bonne en entrée et du riz et soupe miso pour accompagné le plat principal. 
Très bon, les meilleurs california rolls qu'elle a mangé, pour ma fille. 
Le chef vient vous parler des mets, et comment les manger. 
Maintenant cela reste quand même chère pour la quantité."
52,Jean-Philippe F,jphfejoz,30 novembre 2018,Le must des sushis,5.0,business,42,"Quelle fraîcheur cette salade en entrée, les maki, sushi et autres sont excellents, le meilleur japonais à Lyon. Un vrai restaurant de sushi. "
53,MelleEmma,MelleEmma,29 novembre 2018,WOUA!,5.0,friends,15,"Nous avons très bien mangé, menu pour 2 copieux! Poisson ultra frais, c'est d'ailleurs à cette occasion que j'ai découvert le poulpe, depuis j'adore! Bon accueil, endroit convivial, déco particulière! Prix en conséquence mais repas de qualité. De la concurrence dans le quartier mais jamais égalé! Je recommande (j'ai faim rien que d'y penser!!)"
54,Dom L,821doml,25 novembre 2018,Très bon !,5.0,couples,3,"Très bon et fait maison,
Seul bémol, qui en est la conséquence, c'est que le service est un peu long"
55,mattouille,mattouille,22 novembre 2018,Un délice !,5.0,family,9,"Pour les amateurs de sushis, ce restaurant est la meilleure adresse de Lyon ! 

Nous y sommes allés à 3 reprises et à chaque fois, c était un régal. 

L hôte de ces lieux vous accueil chaleureusement et vous explique comment manger les sushis. Le poissons est frais et les sushis sont excellents. 

Une merveille "
56,julien g,juliengC1399LV,18 novembre 2018,Le restaurant japonais par excellence sur Lyon,5.0,couples,30,"2eme fois 
2eme réussite !
Surpris encore par la fraîcheur, la finesse des sushis ...... Ils fondent littéralement en bouche 
J'ai pourtant l'habitude de manger ""japonais"" mais là c'est vraiment très bon.
Les Menus sont bien expliqués , il y en a pour tous les goûts .
Les desserts sont très bons également .
Nous conseillons d'y aller en soirée , c'est beaucoup plus joli avec les éclairages tamisés et toutes ces petites lumières accrochées à des branches suspendues au plafond .
Nous recommandons."
57,69marco69,69marco69,12 novembre 2018,Raffinement,5.0,couples,212,"Certes ce n'est pas un restaurant japonais pour petits budgets.
Mais vous aurez l'occasion de découvrir des sushis comme nulle part ailleurs à Lyon . Anguille, poulpe, thon aux 2 cuissons, ainsi que tous les autres Sushis et sashimis traditionnels. 
Température excellents de légèreté et en dessert glace au sésame noir.
Le tout accompagné par un excellent saké que vous aurez choisi parmi les 12 ou 15 variétés qui vous sont toutes décrites individuellement.
Conclusion : une adresse inévitable pour les amateurs "
58,Pénélope w,p_n_lopew,23 octobre 2018,Des sushis oui mais de luxe,5.0,friends,56,"En la matière on voit de tout mais ici c’est le chef coréen et son personnel au petit soins qui vous font découvrir le poisson sous toutes ses facettes cru cuit en brochette en sushi en takimune ambiance rétro et un service très attentionné 
On peut s’y rendre en famille aussi"
59,Pierre V,pierrev883,19 octobre 2018,Le sushi a Lyon...c’est le Wasabi,5.0,couples,132,"Nous y étions en octobre 2018.

De l’extérieur, l’endroit ne paye pas de mine, rue d’Anvers une petite rue qui donne sur la rue de l’Université.
Poussez la porte, vous entrez dans une salle pas très grande mais où règne une douce lumière avec des myriades de petites ampoules, une musique d’ambiance calme et reposante.
Une partie de la salle est légèrement surélevée.
Au fond c’est la cuisine ou l’on voit « officier » le chef Kim qui prépare des Sushis exceptionnels.
Les menus sont composés d’une salade garnie de saumon, de beignets de crevettes, d’un grand plat de sushis et d’un dessert.
Selon le menu choisi la quantité et la variété de sushis est différente.
Le serveur ou le chef Kim lui-même vous expliquerons comment et dans quel ordre les déguster.

Nous avons passé une soirée au calme, reposante et nous avons dégusté des sushis excellent que nous avons précédés par un whisky japonais bien sûr.

Les sushis sont à la hauteur, l’addition aussi.
Les menus sont entre 32€ et 64€ le soir, mais sont moins cher à midi.

Un incontournable à Lyon."
60,theza2016,theza2016,5 octobre 2018,Très sympa,4.0,couples,109,"Un peu petit mais très sympa.Accueil chaleureux et les recommandations sont parfaites. Le saumon est à tomber. En salade comme en brochette
Idéal pour les amoureux. Accessible en transport en commun. Prix intermédiaires
Produits frais et de qualité
On recommande +++"
61,Julien.,666JC666,28 septembre 2018,Il n'y a pas mieux.,5.0,friends,231,"Un régal sans toujours renouvelé. Le chef vient à table pour vous expliquer comment déguster les plats qu'il vous a préparé. Les sushis et sashimis sont subtiles et raffinés, ils fondent dans la bouche, le wazabi vous réveille pour ne pas oublier que vous ne rêvés pas."
62,Fabien A,fabiena804,14 septembre 2018,Extra,5.0,couples,6,Nous sommes des habitués de longue date. C'est toujours un plaisirs de déguster le menu Wasabi de maitre Kim. Seul ombre au tableau le prix ne cesse de grimper. C'est le meilleur Sushi de la région.
63,Leanie69,Leanie69,16 août 2018,Remarquables saveurs japonaises,5.0,couples,145,"Menu Bulgogi exceptionnel (sur commande) En entrée salade de roquette et feuilles de betterave, saumon mariné et sauce soja sésame (?), suivi d’une soupe Miso, le plat de viande marinée dans une sauce maison (+ riz nature). La portion est copieuse. En dessert la glace au sésame noir servie avec son croquant est remarquable ! Les poissons grillés sont plus anodins."
64,Cleolis,Cleolis,8 août 2018,Un vrai restau japonais,5.0,friends,6,"Le Japon! Super bon raffiné, copieux et tout ceci dans une serreinité remarquable. Très bonne expérience, à refaire!
Allez en prenant le temps... un vraiment moment de dépaysement .
Tout est frais, fais à la main par le chef KIM. Toute l’équipe est japonaise et converse mal en Français mais ce qu’il faut pour se faire totalement comprendre. (J’ai des allergies donc important) un super services et des super assiettes! Merci!"
